train,stations
0,"[Deventer, Apeldoorn, Zutphen, Deventer, Zutphen, Dieren, Arnhem Centraal, Dieren, Arnhem Centraal, Ede-Wageningen]"
1,"[]"
2,"[Zaandam, Amsterdam Sloterdijk, Amsterdam Centraal, Amsterdam Amstel, Amsterdam Centraal, Amsterdam Amstel, Amsterdam Zuid, Amsterdam Sloterdijk, Zaandam, Amsterdam Sloterdijk, Amsterdam Centraal]"
3,"[Deventer, Apeldoorn, Amersfoort, Apeldoorn, Deventer, Zwolle, Almelo, Deventer, Zutphen, Dieren]"
4,"[Etten-Leur, Roosendaal, Dordrecht, Breda, Etten-Leur, Roosendaal, Etten-Leur, Breda, Tilburg, s-Hertogenbosch, Eindhoven]"
5,"[Dordrecht, Rotterdam Blaak, Rotterdam Alexander, Gouda, Rotterdam Alexander, Rotterdam Blaak, Rotterdam Alexander, Rotterdam Centraal, Schiedam Centrum, Rotterdam Blaak, Dordrecht, Rotterdam Blaak, Rotterdam Alexander, Gouda]"
6,"[Castricum, Zaandam, Amsterdam Sloterdijk, Zaandam, Beverwijk, Haarlem, Amsterdam Sloterdijk, Zaandam, Amsterdam Sloterdijk, Amsterdam Centraal, Amsterdam Amstel, Amsterdam Centraal, Amsterdam Amstel, Amsterdam Centraal, Amsterdam Amstel, Amsterdam Centraal]"
7,"[Den Haag HS, Leiden Centraal, Den Haag Laan v NOI, Leiden Centraal, Heemstede-Aerdenhout, Haarlem, Heemstede-Aerdenhout, Haarlem, Beverwijk, Castricum, Alkmaar, Castricum, Alkmaar, Castricum, Alkmaar, Den Helder]"
8,"[Arnhem Centraal, Ede-Wageningen, Arnhem Centraal, Nijmegen, Oss, s-Hertogenbosch]"
9,"[Almelo, Hengelo, Enschede, Hengelo, Enschede, Hengelo, Almelo, Hengelo]"
10,"[Sittard]"
11,"[]"
12,"[Amsterdam Sloterdijk, Zaandam, Amsterdam Sloterdijk, Amsterdam Centraal, Almere Centrum, Lelystad Centrum, Almere Centrum, Hilversum]"
13,"[Leiden Centraal]"
14,"[Den Haag HS, Leiden Centraal, Schiphol Airport, Amsterdam Zuid, Amsterdam Amstel, Amsterdam Zuid, Schiphol Airport, Leiden Centraal, Den Haag HS, Delft, Schiedam Centrum, Rotterdam Centraal, Dordrecht, Rotterdam Blaak]"
15,"[Almere Centrum, Amsterdam Amstel, Amsterdam Centraal, Amsterdam Amstel, Amsterdam Zuid, Amsterdam Sloterdijk, Haarlem, Heemstede-Aerdenhout, Haarlem, Heemstede-Aerdenhout]"
16,"[Den Haag Laan v NOI, Leiden Centraal, Alphen a/d Rijn, Gouda, Den Haag Laan v NOI]"
17,"[]"
18,"[Schiedam Centrum, Rotterdam Centraal, Schiedam Centrum, Rotterdam Centraal, Rotterdam Alexander, Gouda, Den Haag HS, Leiden Centraal, Heemstede-Aerdenhout, Haarlem, Beverwijk]"
19,"[Eindhoven, Weert, Roermond, Weert, Eindhoven, s-Hertogenbosch, Eindhoven, s-Hertogenbosch, Eindhoven, Helmond, Venlo]"
score,4141.0
connections missing,[['Leeuwarden': 'Heerenveen']: ['Leeuwarden': 'Groningen']: ['Roosendaal': 'Vlissingen']]