train,stations
0,"[Etten-Leur, Roosendaal, Dordrecht]"
1,"[Delft, Den Haag Centraal, Leiden Centraal, Den Haag Centraal, Leiden Centraal, Heemstede-Aerdenhout, Leiden Centraal, Den Haag Laan v NOI, Leiden Centraal, Den Haag Laan v NOI, Delft, Den Haag Centraal]"
2,"[Roermond, Weert, Roermond, Weert, Eindhoven, Helmond, Eindhoven, s-Hertogenbosch]"
3,"[Beverwijk, Castricum, Alkmaar, Castricum, Alkmaar, Castricum, Alkmaar, Castricum, Zaandam, Amsterdam Sloterdijk]"
4,"[Zutphen, Dieren, Zutphen, Dieren, Arnhem Centraal, Nijmegen, Arnhem Centraal, Ede-Wageningen, Utrecht Centraal, Hilversum, Almere Centrum]"
5,"[Leiden Centraal, Heemstede-Aerdenhout, Haarlem, Heemstede-Aerdenhout, Haarlem, Amsterdam Sloterdijk, Zaandam, Amsterdam Sloterdijk, Amsterdam Centraal, Amsterdam Sloterdijk, Haarlem, Beverwijk, Haarlem]"
6,"[Haarlem, Amsterdam Sloterdijk, Haarlem, Heemstede-Aerdenhout]"
7,"[Zwolle, Amersfoort, Apeldoorn, Deventer, Almelo, Hengelo]"
8,"[Helmond, Eindhoven, Helmond, Venlo, Helmond, Eindhoven, Tilburg, s-Hertogenbosch]"
9,"[Steenwijk, Heerenveen, Steenwijk, Heerenveen, Leeuwarden, Heerenveen, Steenwijk, Zwolle]"
10,"[Rotterdam Alexander, Rotterdam Centraal, Dordrecht, Rotterdam Blaak, Rotterdam Alexander, Gouda, Utrecht Centraal, Alphen a/d Rijn, Gouda]"
11,"[Amsterdam Zuid, Amsterdam Amstel, Utrecht Centraal, Schiphol Airport, Amsterdam Zuid, Schiphol Airport, Leiden Centraal, Schiphol Airport, Amsterdam Zuid, Schiphol Airport, Amsterdam Zuid, Schiphol Airport]"
12,"[Beverwijk, Castricum, Alkmaar, Hoorn, Zaandam, Castricum, Alkmaar, Castricum, Zaandam, Amsterdam Sloterdijk, Zaandam]"
13,"[Alkmaar, Castricum, Alkmaar, Castricum, Alkmaar, Den Helder]"
14,"[Rotterdam Centraal, Schiedam Centrum, Rotterdam Centraal, Schiedam Centrum, Rotterdam Blaak, Dordrecht, Rotterdam Centraal, Schiedam Centrum, Delft, Den Haag HS, Leiden Centraal, Schiphol Airport, Leiden Centraal]"
15,"[Amsterdam Zuid, Schiphol Airport, Amsterdam Zuid, Schiphol Airport, Leiden Centraal, Alphen a/d Rijn, Gouda, Utrecht Centraal, Amsterdam Centraal, Amsterdam Amstel, Amsterdam Centraal, Amsterdam Sloterdijk]"
16,"[s-Hertogenbosch, Utrecht Centraal, Amsterdam Centraal, Almere Centrum, Amsterdam Amstel, Amsterdam Centraal]"
score,4306.51724137931
connections missing,[['Assen': 'Zwolle']: ['Breda': 'Etten-Leur']: ['Hengelo': 'Enschede']: ['Maastricht': 'Sittard']: ['Roosendaal': 'Vlissingen']: ['Sittard': 'Heerlen']: ['Sittard': 'Roermond']: ['Zwolle': 'Deventer']: ['Zwolle': 'Almelo']]