train,stations
0,"[Rotterdam Alexander, Rotterdam Centraal, Rotterdam Alexander, Rotterdam Centraal, Schiedam Centrum, Rotterdam Centraal, Schiedam Centrum, Rotterdam Blaak]"
1,"[Den Haag Centraal, Leiden Centraal, Schiphol Airport, Amsterdam Zuid, Amsterdam Sloterdijk, Haarlem, Amsterdam Sloterdijk, Amsterdam Centraal, Amsterdam Amstel, Amsterdam Centraal, Almere Centrum, Amsterdam Amstel, Amsterdam Centraal, Amsterdam Sloterdijk, Zaandam]"
2,"[Alphen a/d Rijn, Utrecht Centraal, Ede-Wageningen]"
3,"[Rotterdam Alexander, Rotterdam Blaak, Schiedam Centrum, Rotterdam Blaak, Rotterdam Alexander, Rotterdam Centraal, Schiedam Centrum, Delft, Schiedam Centrum, Rotterdam Blaak, Rotterdam Alexander, Rotterdam Centraal]"
4,"[Deventer, Zutphen, Deventer, Zwolle, Steenwijk, Heerenveen, Leeuwarden]"
5,"[Utrecht Centraal, Amersfoort, Apeldoorn, Deventer, Apeldoorn, Zutphen, Deventer]"
7,"[Breda, Etten-Leur, Breda, Etten-Leur, Breda, Etten-Leur, Breda, Etten-Leur, Breda, Etten-Leur]"
8,"[Amsterdam Centraal, Amsterdam Sloterdijk, Amsterdam Centraal, Utrecht Centraal]"
9,"[Rotterdam Centraal, Schiedam Centrum, Rotterdam Blaak, Rotterdam Alexander, Rotterdam Blaak, Schiedam Centrum, Delft, Den Haag Laan v NOI, Delft, Den Haag HS]"
10,"[Haarlem, Beverwijk, Haarlem, Heemstede-Aerdenhout, Leiden Centraal, Alphen a/d Rijn, Gouda, Den Haag HS, Leiden Centraal, Den Haag Laan v NOI, Leiden Centraal]"
11,"[Utrecht Centraal, Schiphol Airport, Amsterdam Zuid, Amsterdam Sloterdijk, Amsterdam Zuid, Amsterdam Amstel, Amsterdam Centraal]"
12,"[Breda, Tilburg]"
13,"[Weert, Roermond, Sittard, Roermond, Sittard, Roermond, Weert, Eindhoven]"
14,"[Sittard, Heerlen, Sittard, Maastricht, Sittard, Maastricht, Sittard]"
15,"[Schiedam Centrum, Rotterdam Blaak, Dordrecht, Breda, Dordrecht, Rotterdam Blaak, Schiedam Centrum, Rotterdam Blaak, Rotterdam Alexander, Rotterdam Centraal, Schiedam Centrum, Rotterdam Centraal, Schiedam Centrum, Delft]"
score,3923.8876404494376
connections missing,[['Alkmaar': 'Hoorn']: ['Alkmaar': 'Den Helder']: ['Almere Centrum': 'Lelystad Centrum']: ['Assen': 'Zwolle']: ['Beverwijk': 'Castricum']: ['Castricum': 'Alkmaar']: ['Eindhoven': 's-Hertogenbosch']: ['Eindhoven': 'Tilburg']: ['Helmond': 'Venlo']: ['Nijmegen': 'Arnhem Centraal']: ['Oss': 'Nijmegen']: ['Roosendaal': 'Vlissingen']: ['Zaandam': 'Hoorn']: ['Zaandam': 'Castricum']: ['Zaandam': 'Beverwijk']: ['Zwolle': 'Amersfoort']: ['Zwolle': 'Almelo']]