train,stations
0,"[Rotterdam Blaak, Schiedam Centrum, Rotterdam Blaak, Dordrecht, Rotterdam Centraal, Schiedam Centrum, Rotterdam Centraal, Rotterdam Alexander, Gouda, Den Haag Laan v NOI, Leiden Centraal, Den Haag Laan v NOI]"
1,"[Helmond, Eindhoven, s-Hertogenbosch, Eindhoven, s-Hertogenbosch, Eindhoven]"
2,"[Castricum, Alkmaar, Hoorn, Zaandam, Castricum, Beverwijk, Haarlem, Amsterdam Sloterdijk, Zaandam, Amsterdam Sloterdijk]"
3,"[Hengelo, Enschede, Hengelo, Enschede, Hengelo, Almelo, Hengelo, Enschede, Hengelo, Enschede, Hengelo, Enschede, Hengelo, Enschede, Hengelo, Enschede, Hengelo, Enschede, Hengelo, Almelo]"
4,"[Nijmegen, Arnhem Centraal, Ede-Wageningen, Utrecht Centraal, Gouda, Rotterdam Alexander, Gouda, Den Haag Laan v NOI, Leiden Centraal, Heemstede-Aerdenhout, Haarlem, Heemstede-Aerdenhout, Haarlem, Amsterdam Sloterdijk]"
5,"[Vlissingen, Roosendaal, Dordrecht, Roosendaal, Etten-Leur, Roosendaal, Etten-Leur, Breda]"
6,"[Almere Centrum, Amsterdam Centraal, Utrecht Centraal, Schiphol Airport, Amsterdam Zuid, Amsterdam Amstel]"
7,"[Apeldoorn, Amersfoort, Utrecht Centraal, Hilversum, Amsterdam Amstel, Almere Centrum]"
8,"[Amersfoort, Zwolle, Steenwijk, Heerenveen, Leeuwarden, Heerenveen, Steenwijk]"
9,"[Dordrecht, Rotterdam Blaak, Schiedam Centrum, Delft, Den Haag HS, Leiden Centraal, Alphen a/d Rijn, Leiden Centraal, Schiphol Airport, Amsterdam Zuid, Schiphol Airport, Leiden Centraal]"
10,"[Helmond, Eindhoven, Weert, Roermond, Weert, Eindhoven, Weert, Roermond, Sittard, Maastricht, Sittard, Heerlen, Sittard]"
11,"[Gouda, Den Haag Laan v NOI, Delft, Den Haag Centraal, Leiden Centraal, Alphen a/d Rijn, Gouda, Rotterdam Alexander, Gouda, Rotterdam Alexander, Rotterdam Blaak]"
12,"[Deventer, Apeldoorn, Zutphen, Deventer, Zutphen, Apeldoorn, Zutphen, Dieren, Zutphen, Dieren, Arnhem Centraal, Dieren]"
13,"[Amsterdam Sloterdijk, Zaandam, Beverwijk, Haarlem, Heemstede-Aerdenhout, Haarlem, Amsterdam Sloterdijk, Amsterdam Centraal, Amsterdam Sloterdijk, Zaandam]"
14,"[Enschede, Hengelo, Enschede, Hengelo, Almelo, Zwolle, Almelo, Deventer, Almelo, Hengelo]"
15,"[Amsterdam Sloterdijk, Amsterdam Zuid, Amsterdam Amstel, Utrecht Centraal, s-Hertogenbosch, Tilburg]"
16,"[Lelystad Centrum, Almere Centrum, Amsterdam Amstel, Amsterdam Centraal, Almere Centrum, Amsterdam Amstel, Amsterdam Centraal, Amsterdam Sloterdijk, Amsterdam Centraal]"
17,"[Eindhoven, s-Hertogenbosch, Tilburg, s-Hertogenbosch, Utrecht Centraal, Schiphol Airport]"
18,"[Oss, Nijmegen, Oss, s-Hertogenbosch, Oss, s-Hertogenbosch, Eindhoven, Tilburg, Breda, Dordrecht, Rotterdam Centraal, Schiedam Centrum]"
score,4354.229885057472
connections missing,[['Alkmaar': 'Den Helder']: ['Assen': 'Zwolle']: ['Utrecht Centraal': 'Alphen a/d Rijn']: ['Zwolle': 'Deventer']]