train,stations
0,"[Leiden Centraal, Den Haag Centraal, Gouda, Den Haag Centraal, Delft, Den Haag HS, Delft, Den Haag HS, Delft, Den Haag HS, Leiden Centraal, Den Haag Laan v NOI, Leiden Centraal, Den Haag HS, Gouda]"
1,"[Utrecht Centraal, Amersfoort, Apeldoorn, Zutphen, Deventer, Almelo]"
2,"[Leiden Centraal, Den Haag Centraal, Leiden Centraal, Alphen a/d Rijn, Utrecht Centraal, Ede-Wageningen, Utrecht Centraal]"
3,"[Heerenveen, Steenwijk, Zwolle, Almelo, Hengelo, Enschede, Hengelo, Enschede, Hengelo, Enschede, Hengelo]"
4,"[Gouda, Rotterdam Alexander, Gouda, Rotterdam Alexander, Gouda, Rotterdam Alexander, Rotterdam Blaak, Schiedam Centrum, Delft]"
5,"[Weert, Roermond, Sittard, Maastricht, Sittard]"
6,"[Rotterdam Alexander, Gouda, Rotterdam Alexander, Rotterdam Centraal, Schiedam Centrum, Rotterdam Centraal, Dordrecht, Roosendaal, Etten-Leur, Breda, Etten-Leur]"
7,"[Amsterdam Zuid, Amsterdam Sloterdijk, Zaandam, Castricum, Beverwijk, Castricum]"
8,"[Zutphen, Dieren, Arnhem Centraal, Dieren, Arnhem Centraal, Dieren, Arnhem Centraal, Ede-Wageningen, Utrecht Centraal, Amsterdam Amstel]"
9,"[Amsterdam Amstel, Amsterdam Zuid, Schiphol Airport, Leiden Centraal, Den Haag Laan v NOI, Delft, Den Haag Centraal, Leiden Centraal, Heemstede-Aerdenhout, Haarlem, Heemstede-Aerdenhout, Haarlem, Heemstede-Aerdenhout, Leiden Centraal, Den Haag Centraal, Delft]"
10,"[Arnhem Centraal, Nijmegen, Arnhem Centraal, Nijmegen, Arnhem Centraal, Ede-Wageningen, Arnhem Centraal, Nijmegen, Oss]"
11,"[Lelystad Centrum, Almere Centrum, Amsterdam Centraal, Amsterdam Amstel, Amsterdam Centraal, Amsterdam Sloterdijk, Haarlem, Amsterdam Sloterdijk, Haarlem, Beverwijk, Zaandam, Amsterdam Sloterdijk]"
12,"[Zwolle, Amersfoort]"
score,4354.52808988764
connections missing,[['Alkmaar': 'Hoorn']: ['Amsterdam Amstel': 'Almere Centrum']: ['Breda': 'Dordrecht']: ['Dordrecht': 'Rotterdam Blaak']: ['Eindhoven': 'Helmond']: ['Eindhoven': 'Tilburg']: ['Gouda': 'Alphen a/d Rijn']: ['Groningen': 'Assen']: ['Helmond': 'Venlo']: ['Hilversum': 'Almere Centrum']: ['Leeuwarden': 'Heerenveen']: ['Leeuwarden': 'Groningen']: ['Roosendaal': 'Vlissingen']: ['Utrecht Centraal': 'Amsterdam Centraal']: ['Utrecht Centraal': 'Schiphol Airport']: ['Utrecht Centraal': 's-Hertogenbosch']: ['Weert': 'Eindhoven']: ['Zaandam': 'Hoorn']]