train,stations
0,"[Amsterdam Zuid, Amsterdam Amstel, Utrecht Centraal, Alphen a/d Rijn, Gouda, Den Haag Laan v NOI, Leiden Centraal, Den Haag Laan v NOI, Delft, Schiedam Centrum, Rotterdam Centraal, Schiedam Centrum, Rotterdam Centraal, Schiedam Centrum]"
1,"[Rotterdam Centraal, Rotterdam Alexander, Rotterdam Blaak, Dordrecht, Breda, Etten-Leur, Roosendaal, Etten-Leur, Roosendaal]"
2,"[Ede-Wageningen, Arnhem Centraal, Nijmegen, Oss, Nijmegen, Arnhem Centraal, Nijmegen, Arnhem Centraal, Dieren, Zutphen]"
3,"[Beverwijk, Haarlem, Amsterdam Sloterdijk, Amsterdam Centraal, Almere Centrum, Lelystad Centrum]"
4,"[Eindhoven, Helmond, Eindhoven, s-Hertogenbosch, Eindhoven, Weert, Eindhoven, Weert, Roermond, Sittard]"
5,"[Amsterdam Centraal, Almere Centrum, Lelystad Centrum]"
6,"[Leeuwarden, Groningen, Assen, Zwolle]"
7,"[Hoorn, Alkmaar, Castricum, Beverwijk, Haarlem, Heemstede-Aerdenhout, Leiden Centraal, Den Haag Laan v NOI, Delft, Den Haag Laan v NOI, Leiden Centraal]"
8,"[Ede-Wageningen, Arnhem Centraal, Ede-Wageningen, Utrecht Centraal, Amsterdam Centraal, Amsterdam Amstel]"
9,"[Den Haag HS, Delft, Den Haag HS, Delft, Schiedam Centrum, Delft, Den Haag HS, Leiden Centraal, Alphen a/d Rijn, Gouda, Den Haag HS, Delft, Den Haag HS, Delft, Den Haag HS]"
10,"[Utrecht Centraal, Amersfoort, Apeldoorn, Deventer, Apeldoorn, Deventer]"
11,"[Utrecht Centraal, Gouda, Den Haag Centraal, Gouda, Rotterdam Alexander, Rotterdam Blaak, Dordrecht, Rotterdam Blaak]"
12,"[Dordrecht, Roosendaal, Etten-Leur, Breda, Dordrecht, Roosendaal, Etten-Leur, Roosendaal, Etten-Leur]"
13,"[Amsterdam Centraal, Utrecht Centraal, s-Hertogenbosch, Tilburg, Breda, Dordrecht, Rotterdam Centraal, Rotterdam Alexander, Rotterdam Blaak, Rotterdam Alexander]"
14,"[Schiphol Airport, Amsterdam Zuid, Amsterdam Sloterdijk, Zaandam, Beverwijk, Castricum, Beverwijk, Castricum, Zaandam]"
score,4311.966292134832
connections missing,[['Alkmaar': 'Den Helder']: ['Almelo': 'Hengelo']: ['Deventer': 'Almelo']: ['Eindhoven': 'Tilburg']: ['Helmond': 'Venlo']: ['Hengelo': 'Enschede']: ['Hilversum': 'Almere Centrum']: ['Leiden Centraal': 'Schiphol Airport']: ['Maastricht': 'Sittard']: ['Sittard': 'Heerlen']: ['Zaandam': 'Hoorn']: ['Zwolle': 'Deventer']: ['Zwolle': 'Almelo']: ['s-Hertogenbosch': 'Oss']]