train,stations
0,"[Amsterdam Zuid, Schiphol Airport, Leiden Centraal, Alphen a/d Rijn, Leiden Centraal, Den Haag Centraal, Leiden Centraal, Den Haag Laan v NOI, Leiden Centraal]"
1,"[Venlo, Helmond, Eindhoven, Weert, Roermond, Weert, Roermond, Weert, Eindhoven, Weert]"
2,"[Schiphol Airport, Amsterdam Zuid, Schiphol Airport, Amsterdam Zuid, Amsterdam Sloterdijk, Zaandam, Castricum, Zaandam, Amsterdam Sloterdijk, Haarlem, Beverwijk]"
3,"[Amsterdam Sloterdijk, Haarlem, Heemstede-Aerdenhout, Leiden Centraal, Den Haag Centraal, Gouda, Alphen a/d Rijn, Utrecht Centraal, Amsterdam Centraal, Amsterdam Sloterdijk, Haarlem, Heemstede-Aerdenhout]"
4,"[Amsterdam Sloterdijk, Zaandam, Beverwijk, Castricum, Zaandam, Hoorn, Alkmaar, Castricum, Beverwijk]"
5,"[Oss, Nijmegen, Arnhem Centraal, Ede-Wageningen, Arnhem Centraal, Nijmegen]"
6,"[Breda, Tilburg, Eindhoven, Weert, Eindhoven, s-Hertogenbosch, Eindhoven, s-Hertogenbosch, Oss, s-Hertogenbosch]"
7,"[Utrecht Centraal, Gouda, Rotterdam Alexander, Rotterdam Blaak, Rotterdam Alexander, Rotterdam Blaak, Rotterdam Alexander, Rotterdam Centraal, Rotterdam Alexander, Rotterdam Blaak, Schiedam Centrum, Rotterdam Blaak]"
8,"[Steenwijk, Zwolle, Almelo, Deventer]"
9,"[Amsterdam Sloterdijk, Amsterdam Centraal, Amsterdam Amstel, Amsterdam Zuid, Amsterdam Sloterdijk, Haarlem, Heemstede-Aerdenhout, Haarlem, Amsterdam Sloterdijk, Amsterdam Zuid]"
10,"[Utrecht Centraal, s-Hertogenbosch, Tilburg, Breda, Etten-Leur, Roosendaal, Dordrecht, Rotterdam Centraal, Schiedam Centrum, Rotterdam Centraal, Schiedam Centrum, Rotterdam Blaak, Schiedam Centrum, Rotterdam Blaak]"
11,"[Hilversum, Almere Centrum, Amsterdam Centraal, Amsterdam Amstel, Almere Centrum, Lelystad Centrum]"
12,"[Assen, Zwolle, Deventer, Zwolle, Deventer, Zutphen]"
13,"[Steenwijk, Heerenveen, Steenwijk, Heerenveen, Steenwijk, Heerenveen, Leeuwarden, Heerenveen, Steenwijk, Heerenveen]"
14,"[Rotterdam Alexander, Rotterdam Centraal, Dordrecht, Breda, Dordrecht, Rotterdam Centraal, Dordrecht, Roosendaal, Etten-Leur]"
15,"[Amsterdam Centraal, Amsterdam Amstel, Hilversum, Utrecht Centraal, Amsterdam Amstel, Utrecht Centraal]"
16,"[Delft, Den Haag Centraal, Gouda]"
17,"[Heerenveen, Leeuwarden, Heerenveen, Leeuwarden, Groningen, Leeuwarden, Heerenveen]"
18,"[Castricum, Alkmaar, Castricum, Beverwijk, Castricum, Beverwijk, Castricum]"
19,"[Amersfoort, Zwolle, Deventer, Apeldoorn, Deventer, Apeldoorn, Amersfoort, Utrecht Centraal]"
score,3687.123595505618
connections missing,[['Apeldoorn': 'Zutphen']: ['Delft': 'Den Haag HS']: ['Den Haag HS': 'Gouda']: ['Den Haag HS': 'Leiden Centraal']: ['Groningen': 'Assen']: ['Maastricht': 'Sittard']: ['Roosendaal': 'Vlissingen']: ['Sittard': 'Heerlen']]