train,stations
0,"[Den Haag Laan v NOI, Delft, Den Haag Centraal, Gouda, Alphen a/d Rijn]"
1,"[Amsterdam Sloterdijk, Amsterdam Centraal, Utrecht Centraal, Gouda, Utrecht Centraal, Hilversum]"
2,"[Heerlen, Sittard, Maastricht]"
3,"[Den Haag Centraal, Leiden Centraal, Schiphol Airport]"
4,"[Deventer, Zwolle, Almelo, Hengelo, Enschede, Hengelo, Enschede, Hengelo, Enschede, Hengelo]"
5,"[Den Haag HS, Delft, Schiedam Centrum, Rotterdam Blaak, Dordrecht, Roosendaal, Etten-Leur]"
6,"[Castricum, Zaandam, Amsterdam Sloterdijk, Amsterdam Centraal, Amsterdam Sloterdijk, Zaandam, Castricum, Alkmaar]"
7,"[Oss, s-Hertogenbosch, Tilburg, s-Hertogenbosch, Tilburg]"
8,"[Haarlem, Amsterdam Sloterdijk, Amsterdam Zuid, Schiphol Airport, Amsterdam Zuid, Schiphol Airport, Utrecht Centraal, Amersfoort]"
9,"[Amsterdam Zuid, Amsterdam Amstel, Amsterdam Centraal]"
10,"[Rotterdam Alexander, Rotterdam Centraal, Schiedam Centrum, Rotterdam Blaak, Dordrecht, Rotterdam Centraal, Rotterdam Alexander, Rotterdam Blaak]"
11,"[Dieren, Arnhem Centraal, Ede-Wageningen, Arnhem Centraal, Dieren, Zutphen, Dieren, Zutphen, Dieren, Arnhem Centraal, Nijmegen, Oss, Nijmegen, Arnhem Centraal, Nijmegen]"
12,"[Rotterdam Alexander, Gouda, Utrecht Centraal, s-Hertogenbosch, Tilburg, Eindhoven, Helmond, Eindhoven, Weert]"
score,4257.168539325843
connections missing,[['Alkmaar': 'Den Helder']: ['Amsterdam Centraal': 'Almere Centrum']: ['Apeldoorn': 'Amersfoort']: ['Apeldoorn': 'Zutphen']: ['Assen': 'Zwolle']: ['Den Haag HS': 'Gouda']: ['Den Haag HS': 'Leiden Centraal']: ['Den Haag Laan v NOI': 'Gouda']: ['Deventer': 'Apeldoorn']: ['Deventer': 'Almelo']: ['Groningen': 'Assen']: ['Heerenveen': 'Steenwijk']: ['Helmond': 'Venlo']: ['Leeuwarden': 'Heerenveen']: ['Leeuwarden': 'Groningen']: ['Roosendaal': 'Vlissingen']: ['Steenwijk': 'Zwolle']: ['Utrecht Centraal': 'Ede-Wageningen']: ['Zwolle': 'Amersfoort']]