train,stations
0,"[Den Helder, Alkmaar, Den Helder]"
1,"[Beverwijk, Zaandam, Amsterdam Sloterdijk, Zaandam]"
2,"[Den Haag Centraal, Delft, Schiedam Centrum, Delft, Den Haag Centraal, Leiden Centraal]"
3,"[Alphen a/d Rijn, Leiden Centraal, Schiphol Airport, Leiden Centraal, Heemstede-Aerdenhout, Haarlem, Amsterdam Sloterdijk, Amsterdam Centraal, Amsterdam Amstel, Amsterdam Zuid, Schiphol Airport, Amsterdam Zuid]"
4,"[Alphen a/d Rijn, Leiden Centraal, Den Haag Centraal, Delft, Den Haag Centraal, Delft, Schiedam Centrum, Delft, Schiedam Centrum]"
5,"[Rotterdam Centraal, Schiedam Centrum, Delft, Schiedam Centrum, Rotterdam Centraal, Schiedam Centrum, Delft]"
6,"[Rotterdam Centraal, Rotterdam Alexander, Rotterdam Centraal, Dordrecht, Rotterdam Centraal, Schiedam Centrum, Delft, Schiedam Centrum]"
score,3480.857142857143