train,stations
0,"[Den Haag Laan v NOI, Gouda, Utrecht Centraal, Ede-Wageningen, Arnhem Centraal, Ede-Wageningen, Utrecht Centraal, Gouda]"
1,"[Oss, Nijmegen, Oss, Nijmegen, Arnhem Centraal, Ede-Wageningen, Utrecht Centraal, Hilversum, Amsterdam Amstel, Amsterdam Zuid, Amsterdam Amstel]"
2,"[Steenwijk, Zwolle, Assen, Zwolle, Deventer, Almelo]"
3,"[Etten-Leur, Roosendaal, Etten-Leur, Breda, Dordrecht, Rotterdam Blaak, Rotterdam Alexander, Gouda, Rotterdam Alexander, Rotterdam Centraal, Schiedam Centrum, Delft]"
4,"[Eindhoven, Tilburg, Breda, Tilburg, Breda, Dordrecht, Rotterdam Centraal, Schiedam Centrum, Delft, Den Haag Laan v NOI]"
5,"[Apeldoorn, Amersfoort, Apeldoorn, Zutphen, Dieren, Arnhem Centraal, Ede-Wageningen, Arnhem Centraal, Nijmegen, Arnhem Centraal]"
6,"[Zaandam, Amsterdam Sloterdijk, Haarlem, Amsterdam Sloterdijk, Amsterdam Zuid, Amsterdam Amstel, Amsterdam Zuid, Amsterdam Amstel, Amsterdam Centraal, Amsterdam Amstel, Hilversum]"
7,"[Apeldoorn, Deventer, Zwolle, Amersfoort, Utrecht Centraal]"
8,"[Dieren, Zutphen, Apeldoorn, Zutphen, Deventer, Almelo, Hengelo, Almelo, Hengelo]"
9,"[Alkmaar]"
10,"[Venlo, Helmond, Eindhoven, Weert, Eindhoven, Tilburg, s-Hertogenbosch, Eindhoven, s-Hertogenbosch]"
11,"[Amsterdam Zuid, Amsterdam Amstel, Almere Centrum, Amsterdam Centraal, Utrecht Centraal, Ede-Wageningen]"
12,"[Heemstede-Aerdenhout, Leiden Centraal, Den Haag HS, Delft, Den Haag HS, Delft, Schiedam Centrum, Delft, Den Haag Laan v NOI, Leiden Centraal, Den Haag Centraal, Delft, Den Haag HS, Leiden Centraal]"
13,"[Heerenveen, Steenwijk, Heerenveen, Leeuwarden, Heerenveen, Steenwijk, Zwolle]"
14,"[Roermond, Weert, Roermond, Sittard, Maastricht, Sittard, Roermond, Sittard, Roermond, Sittard, Heerlen, Sittard, Maastricht]"
15,"[Rotterdam Blaak, Schiedam Centrum, Rotterdam Blaak, Dordrecht, Roosendaal, Dordrecht, Roosendaal, Etten-Leur, Breda, Etten-Leur, Breda]"
16,"[Heerenveen, Leeuwarden, Heerenveen, Leeuwarden, Heerenveen, Steenwijk]"
17,"[Amsterdam Centraal, Amsterdam Sloterdijk, Zaandam, Beverwijk, Haarlem, Heemstede-Aerdenhout, Haarlem, Amsterdam Sloterdijk, Haarlem, Amsterdam Sloterdijk, Zaandam, Beverwijk]"
score,3825.6321839080465
connections missing,[['Alkmaar': 'Den Helder']: ['Almere Centrum': 'Lelystad Centrum']: ['Den Haag Centraal': 'Gouda']: ['Den Haag HS': 'Gouda']: ['Hilversum': 'Almere Centrum']: ['Leiden Centraal': 'Schiphol Airport']: ['Leiden Centraal': 'Alphen a/d Rijn']: ['Roosendaal': 'Vlissingen']: ['Utrecht Centraal': 'Alphen a/d Rijn']: ['Utrecht Centraal': 's-Hertogenbosch']: ['Zwolle': 'Almelo']]