train,stations
0,"[Zwolle, Deventer, Zutphen, Apeldoorn, Amersfoort, Zwolle, Steenwijk, Zwolle]"
1,"[Leiden Centraal, Den Haag Laan v NOI, Delft, Schiedam Centrum, Rotterdam Centraal]"
2,"[Alphen a/d Rijn, Leiden Centraal, Schiphol Airport, Amsterdam Zuid, Schiphol Airport, Leiden Centraal, Den Haag HS, Delft, Schiedam Centrum, Rotterdam Centraal, Rotterdam Alexander, Rotterdam Blaak, Rotterdam Alexander, Gouda, Den Haag HS]"
3,"[Leeuwarden]"
4,"[Castricum, Zaandam, Beverwijk, Castricum, Zaandam, Castricum, Alkmaar]"
5,"[]"
6,"[Deventer, Zutphen, Dieren, Arnhem Centraal, Ede-Wageningen, Arnhem Centraal, Ede-Wageningen, Arnhem Centraal, Nijmegen, Oss]"
7,"[Amsterdam Amstel, Amsterdam Zuid, Amsterdam Sloterdijk, Zaandam, Amsterdam Sloterdijk, Amsterdam Centraal, Amsterdam Sloterdijk, Amsterdam Zuid, Amsterdam Sloterdijk, Zaandam, Castricum, Alkmaar, Castricum, Zaandam, Hoorn]"
8,"[Apeldoorn, Deventer, Zwolle, Almelo, Hengelo]"
9,"[Amsterdam Sloterdijk, Amsterdam Centraal, Amsterdam Amstel, Hilversum, Almere Centrum, Lelystad Centrum, Almere Centrum, Amsterdam Centraal, Amsterdam Sloterdijk, Amsterdam Centraal]"
10,"[Delft, Den Haag HS, Delft, Den Haag HS, Gouda, Den Haag Laan v NOI, Leiden Centraal, Den Haag HS, Delft, Den Haag HS, Delft, Den Haag HS]"
11,"[Alphen a/d Rijn, Gouda, Den Haag HS, Leiden Centraal, Heemstede-Aerdenhout, Haarlem, Beverwijk, Castricum, Alkmaar, Castricum]"
12,"[Rotterdam Centraal, Schiedam Centrum]"
score,4824.0
connections missing,[['Alkmaar': 'Den Helder']: ['Amsterdam Amstel': 'Almere Centrum']: ['Breda': 'Etten-Leur']: ['Dordrecht': 'Rotterdam Centraal']: ['Eindhoven': 'Helmond']: ['Etten-Leur': 'Roosendaal']: ['Helmond': 'Venlo']: ['Maastricht': 'Sittard']: ['Roosendaal': 'Vlissingen']: ['Roosendaal': 'Dordrecht']: ['Sittard': 'Heerlen']: ['Sittard': 'Roermond']: ['Weert': 'Eindhoven']]