train,stations
0,"[Schiedam Centrum, Delft, Den Haag HS, Delft, Schiedam Centrum, Rotterdam Blaak, Schiedam Centrum, Delft, Den Haag Centraal, Gouda, Rotterdam Alexander]"
1,"[Beverwijk, Castricum, Alkmaar, Castricum, Alkmaar, Castricum, Alkmaar, Castricum, Zaandam, Beverwijk, Zaandam, Amsterdam Sloterdijk]"
2,"[Hengelo, Enschede, Hengelo, Almelo, Hengelo, Almelo, Deventer, Zutphen, Apeldoorn, Deventer, Zwolle]"
3,"[Breda, Tilburg, s-Hertogenbosch, Oss, s-Hertogenbosch, Oss, Nijmegen]"
4,"[Oss, s-Hertogenbosch, Oss, Nijmegen, Arnhem Centraal, Ede-Wageningen, Arnhem Centraal, Dieren, Zutphen, Deventer]"
5,"[Schiedam Centrum, Delft, Den Haag Laan v NOI, Leiden Centraal, Den Haag Centraal, Leiden Centraal]"
6,"[Alphen a/d Rijn, Leiden Centraal, Den Haag Centraal, Leiden Centraal, Schiphol Airport, Amsterdam Zuid, Amsterdam Amstel, Almere Centrum, Hilversum, Amsterdam Amstel]"
7,"[Roermond, Weert, Roermond]"
8,"[Schiedam Centrum, Rotterdam Centraal, Rotterdam Alexander, Rotterdam Blaak, Dordrecht, Rotterdam Centraal, Rotterdam Alexander, Rotterdam Blaak, Dordrecht]"
9,"[Vlissingen, Roosendaal, Dordrecht, Breda, Etten-Leur, Roosendaal, Etten-Leur]"
10,"[Venlo, Helmond, Eindhoven, Helmond, Eindhoven, s-Hertogenbosch]"
11,"[Weert, Eindhoven, Tilburg, s-Hertogenbosch, Oss, Nijmegen]"
12,"[Zwolle]"
score,4664.0
connections missing,[['Alkmaar': 'Hoorn']: ['Alkmaar': 'Den Helder']: ['Almere Centrum': 'Lelystad Centrum']: ['Amsterdam Centraal': 'Almere Centrum']: ['Assen': 'Zwolle']: ['Den Haag HS': 'Gouda']: ['Den Haag HS': 'Leiden Centraal']: ['Den Haag Laan v NOI': 'Gouda']: ['Gouda': 'Alphen a/d Rijn']: ['Heemstede-Aerdenhout': 'Haarlem']: ['Leiden Centraal': 'Heemstede-Aerdenhout']: ['Sittard': 'Heerlen']: ['Zaandam': 'Hoorn']: ['Zwolle': 'Almelo']]