train,stations
0,"[Castricum, Beverwijk, Castricum, Zaandam, Amsterdam Sloterdijk, Zaandam, Beverwijk, Castricum, Alkmaar]"
1,"[Eindhoven, Weert, Eindhoven, Helmond, Venlo, Helmond, Eindhoven]"
2,"[Amsterdam Zuid, Schiphol Airport, Amsterdam Zuid, Amsterdam Amstel, Hilversum, Almere Centrum, Amsterdam Amstel, Amsterdam Centraal, Amsterdam Sloterdijk]"
3,"[Beverwijk, Haarlem, Heemstede-Aerdenhout, Leiden Centraal, Schiphol Airport, Amsterdam Zuid, Amsterdam Amstel, Almere Centrum, Amsterdam Amstel, Amsterdam Centraal]"
4,"[Hoorn, Zaandam, Amsterdam Sloterdijk, Amsterdam Zuid, Amsterdam Sloterdijk, Haarlem, Heemstede-Aerdenhout]"
5,"[Gouda, Den Haag Centraal, Leiden Centraal, Den Haag HS, Gouda, Den Haag Laan v NOI, Delft]"
6,"[Den Haag Centraal, Delft, Den Haag Centraal, Leiden Centraal, Den Haag Laan v NOI, Leiden Centraal, Den Haag Laan v NOI, Gouda, Rotterdam Alexander, Rotterdam Centraal]"
7,"[Arnhem Centraal, Dieren, Zutphen, Apeldoorn, Deventer, Apeldoorn, Deventer, Zutphen, Apeldoorn, Deventer, Apeldoorn, Zutphen]"
8,"[Rotterdam Alexander, Gouda, Rotterdam Alexander, Rotterdam Blaak, Dordrecht, Breda, Tilburg]"
9,"[Den Haag HS, Gouda, Alphen a/d Rijn, Gouda, Rotterdam Alexander, Gouda, Den Haag HS, Delft, Den Haag Centraal]"
10,"[Deventer, Apeldoorn, Amersfoort, Zwolle, Steenwijk, Heerenveen, Steenwijk, Heerenveen, Steenwijk, Heerenveen, Leeuwarden]"
11,"[Schiedam Centrum, Rotterdam Centraal, Dordrecht, Rotterdam Blaak, Rotterdam Alexander, Rotterdam Centraal, Rotterdam Alexander, Rotterdam Centraal, Schiedam Centrum, Delft, Den Haag Centraal, Leiden Centraal, Den Haag Laan v NOI, Delft, Den Haag Centraal]"
12,"[Heerlen, Sittard, Maastricht, Sittard, Roermond, Sittard]"
13,"[Dieren, Arnhem Centraal, Dieren, Arnhem Centraal, Dieren, Arnhem Centraal, Nijmegen, Oss, s-Hertogenbosch, Tilburg, Breda, Etten-Leur, Breda]"
14,"[Etten-Leur, Roosendaal, Dordrecht, Breda, Tilburg, Eindhoven, Helmond, Eindhoven, Helmond, Eindhoven]"
15,"[Schiphol Airport, Amsterdam Zuid, Schiphol Airport, Amsterdam Zuid, Amsterdam Sloterdijk, Amsterdam Centraal, Amsterdam Sloterdijk, Amsterdam Centraal, Amsterdam Amstel]"
16,"[Deventer, Zutphen, Dieren, Arnhem Centraal, Dieren, Arnhem Centraal, Ede-Wageningen]"
17,"[Hengelo, Almelo, Deventer, Apeldoorn, Deventer, Almelo, Zwolle, Deventer]"
score,4334.0
connections missing,[['Alkmaar': 'Den Helder']: ['Assen': 'Zwolle']: ['Groningen': 'Assen']: ['Hengelo': 'Enschede']: ['Leeuwarden': 'Groningen']: ['Roosendaal': 'Vlissingen']]