train,stations
2,"[Zaandam, Amsterdam Sloterdijk, Zaandam, Beverwijk, Haarlem, Beverwijk, Castricum, Beverwijk, Castricum, Alkmaar, Castricum, Zaandam, Amsterdam Sloterdijk]"
3,"[]"
4,"[Rotterdam Centraal, Schiedam Centrum, Rotterdam Centraal, Rotterdam Alexander, Gouda, Den Haag Laan v NOI, Leiden Centraal, Den Haag Centraal, Delft, Den Haag HS, Delft]"
5,"[Rotterdam Centraal, Schiedam Centrum]"
12,"[Utrecht Centraal, Amsterdam Amstel, Hilversum, Utrecht Centraal, s-Hertogenbosch, Eindhoven, s-Hertogenbosch, Oss]"
16,"[Delft, Schiedam Centrum, Rotterdam Centraal, Dordrecht, Rotterdam Blaak, Dordrecht, Rotterdam Blaak, Schiedam Centrum, Delft, Den Haag HS, Leiden Centraal, Den Haag Centraal, Delft, Den Haag HS]"
18,"[Gouda, Utrecht Centraal, Amersfoort, Apeldoorn, Deventer, Zutphen, Dieren, Arnhem Centraal, Ede-Wageningen, Utrecht Centraal, Alphen a/d Rijn, Gouda]"
20,"[Maastricht, Sittard, Heerlen, Sittard, Roermond, Weert, Eindhoven, Helmond, Eindhoven]"
25,"[Zutphen, Deventer, Zwolle, Assen, Groningen, Leeuwarden, Heerenveen]"
score,5281.808988764045
connections missing,[['Alkmaar': 'Hoorn']: ['Alkmaar': 'Den Helder']: ['Almelo': 'Hengelo']: ['Almere Centrum': 'Lelystad Centrum']: ['Amsterdam Centraal': 'Almere Centrum']: ['Apeldoorn': 'Zutphen']: ['Den Haag HS': 'Gouda']: ['Deventer': 'Almelo']: ['Eindhoven': 'Tilburg']: ['Etten-Leur': 'Roosendaal']: ['Hengelo': 'Enschede']: ['Hilversum': 'Almere Centrum']: ['Roosendaal': 'Vlissingen']: ['Roosendaal': 'Dordrecht']: ['Steenwijk': 'Zwolle']: ['Utrecht Centraal': 'Amsterdam Centraal']: ['Utrecht Centraal': 'Schiphol Airport']: ['Zaandam': 'Hoorn']: ['Zwolle': 'Amersfoort']: ['Zwolle': 'Almelo']]