train,stations
0,"[Zaandam, Amsterdam Sloterdijk, Zaandam, Castricum, Alkmaar, Hoorn, Zaandam, Beverwijk, Castricum, Alkmaar, Hoorn]"
1,"[Arnhem Centraal, Nijmegen, Oss, s-Hertogenbosch, Tilburg, Eindhoven, Helmond, Eindhoven, s-Hertogenbosch, Oss]"
2,"[Amsterdam Zuid, Schiphol Airport, Utrecht Centraal, Gouda, Alphen a/d Rijn, Leiden Centraal, Den Haag Centraal, Delft, Schiedam Centrum, Rotterdam Blaak, Schiedam Centrum, Rotterdam Blaak, Schiedam Centrum, Rotterdam Centraal]"
5,"[Rotterdam Centraal, Rotterdam Alexander, Rotterdam Blaak, Schiedam Centrum, Delft, Den Haag Centraal, Leiden Centraal, Heemstede-Aerdenhout, Leiden Centraal, Den Haag Laan v NOI]"
6,"[Groningen, Assen, Zwolle, Deventer, Zutphen, Deventer, Almelo, Hengelo, Enschede, Hengelo]"
7,"[Amsterdam Sloterdijk, Amsterdam Zuid, Amsterdam Amstel, Utrecht Centraal, Ede-Wageningen, Utrecht Centraal, Gouda]"
8,"[s-Hertogenbosch, Utrecht Centraal, Amersfoort, Apeldoorn, Deventer, Zwolle, Almelo, Hengelo, Enschede, Hengelo]"
9,"[Leiden Centraal, Den Haag Laan v NOI, Delft, Schiedam Centrum, Rotterdam Centraal, Schiedam Centrum, Rotterdam Blaak, Dordrecht]"
13,"[Schiedam Centrum, Delft, Schiedam Centrum, Rotterdam Blaak, Dordrecht, Roosendaal, Etten-Leur, Breda, Etten-Leur, Roosendaal, Dordrecht]"
19,"[Hilversum, Almere Centrum, Lelystad Centrum, Almere Centrum, Amsterdam Amstel, Amsterdam Zuid, Schiphol Airport, Leiden Centraal, Heemstede-Aerdenhout, Haarlem, Beverwijk]"
20,"[Haarlem, Heemstede-Aerdenhout, Haarlem, Amsterdam Sloterdijk, Amsterdam Centraal, Amsterdam Amstel, Amsterdam Zuid, Schiphol Airport, Amsterdam Zuid, Amsterdam Sloterdijk, Haarlem, Beverwijk]"
24,"[Rotterdam Blaak, Dordrecht, Rotterdam Centraal, Schiedam Centrum, Rotterdam Centraal, Schiedam Centrum, Rotterdam Blaak, Schiedam Centrum, Delft, Den Haag HS, Leiden Centraal, Den Haag Laan v NOI, Leiden Centraal]"
28,"[Helmond, Venlo, Helmond, Eindhoven, Weert, Roermond, Sittard, Heerlen, Sittard, Maastricht, Sittard]"
29,"[Leeuwarden, Heerenveen, Steenwijk, Zwolle, Amersfoort, Apeldoorn, Zutphen, Dieren]"
33,"[Beverwijk, Haarlem, Amsterdam Sloterdijk, Haarlem, Amsterdam Sloterdijk, Haarlem, Heemstede-Aerdenhout, Leiden Centraal, Den Haag Centraal, Gouda, Den Haag HS, Delft]"
34,"[Hilversum, Almere Centrum, Amsterdam Centraal, Amsterdam Amstel, Hilversum, Utrecht Centraal, Amsterdam Centraal, Utrecht Centraal, Hilversum]"
36,"[Zutphen, Dieren, Arnhem Centraal, Ede-Wageningen, Utrecht Centraal, Gouda, Alphen a/d Rijn, Utrecht Centraal]"
75,"[Groningen, Leeuwarden, Heerenveen]"
score,5251.2808988764045
connections missing,[['Alkmaar': 'Den Helder']: ['Roosendaal': 'Vlissingen']]