train,stations
2,"[Amsterdam Sloterdijk, Zaandam, Beverwijk, Haarlem, Beverwijk, Castricum, Beverwijk, Castricum, Alkmaar, Castricum, Zaandam, Amsterdam Sloterdijk, Zaandam]"
3,"[]"
4,"[Rotterdam Centraal, Rotterdam Alexander, Gouda, Den Haag Laan v NOI, Leiden Centraal, Den Haag Centraal]"
5,"[Schiedam Centrum, Rotterdam Centraal, Schiedam Centrum, Delft]"
12,"[Utrecht Centraal, Amsterdam Amstel, Hilversum, Utrecht Centraal, s-Hertogenbosch, Eindhoven, s-Hertogenbosch, Oss]"
16,"[Rotterdam Centraal, Schiedam Centrum, Rotterdam Centraal, Dordrecht, Rotterdam Blaak, Dordrecht, Rotterdam Blaak, Schiedam Centrum, Delft, Den Haag HS, Leiden Centraal, Den Haag Centraal, Delft, Den Haag HS]"
18,"[Utrecht Centraal, Amersfoort, Apeldoorn, Deventer, Zutphen, Dieren, Arnhem Centraal, Ede-Wageningen, Utrecht Centraal, Alphen a/d Rijn, Gouda, Utrecht Centraal]"
20,"[Maastricht, Sittard, Heerlen, Sittard, Roermond, Weert, Eindhoven]"
26,"[Groningen, Leeuwarden, Heerenveen, Steenwijk, Zwolle, Deventer, Almelo, Hengelo, Enschede]"
score,5479.52808988764
connections missing,[['Alkmaar': 'Hoorn']: ['Alkmaar': 'Den Helder']: ['Almere Centrum': 'Lelystad Centrum']: ['Amsterdam Centraal': 'Almere Centrum']: ['Apeldoorn': 'Zutphen']: ['Assen': 'Zwolle']: ['Den Haag HS': 'Gouda']: ['Etten-Leur': 'Roosendaal']: ['Groningen': 'Assen']: ['Helmond': 'Venlo']: ['Hilversum': 'Almere Centrum']: ['Roosendaal': 'Vlissingen']: ['Roosendaal': 'Dordrecht']: ['Utrecht Centraal': 'Amsterdam Centraal']: ['Utrecht Centraal': 'Schiphol Airport']: ['Zaandam': 'Hoorn']: ['Zwolle': 'Amersfoort']: ['Zwolle': 'Almelo']]