train,stations
0,"[Deventer, Zwolle, Amersfoort]"
1,"[Assen, Zwolle, Almelo, Hengelo, Enschede, Hengelo, Enschede, Hengelo, Enschede, Hengelo, Enschede]"
2,"[Leeuwarden, Heerenveen, Steenwijk, Zwolle, Almelo, Deventer, Apeldoorn, Zutphen, Deventer, Zutphen]"
3,"[Den Haag HS, Gouda, Utrecht Centraal, Amsterdam Amstel, Amsterdam Centraal, Amsterdam Sloterdijk, Amsterdam Centraal, Almere Centrum, Lelystad Centrum, Almere Centrum, Amsterdam Amstel, Amsterdam Centraal, Amsterdam Sloterdijk, Zaandam]"
4,"[Den Haag Centraal, Leiden Centraal, Alphen a/d Rijn, Gouda, Den Haag HS, Delft, Den Haag Laan v NOI, Leiden Centraal, Den Haag HS, Gouda, Rotterdam Alexander, Gouda, Rotterdam Alexander]"
5,"[Apeldoorn, Amersfoort, Apeldoorn, Amersfoort, Apeldoorn]"
6,"[Helmond, Eindhoven, s-Hertogenbosch, Utrecht Centraal, Amsterdam Amstel, Amsterdam Zuid]"
7,"[Zaandam, Amsterdam Sloterdijk, Amsterdam Zuid, Schiphol Airport, Leiden Centraal, Den Haag Laan v NOI, Delft, Den Haag HS, Leiden Centraal, Den Haag Centraal, Delft, Den Haag Laan v NOI, Gouda]"
8,"[Utrecht Centraal, Ede-Wageningen, Arnhem Centraal, Ede-Wageningen, Utrecht Centraal, Hilversum, Almere Centrum, Amsterdam Centraal]"
9,"[Castricum, Alkmaar, Castricum, Beverwijk, Zaandam, Hoorn, Alkmaar, Hoorn]"
10,"[Delft, Den Haag HS, Delft, Schiedam Centrum, Rotterdam Centraal, Rotterdam Alexander, Rotterdam Blaak, Dordrecht, Rotterdam Centraal, Dordrecht, Roosendaal]"
11,"[Roermond, Weert, Roermond, Sittard, Heerlen, Sittard, Roermond]"
12,"[Dieren, Zutphen, Apeldoorn, Zutphen, Deventer, Zutphen, Dieren, Arnhem Centraal, Nijmegen, Arnhem Centraal, Nijmegen, Arnhem Centraal]"
13,"[Arnhem Centraal, Ede-Wageningen, Arnhem Centraal, Nijmegen, Oss, s-Hertogenbosch, Tilburg, Breda, Tilburg]"
14,"[Almere Centrum, Amsterdam Centraal, Almere Centrum, Amsterdam Centraal, Amsterdam Sloterdijk, Haarlem, Heemstede-Aerdenhout, Haarlem, Beverwijk, Castricum, Zaandam, Castricum]"
15,"[Vlissingen, Roosendaal, Etten-Leur, Breda, Dordrecht, Roosendaal, Etten-Leur, Roosendaal]"
score,4519.689655172413
connections missing,[['Alkmaar': 'Den Helder']: ['Amsterdam Amstel': 'Hilversum']: ['Den Haag Centraal': 'Gouda']: ['Eindhoven': 'Tilburg']: ['Helmond': 'Venlo']: ['Leiden Centraal': 'Heemstede-Aerdenhout']: ['Maastricht': 'Sittard']: ['Rotterdam Blaak': 'Schiedam Centrum']: ['Utrecht Centraal': 'Amsterdam Centraal']: ['Utrecht Centraal': 'Alphen a/d Rijn']: ['Utrecht Centraal': 'Schiphol Airport']: ['Weert': 'Eindhoven']]