train,stations
1,"[Arnhem Centraal, Ede-Wageningen, Arnhem Centraal, Nijmegen, Oss, s-Hertogenbosch, Tilburg, Eindhoven, s-Hertogenbosch, Eindhoven]"
3,"[Haarlem, Heemstede-Aerdenhout, Leiden Centraal, Den Haag Laan v NOI, Delft, Schiedam Centrum, Rotterdam Blaak, Rotterdam Alexander]"
4,"[Heemstede-Aerdenhout, Haarlem, Heemstede-Aerdenhout, Leiden Centraal, Den Haag Centraal, Delft, Den Haag HS, Leiden Centraal, Heemstede-Aerdenhout, Haarlem, Amsterdam Sloterdijk, Amsterdam Zuid, Schiphol Airport, Amsterdam Zuid, Amsterdam Sloterdijk, Amsterdam Centraal, Amsterdam Sloterdijk]"
8,"[Rotterdam Centraal, Rotterdam Alexander, Gouda, Den Haag HS]"
10,"[Dordrecht, Roosendaal, Etten-Leur, Roosendaal, Dordrecht, Rotterdam Centraal, Schiedam Centrum, Rotterdam Centraal]"
14,"[Delft, Den Haag Laan v NOI, Delft, Den Haag HS, Leiden Centraal, Alphen a/d Rijn, Leiden Centraal, Den Haag Centraal, Gouda]"
16,"[Beverwijk, Castricum, Zaandam, Amsterdam Sloterdijk, Haarlem]"
18,"[Apeldoorn, Deventer, Zutphen, Dieren, Arnhem Centraal, Nijmegen, Oss, s-Hertogenbosch, Eindhoven, Tilburg, Breda, Dordrecht]"
20,"[Amsterdam Amstel, Amsterdam Zuid, Amsterdam Sloterdijk, Amsterdam Centraal, Almere Centrum, Lelystad Centrum, Almere Centrum, Lelystad Centrum, Almere Centrum, Hilversum, Amsterdam Amstel]"
23,"[Heerenveen, Steenwijk, Zwolle, Amersfoort, Apeldoorn, Zutphen, Deventer, Almelo]"
25,"[Hengelo, Enschede, Hengelo, Almelo, Zwolle, Steenwijk, Heerenveen, Leeuwarden, Groningen, Assen]"
26,"[Maastricht, Sittard, Maastricht, Sittard, Roermond, Weert, Eindhoven, Helmond, Venlo, Helmond]"
score,5866.0
connections missing,[['Alkmaar': 'Den Helder']: ['Amsterdam Amstel': 'Almere Centrum']: ['Assen': 'Zwolle']: ['Castricum': 'Alkmaar']: ['Roosendaal': 'Vlissingen']: ['Sittard': 'Heerlen']: ['Zwolle': 'Deventer']]