train,stations
0,"[Nijmegen, Arnhem Centraal, Ede-Wageningen, Utrecht Centraal, s-Hertogenbosch, Oss, s-Hertogenbosch, Tilburg, Breda]"
1,"[Utrecht Centraal, Amersfoort, Apeldoorn, Amersfoort, Apeldoorn, Deventer, Zwolle, Assen, Groningen]"
2,"[Amsterdam Amstel, Almere Centrum, Amsterdam Centraal]"
3,"[Heemstede-Aerdenhout, Haarlem, Amsterdam Sloterdijk, Zaandam, Castricum, Beverwijk, Zaandam, Beverwijk, Haarlem]"
4,"[Amsterdam Zuid, Schiphol Airport, Utrecht Centraal, Gouda, Alphen a/d Rijn, Leiden Centraal, Den Haag HS, Delft, Schiedam Centrum, Rotterdam Centraal, Rotterdam Alexander]"
5,"[Leiden Centraal, Alphen a/d Rijn, Gouda]"
6,"[Dieren, Zutphen, Dieren, Zutphen, Dieren]"
7,"[Hoorn, Zaandam, Amsterdam Sloterdijk, Amsterdam Centraal, Amsterdam Sloterdijk, Zaandam]"
8,"[Rotterdam Centraal, Schiedam Centrum, Rotterdam Centraal, Dordrecht, Rotterdam Blaak, Rotterdam Alexander, Gouda, Alphen a/d Rijn, Utrecht Centraal, Amersfoort]"
9,"[Alkmaar, Castricum, Zaandam, Amsterdam Sloterdijk, Amsterdam Centraal, Utrecht Centraal, Hilversum, Amsterdam Amstel, Amsterdam Zuid]"
10,"[Sittard, Maastricht, Sittard, Roermond, Weert, Roermond]"
11,"[Breda, Etten-Leur, Breda, Dordrecht, Rotterdam Blaak, Rotterdam Alexander, Gouda, Den Haag Laan v NOI, Leiden Centraal, Den Haag Laan v NOI, Leiden Centraal, Schiphol Airport, Leiden Centraal]"
12,"[Utrecht Centraal, Amsterdam Amstel, Amsterdam Zuid, Schiphol Airport, Leiden Centraal, Den Haag Laan v NOI]"
13,"[s-Hertogenbosch, Eindhoven, Weert, Roermond, Weert]"
14,"[Groningen, Leeuwarden, Heerenveen, Leeuwarden, Heerenveen, Leeuwarden, Heerenveen, Steenwijk]"
15,"[Arnhem Centraal, Dieren, Zutphen, Dieren, Zutphen, Apeldoorn, Deventer, Almelo, Hengelo, Enschede, Hengelo, Almelo]"
score,4572.76404494382
connections missing,[['Alkmaar': 'Hoorn']: ['Alkmaar': 'Den Helder']: ['Etten-Leur': 'Roosendaal']: ['Helmond': 'Venlo']: ['Oss': 'Nijmegen']: ['Roosendaal': 'Vlissingen']: ['Roosendaal': 'Dordrecht']: ['Zwolle': 'Amersfoort']: ['Zwolle': 'Almelo']]