train,stations
0,"[Deventer, Apeldoorn, Zutphen, Dieren, Zutphen, Dieren, Zutphen, Deventer, Almelo, Hengelo, Enschede, Hengelo, Almelo, Deventer, Apeldoorn, Deventer]"
1,"[Amsterdam Amstel, Amsterdam Centraal, Almere Centrum, Lelystad Centrum, Almere Centrum, Amsterdam Centraal, Amsterdam Sloterdijk, Zaandam]"
2,"[Den Haag Laan v NOI, Leiden Centraal, Heemstede-Aerdenhout, Leiden Centraal, Den Haag Centraal, Delft, Schiedam Centrum, Rotterdam Blaak, Rotterdam Alexander, Rotterdam Centraal, Dordrecht, Breda]"
3,"[Gouda, Alphen a/d Rijn, Leiden Centraal, Den Haag HS, Gouda, Den Haag Laan v NOI, Leiden Centraal, Den Haag Laan v NOI, Leiden Centraal, Den Haag HS, Gouda]"
4,"[Oss, Nijmegen, Arnhem Centraal, Ede-Wageningen, Utrecht Centraal, Hilversum, Utrecht Centraal, Hilversum, Utrecht Centraal]"
5,"[Sittard, Roermond, Weert, Eindhoven, s-Hertogenbosch, Tilburg, Breda, Etten-Leur]"
6,"[Weert, Eindhoven, s-Hertogenbosch, Oss, s-Hertogenbosch, Eindhoven, Tilburg, Breda, Dordrecht]"
8,"[Dieren, Arnhem Centraal, Ede-Wageningen, Utrecht Centraal, Amsterdam Amstel, Almere Centrum, Amsterdam Centraal, Amsterdam Amstel, Amsterdam Zuid, Amsterdam Sloterdijk, Amsterdam Centraal]"
9,"[Leiden Centraal, Den Haag Laan v NOI, Leiden Centraal, Den Haag Laan v NOI, Delft, Schiedam Centrum, Rotterdam Blaak, Schiedam Centrum, Delft, Den Haag Laan v NOI, Leiden Centraal, Heemstede-Aerdenhout, Haarlem, Beverwijk, Castricum, Alkmaar, Hoorn]"
11,"[Amersfoort, Utrecht Centraal, s-Hertogenbosch, Oss, Nijmegen, Arnhem Centraal, Ede-Wageningen, Utrecht Centraal, Alphen a/d Rijn]"
12,"[Den Haag Laan v NOI, Leiden Centraal, Heemstede-Aerdenhout, Haarlem, Amsterdam Sloterdijk, Zaandam, Beverwijk, Castricum, Zaandam, Castricum]"
14,"[Heerenveen, Steenwijk, Zwolle, Deventer, Zutphen, Dieren, Zutphen, Deventer]"
15,"[Den Haag Centraal, Leiden Centraal, Alphen a/d Rijn, Utrecht Centraal, Schiphol Airport, Amsterdam Zuid, Amsterdam Amstel, Amsterdam Zuid, Schiphol Airport]"
17,"[Amsterdam Zuid, Schiphol Airport, Amsterdam Zuid, Schiphol Airport, Utrecht Centraal, Gouda, Den Haag HS, Delft, Den Haag HS]"
18,"[Amsterdam Sloterdijk, Zaandam, Hoorn, Zaandam, Castricum, Beverwijk, Zaandam, Amsterdam Sloterdijk, Amsterdam Centraal, Amsterdam Sloterdijk]"
24,"[Etten-Leur, Breda, Etten-Leur, Roosendaal, Dordrecht, Rotterdam Blaak, Schiedam Centrum, Rotterdam Blaak, Schiedam Centrum, Rotterdam Centraal, Rotterdam Alexander, Rotterdam Centraal]"
27,"[Deventer, Almelo, Zwolle, Amersfoort, Apeldoorn, Zutphen, Deventer]"
32,"[Assen, Groningen, Leeuwarden, Heerenveen]"
score,4698.202247191011
connections missing,[['Helmond': 'Venlo']: ['Maastricht': 'Sittard']: ['Roosendaal': 'Vlissingen']: ['Sittard': 'Heerlen']: ['Utrecht Centraal': 'Amsterdam Centraal']]