train,stations
0,"[Leiden Centraal, Den Haag Centraal, Leiden Centraal, Den Haag HS, Leiden Centraal, Den Haag Laan v NOI, Gouda, Alphen a/d Rijn, Gouda, Den Haag Centraal]"
1,"[Breda, Dordrecht, Rotterdam Centraal, Rotterdam Alexander, Rotterdam Blaak, Dordrecht, Roosendaal, Etten-Leur, Breda, Etten-Leur, Breda, Etten-Leur]"
2,"[Castricum, Alkmaar, Hoorn, Alkmaar, Castricum, Beverwijk, Zaandam, Castricum, Zaandam, Castricum]"
3,"[Alkmaar, Castricum, Alkmaar, Castricum, Beverwijk, Zaandam, Beverwijk, Castricum, Alkmaar, Castricum, Zaandam]"
4,"[Eindhoven, Helmond, Venlo, Helmond, Eindhoven, Weert, Roermond, Weert, Roermond, Weert]"
5,"[Oss, s-Hertogenbosch, Tilburg, s-Hertogenbosch, Utrecht Centraal, Alphen a/d Rijn]"
6,"[Assen, Zwolle, Amersfoort, Apeldoorn, Deventer, Almelo, Hengelo, Enschede]"
7,"[Hilversum, Utrecht Centraal, Amsterdam Centraal, Amsterdam Amstel, Utrecht Centraal, Gouda, Alphen a/d Rijn, Gouda, Rotterdam Alexander]"
8,"[Almere Centrum, Amsterdam Centraal, Amsterdam Sloterdijk, Zaandam, Beverwijk, Haarlem, Amsterdam Sloterdijk]"
9,"[Den Haag HS, Leiden Centraal, Schiphol Airport, Leiden Centraal, Den Haag Centraal, Delft, Den Haag HS, Delft, Schiedam Centrum, Rotterdam Blaak, Schiedam Centrum, Delft, Den Haag Centraal]"
10,"[Amsterdam Zuid, Amsterdam Amstel, Amsterdam Centraal, Amsterdam Amstel, Amsterdam Centraal, Almere Centrum, Amsterdam Centraal, Amsterdam Sloterdijk, Amsterdam Zuid, Schiphol Airport, Amsterdam Zuid, Amsterdam Amstel, Hilversum]"
11,"[Lelystad Centrum, Almere Centrum, Amsterdam Amstel, Amsterdam Zuid, Schiphol Airport, Utrecht Centraal, s-Hertogenbosch, Utrecht Centraal, Amsterdam Amstel]"
12,"[Amersfoort, Utrecht Centraal, Hilversum, Utrecht Centraal, Gouda, Den Haag Centraal, Gouda]"
13,"[Den Haag HS, Gouda, Alphen a/d Rijn, Gouda, Den Haag Centraal, Gouda, Rotterdam Alexander]"
14,"[Eindhoven, Tilburg, s-Hertogenbosch, Oss, Nijmegen, Arnhem Centraal, Dieren, Arnhem Centraal, Dieren, Zutphen]"
15,"[s-Hertogenbosch, Eindhoven, Tilburg, Breda, Etten-Leur, Roosendaal, Dordrecht, Rotterdam Blaak, Rotterdam Alexander, Rotterdam Blaak, Schiedam Centrum, Rotterdam Centraal, Schiedam Centrum]"
16,"[Heerenveen, Steenwijk, Zwolle, Deventer, Zutphen, Dieren, Zutphen, Apeldoorn, Zutphen]"
score,4065.044943820225
connections missing,[['Alkmaar': 'Den Helder']: ['Groningen': 'Assen']: ['Hilversum': 'Almere Centrum']: ['Leeuwarden': 'Heerenveen']: ['Leeuwarden': 'Groningen']: ['Maastricht': 'Sittard']: ['Roosendaal': 'Vlissingen']: ['Sittard': 'Heerlen']: ['Sittard': 'Roermond']: ['Zaandam': 'Hoorn']: ['Zwolle': 'Almelo']]