train,stations
0,"[Deventer, Apeldoorn, Deventer, Almelo, Hengelo, Enschede, Hengelo, Almelo, Hengelo, Almelo, Deventer, Zutphen, Dieren, Zutphen]"
1,"[Castricum, Alkmaar, Hoorn, Zaandam, Amsterdam Sloterdijk, Amsterdam Zuid, Amsterdam Amstel, Hilversum]"
2,"[Zwolle, Assen, Groningen, Assen, Groningen, Leeuwarden, Heerenveen]"
3,"[Maastricht, Sittard, Roermond, Weert, Eindhoven, Weert, Roermond]"
4,"[Steenwijk, Zwolle, Deventer, Apeldoorn, Zutphen, Dieren, Arnhem Centraal, Nijmegen, Arnhem Centraal]"
5,"[Alphen a/d Rijn, Leiden Centraal, Den Haag Centraal, Gouda, Den Haag Centraal, Delft, Schiedam Centrum, Rotterdam Blaak, Rotterdam Alexander, Rotterdam Blaak, Rotterdam Alexander]"
6,"[Amsterdam Amstel, Amsterdam Centraal, Amsterdam Sloterdijk, Haarlem, Amsterdam Sloterdijk, Amsterdam Zuid, Schiphol Airport, Leiden Centraal, Heemstede-Aerdenhout, Haarlem, Heemstede-Aerdenhout]"
7,"[Tilburg, Eindhoven, s-Hertogenbosch, Oss, Nijmegen, Oss, s-Hertogenbosch, Eindhoven, Helmond]"
8,"[Gouda, Rotterdam Alexander, Rotterdam Blaak, Schiedam Centrum, Rotterdam Centraal, Rotterdam Alexander, Rotterdam Centraal, Rotterdam Alexander, Rotterdam Centraal, Dordrecht, Rotterdam Blaak, Dordrecht]"
9,"[Roosendaal, Dordrecht, Breda, Tilburg, Breda, Dordrecht, Rotterdam Blaak, Rotterdam Alexander, Gouda, Alphen a/d Rijn, Leiden Centraal]"
10,"[Delft, Den Haag HS, Leiden Centraal, Den Haag Laan v NOI, Gouda, Alphen a/d Rijn, Gouda, Den Haag HS, Delft, Schiedam Centrum, Rotterdam Centraal]"
score,5165.0
connections missing,[['Alkmaar': 'Den Helder']: ['Almere Centrum': 'Lelystad Centrum']: ['Amsterdam Amstel': 'Almere Centrum']: ['Amsterdam Centraal': 'Almere Centrum']: ['Apeldoorn': 'Amersfoort']: ['Breda': 'Etten-Leur']: ['Etten-Leur': 'Roosendaal']: ['Helmond': 'Venlo']: ['Roosendaal': 'Vlissingen']: ['Sittard': 'Heerlen']: ['Zaandam': 'Castricum']: ['Zaandam': 'Beverwijk']: ['Zwolle': 'Amersfoort']: ['Zwolle': 'Almelo']: ['s-Hertogenbosch': 'Tilburg']]