train,stations
0,"[Haarlem, Amsterdam Sloterdijk, Haarlem, Beverwijk, Zaandam, Castricum, Alkmaar, Castricum, Beverwijk, Haarlem, Beverwijk]"
2,"[Helmond, Eindhoven, s-Hertogenbosch, Tilburg, Eindhoven, s-Hertogenbosch, Tilburg, Breda, Dordrecht, Breda, Etten-Leur, Breda, Dordrecht]"
3,"[Delft, Den Haag Centraal, Gouda, Alphen a/d Rijn, Leiden Centraal, Alphen a/d Rijn, Leiden Centraal, Heemstede-Aerdenhout, Haarlem]"
4,"[Sittard, Heerlen, Sittard, Roermond, Weert, Roermond, Weert, Roermond, Sittard, Maastricht, Sittard, Roermond, Weert]"
5,"[Gouda, Rotterdam Alexander, Rotterdam Centraal, Dordrecht, Rotterdam Blaak, Schiedam Centrum, Rotterdam Blaak, Rotterdam Alexander, Gouda, Den Haag Laan v NOI]"
7,"[Zwolle, Amersfoort, Apeldoorn, Zutphen, Dieren, Arnhem Centraal, Nijmegen, Oss]"
8,"[Schiedam Centrum, Rotterdam Centraal, Dordrecht, Breda, Etten-Leur, Breda, Etten-Leur, Roosendaal, Dordrecht, Rotterdam Centraal, Schiedam Centrum, Rotterdam Centraal, Schiedam Centrum, Delft]"
9,"[Breda, Tilburg, s-Hertogenbosch, Oss, Nijmegen, Oss, s-Hertogenbosch, Tilburg, s-Hertogenbosch, Eindhoven, Helmond]"
10,"[Almere Centrum, Lelystad Centrum, Almere Centrum, Hilversum, Almere Centrum, Amsterdam Amstel]"
11,"[Beverwijk, Castricum, Zaandam, Amsterdam Sloterdijk, Amsterdam Centraal, Amsterdam Amstel, Amsterdam Centraal, Amsterdam Sloterdijk, Amsterdam Zuid, Amsterdam Amstel, Amsterdam Centraal, Almere Centrum, Amsterdam Centraal, Almere Centrum, Hilversum]"
12,"[Dieren, Zutphen, Apeldoorn, Zutphen, Apeldoorn, Zutphen, Deventer, Apeldoorn, Deventer, Apeldoorn, Zutphen]"
13,"[Delft, Den Haag Laan v NOI, Leiden Centraal, Den Haag HS, Leiden Centraal, Den Haag HS, Delft, Schiedam Centrum, Rotterdam Blaak]"
14,"[Hengelo, Enschede, Hengelo, Almelo, Hengelo, Enschede, Hengelo, Almelo, Hengelo, Almelo, Hengelo, Almelo, Zwolle, Amersfoort]"
15,"[Maastricht, Sittard, Roermond, Sittard, Maastricht, Sittard, Heerlen, Sittard, Roermond, Weert]"
16,"[Haarlem, Heemstede-Aerdenhout, Leiden Centraal, Schiphol Airport, Leiden Centraal, Heemstede-Aerdenhout, Leiden Centraal, Den Haag Centraal, Gouda, Den Haag HS, Leiden Centraal]"
17,"[Heerenveen, Leeuwarden, Groningen, Assen, Groningen, Assen, Zwolle, Amersfoort]"
score,4309.0
connections missing,[['Alkmaar': 'Hoorn']: ['Alkmaar': 'Den Helder']: ['Amsterdam Amstel': 'Hilversum']: ['Amsterdam Zuid': 'Schiphol Airport']: ['Arnhem Centraal': 'Ede-Wageningen']: ['Deventer': 'Almelo']: ['Heerenveen': 'Steenwijk']: ['Helmond': 'Venlo']: ['Roosendaal': 'Vlissingen']: ['Steenwijk': 'Zwolle']: ['Weert': 'Eindhoven']: ['Zaandam': 'Hoorn']: ['Zwolle': 'Deventer']]