train,stations
0,"[Schiphol Airport, Leiden Centraal, Den Haag Centraal, Delft, Den Haag HS, Delft, Schiedam Centrum, Delft, Den Haag Centraal, Gouda, Den Haag Laan v NOI]"
1,"[Den Haag Centraal, Gouda, Den Haag Centraal, Leiden Centraal, Schiphol Airport, Amsterdam Zuid, Amsterdam Sloterdijk, Amsterdam Centraal, Amsterdam Amstel, Amsterdam Zuid, Schiphol Airport]"
2,"[Hilversum, Amsterdam Amstel, Amsterdam Centraal, Amsterdam Amstel, Almere Centrum, Amsterdam Centraal, Amsterdam Sloterdijk, Zaandam, Castricum, Beverwijk, Castricum]"
3,"[Tilburg, Eindhoven, Helmond, Venlo, Helmond, Eindhoven, Helmond, Eindhoven]"
4,"[Hilversum, Almere Centrum, Lelystad Centrum, Almere Centrum, Hilversum, Almere Centrum, Amsterdam Amstel]"
5,"[Rotterdam Alexander, Rotterdam Blaak, Schiedam Centrum, Rotterdam Centraal, Rotterdam Alexander, Rotterdam Blaak, Dordrecht, Breda, Dordrecht, Rotterdam Blaak, Rotterdam Alexander, Rotterdam Centraal, Rotterdam Alexander, Gouda, Rotterdam Alexander, Rotterdam Centraal, Dordrecht]"
6,"[Alphen a/d Rijn, Leiden Centraal, Heemstede-Aerdenhout, Leiden Centraal]"
7,"[Den Haag Centraal, Gouda, Den Haag HS, Leiden Centraal, Den Haag HS, Delft, Den Haag Laan v NOI, Leiden Centraal, Heemstede-Aerdenhout, Haarlem, Beverwijk]"
8,"[Vlissingen, Roosendaal, Etten-Leur, Breda, Dordrecht, Breda, Tilburg, Eindhoven]"
9,"[Enschede, Hengelo, Enschede, Hengelo, Almelo, Hengelo, Almelo, Zwolle, Steenwijk, Heerenveen, Leeuwarden, Heerenveen, Leeuwarden]"
10,"[Sittard, Heerlen, Sittard, Heerlen, Sittard, Heerlen, Sittard]"
11,"[Den Helder, Alkmaar, Castricum, Beverwijk, Zaandam, Castricum, Zaandam, Amsterdam Sloterdijk, Zaandam, Hoorn, Alkmaar, Castricum]"
12,"[Heerenveen, Steenwijk, Heerenveen, Steenwijk, Zwolle, Deventer, Apeldoorn, Deventer, Zutphen, Dieren, Arnhem Centraal, Ede-Wageningen, Arnhem Centraal]"
13,"[Weert, Eindhoven, Weert, Roermond, Weert, Roermond, Sittard, Maastricht, Sittard]"
14,"[Oss, s-Hertogenbosch, Oss, s-Hertogenbosch, Tilburg, s-Hertogenbosch, Oss, Nijmegen, Arnhem Centraal, Nijmegen, Arnhem Centraal]"
15,"[Arnhem Centraal, Nijmegen, Oss, s-Hertogenbosch, Oss, s-Hertogenbosch, Eindhoven, s-Hertogenbosch]"
score,4779.0
connections missing,[['Apeldoorn': 'Amersfoort']: ['Apeldoorn': 'Zutphen']: ['Assen': 'Zwolle']: ['Deventer': 'Almelo']: ['Groningen': 'Assen']: ['Leeuwarden': 'Groningen']: ['Roosendaal': 'Dordrecht']: ['Zwolle': 'Amersfoort']]