train,stations
0,"[Apeldoorn, Amersfoort, Utrecht Centraal, s-Hertogenbosch, Utrecht Centraal, Alphen a/d Rijn, Leiden Centraal, Schiphol Airport]"
1,"[Amsterdam Centraal, Amsterdam Sloterdijk, Zaandam, Castricum, Alkmaar, Hoorn, Zaandam, Amsterdam Sloterdijk, Amsterdam Zuid, Amsterdam Sloterdijk, Amsterdam Centraal, Amsterdam Amstel, Hilversum, Utrecht Centraal]"
2,"[Den Haag Centraal, Leiden Centraal, Den Haag Laan v NOI, Delft, Den Haag Centraal, Gouda, Rotterdam Alexander, Gouda, Alphen a/d Rijn]"
3,"[Schiedam Centrum, Delft, Schiedam Centrum, Delft, Den Haag Laan v NOI, Leiden Centraal, Den Haag HS, Gouda, Rotterdam Alexander, Gouda, Rotterdam Alexander, Rotterdam Centraal, Rotterdam Alexander]"
4,"[Utrecht Centraal, Ede-Wageningen, Arnhem Centraal, Dieren, Zutphen]"
5,"[Gouda, Utrecht Centraal, Schiphol Airport, Leiden Centraal, Heemstede-Aerdenhout, Haarlem, Beverwijk]"
6,"[Heemstede-Aerdenhout, Haarlem, Amsterdam Sloterdijk, Amsterdam Zuid, Amsterdam Amstel, Hilversum]"
7,"[Amsterdam Centraal, Utrecht Centraal, Schiphol Airport, Leiden Centraal, Heemstede-Aerdenhout, Leiden Centraal, Den Haag HS, Delft, Schiedam Centrum]"
8,"[Hengelo, Enschede, Hengelo]"
9,"[Rotterdam Centraal, Schiedam Centrum, Rotterdam Centraal, Schiedam Centrum, Delft, Den Haag Laan v NOI, Leiden Centraal, Den Haag Laan v NOI, Gouda, Rotterdam Alexander, Rotterdam Centraal, Rotterdam Alexander]"
10,"[Lelystad Centrum, Almere Centrum, Amsterdam Centraal, Amsterdam Amstel, Amsterdam Zuid, Schiphol Airport]"
11,"[Assen, Groningen, Leeuwarden, Heerenveen, Steenwijk]"
12,"[Schiedam Centrum, Rotterdam Blaak, Dordrecht, Rotterdam Centraal, Rotterdam Alexander, Rotterdam Centraal, Schiedam Centrum, Rotterdam Centraal, Dordrecht, Breda, Etten-Leur, Breda, Etten-Leur]"
13,"[Oss, s-Hertogenbosch, Tilburg, s-Hertogenbosch, Tilburg, Breda, Dordrecht, Rotterdam Blaak, Dordrecht]"
14,"[Apeldoorn, Deventer, Apeldoorn]"
score,4058.2471910112363
connections missing,[['Alkmaar': 'Den Helder']: ['Apeldoorn': 'Zutphen']: ['Eindhoven': 'Helmond']: ['Eindhoven': 'Tilburg']: ['Helmond': 'Venlo']: ['Maastricht': 'Sittard']: ['Nijmegen': 'Arnhem Centraal']: ['Oss': 'Nijmegen']: ['Roermond': 'Weert']: ['Roosendaal': 'Vlissingen']: ['Sittard': 'Heerlen']: ['Sittard': 'Roermond']: ['Utrecht Centraal': 'Amsterdam Amstel']: ['Weert': 'Eindhoven']: ['Zaandam': 'Beverwijk']: ['Zwolle': 'Amersfoort']]