train,stations
0,"[Utrecht Centraal, Amersfoort, Zwolle, Deventer, Zutphen, Apeldoorn, Deventer, Zutphen, Apeldoorn, Amersfoort]"
1,"[Utrecht Centraal, s-Hertogenbosch, Oss, Nijmegen, Oss, Nijmegen, Oss]"
2,"[Zaandam, Hoorn, Zaandam, Amsterdam Sloterdijk, Haarlem, Heemstede-Aerdenhout, Haarlem, Heemstede-Aerdenhout, Leiden Centraal, Heemstede-Aerdenhout, Leiden Centraal, Heemstede-Aerdenhout, Leiden Centraal]"
3,"[Den Haag Laan v NOI, Leiden Centraal, Den Haag HS, Gouda, Alphen a/d Rijn, Gouda, Den Haag Centraal, Delft, Den Haag Centraal, Leiden Centraal, Schiphol Airport, Leiden Centraal, Den Haag Centraal]"
4,"[Amsterdam Zuid, Schiphol Airport]"
5,"[Arnhem Centraal, Dieren, Zutphen, Deventer, Apeldoorn, Deventer, Zwolle, Steenwijk, Heerenveen, Leeuwarden, Heerenveen, Leeuwarden, Heerenveen]"
6,"[Hengelo, Almelo, Hengelo, Enschede, Hengelo, Almelo, Deventer, Zutphen, Apeldoorn, Deventer, Zutphen]"
7,"[Weert, Roermond, Weert, Eindhoven, Helmond, Eindhoven, Weert]"
8,"[Amsterdam Centraal, Amsterdam Sloterdijk, Amsterdam Centraal, Almere Centrum, Hilversum, Amsterdam Amstel]"
9,"[Amsterdam Sloterdijk, Zaandam, Castricum, Beverwijk, Haarlem, Amsterdam Sloterdijk, Zaandam, Amsterdam Sloterdijk, Amsterdam Zuid, Amsterdam Amstel, Amsterdam Zuid, Schiphol Airport, Amsterdam Zuid, Schiphol Airport, Leiden Centraal]"
10,"[Alkmaar, Den Helder, Alkmaar, Hoorn, Zaandam, Castricum]"
11,"[Hengelo, Almelo, Deventer, Zutphen, Apeldoorn, Zutphen]"
12,"[Rotterdam Alexander, Rotterdam Blaak, Rotterdam Alexander, Rotterdam Blaak, Schiedam Centrum, Rotterdam Centraal, Rotterdam Alexander, Gouda, Den Haag Laan v NOI, Leiden Centraal, Den Haag HS, Delft, Den Haag Centraal, Delft, Schiedam Centrum]"
13,"[Rotterdam Blaak, Dordrecht, Breda, Dordrecht, Roosendaal, Etten-Leur, Breda, Tilburg, s-Hertogenbosch, Eindhoven, Weert]"
14,"[Groningen, Leeuwarden, Groningen, Assen, Zwolle]"
score,4078.2471910112363
connections missing,[['Almere Centrum': 'Lelystad Centrum']: ['Amsterdam Amstel': 'Almere Centrum']: ['Amsterdam Amstel': 'Amsterdam Centraal']: ['Arnhem Centraal': 'Ede-Wageningen']: ['Dordrecht': 'Rotterdam Centraal']: ['Helmond': 'Venlo']: ['Maastricht': 'Sittard']: ['Roosendaal': 'Vlissingen']: ['Sittard': 'Heerlen']: ['Sittard': 'Roermond']: ['Utrecht Centraal': 'Hilversum']: ['Utrecht Centraal': 'Ede-Wageningen']: ['Utrecht Centraal': 'Gouda']: ['Utrecht Centraal': 'Alphen a/d Rijn']: ['Zaandam': 'Beverwijk']: ['Zwolle': 'Almelo']]