train,stations
0,"[Amsterdam Centraal, Amsterdam Amstel, Hilversum, Amsterdam Amstel, Almere Centrum, Amsterdam Centraal, Amsterdam Sloterdijk, Zaandam, Amsterdam Sloterdijk, Haarlem, Heemstede-Aerdenhout]"
1,"[Enschede, Hengelo, Almelo, Deventer, Zutphen, Apeldoorn, Deventer, Zwolle, Steenwijk, Heerenveen, Steenwijk]"
2,"[]"
3,"[Amersfoort, Apeldoorn, Zutphen, Dieren, Arnhem Centraal]"
4,"[Amsterdam Amstel, Amsterdam Zuid, Amsterdam Amstel, Amsterdam Centraal, Amsterdam Amstel, Amsterdam Centraal, Almere Centrum, Amsterdam Centraal, Amsterdam Sloterdijk, Amsterdam Centraal, Amsterdam Amstel, Amsterdam Zuid, Schiphol Airport, Amsterdam Zuid, Amsterdam Sloterdijk]"
7,"[Rotterdam Centraal, Schiedam Centrum, Rotterdam Blaak, Rotterdam Alexander, Gouda, Den Haag HS, Leiden Centraal, Schiphol Airport, Amsterdam Zuid, Amsterdam Sloterdijk, Zaandam, Hoorn, Alkmaar, Castricum]"
8,"[Den Haag Laan v NOI, Leiden Centraal, Schiphol Airport, Leiden Centraal, Den Haag HS, Delft, Den Haag Centraal, Gouda, Alphen a/d Rijn, Leiden Centraal, Den Haag Laan v NOI]"
9,"[Castricum, Zaandam, Beverwijk, Haarlem, Amsterdam Sloterdijk, Amsterdam Zuid, Amsterdam Amstel, Amsterdam Centraal, Amsterdam Amstel, Amsterdam Centraal, Amsterdam Amstel, Almere Centrum, Hilversum]"
11,"[Delft, Schiedam Centrum, Delft, Den Haag Laan v NOI, Leiden Centraal, Den Haag Laan v NOI]"
13,"[Breda, Etten-Leur]"
18,"[Heerenveen, Steenwijk, Heerenveen, Leeuwarden, Groningen, Assen, Zwolle, Amersfoort]"
20,"[Castricum, Alkmaar, Castricum, Beverwijk, Haarlem, Heemstede-Aerdenhout, Leiden Centraal, Heemstede-Aerdenhout, Haarlem]"
21,"[Breda, Dordrecht, Roosendaal, Dordrecht, Rotterdam Centraal, Rotterdam Alexander, Rotterdam Blaak, Schiedam Centrum, Rotterdam Blaak, Schiedam Centrum, Delft, Den Haag HS, Delft, Schiedam Centrum]"
23,"[Maastricht, Sittard, Maastricht, Sittard, Heerlen, Sittard, Roermond, Weert, Eindhoven]"
score,5543.0
connections missing,[['Alkmaar': 'Den Helder']: ['Almere Centrum': 'Lelystad Centrum']: ['Dordrecht': 'Rotterdam Blaak']: ['Roosendaal': 'Vlissingen']: ['Zwolle': 'Almelo']: ['s-Hertogenbosch': 'Tilburg']]