train,stations
2,"[Amsterdam Amstel, Almere Centrum, Amsterdam Centraal, Amsterdam Sloterdijk, Amsterdam Centraal, Utrecht Centraal, Amersfoort, Zwolle, Assen]"
3,"[Schiphol Airport, Amsterdam Zuid, Amsterdam Sloterdijk, Haarlem, Heemstede-Aerdenhout, Haarlem, Amsterdam Sloterdijk, Haarlem, Heemstede-Aerdenhout, Leiden Centraal]"
5,"[Gouda, Den Haag Centraal, Leiden Centraal, Den Haag Laan v NOI, Gouda, Den Haag HS, Delft, Den Haag HS, Gouda, Alphen a/d Rijn, Leiden Centraal]"
8,"[Helmond, Eindhoven, Tilburg, Eindhoven, Weert, Roermond, Sittard, Maastricht, Sittard]"
9,"[Amsterdam Sloterdijk, Amsterdam Centraal, Amsterdam Amstel, Amsterdam Zuid, Schiphol Airport, Leiden Centraal, Schiphol Airport, Leiden Centraal, Den Haag Centraal]"
11,"[Haarlem, Beverwijk, Castricum, Zaandam, Beverwijk, Haarlem, Heemstede-Aerdenhout, Haarlem, Amsterdam Sloterdijk, Amsterdam Centraal, Amsterdam Amstel, Utrecht Centraal]"
12,"[Dieren, Zutphen, Apeldoorn, Deventer, Apeldoorn, Amersfoort, Zwolle, Steenwijk]"
14,"[Den Haag HS, Leiden Centraal, Den Haag Laan v NOI, Leiden Centraal, Den Haag HS, Leiden Centraal, Den Haag Laan v NOI, Delft, Schiedam Centrum, Rotterdam Blaak, Rotterdam Alexander, Rotterdam Centraal]"
16,"[Hilversum, Utrecht Centraal, Hilversum, Utrecht Centraal, Gouda, Rotterdam Alexander, Rotterdam Centraal, Schiedam Centrum, Delft, Schiedam Centrum, Rotterdam Blaak, Rotterdam Alexander, Rotterdam Centraal, Schiedam Centrum, Delft, Den Haag Centraal, Leiden Centraal, Heemstede-Aerdenhout]"
18,"[Leiden Centraal, Heemstede-Aerdenhout, Haarlem, Heemstede-Aerdenhout, Haarlem, Beverwijk, Zaandam, Hoorn, Zaandam, Amsterdam Sloterdijk, Haarlem, Heemstede-Aerdenhout, Haarlem, Heemstede-Aerdenhout, Leiden Centraal]"
19,"[Gouda, Rotterdam Alexander, Gouda, Rotterdam Alexander, Gouda, Den Haag HS, Delft, Den Haag HS, Delft, Den Haag HS, Delft, Schiedam Centrum, Rotterdam Centraal, Rotterdam Alexander, Rotterdam Blaak, Schiedam Centrum, Rotterdam Centraal, Schiedam Centrum]"
25,"[Nijmegen, Oss, s-Hertogenbosch, Eindhoven, Tilburg, s-Hertogenbosch, Utrecht Centraal, Hilversum, Almere Centrum, Lelystad Centrum, Almere Centrum]"
26,"[Nijmegen, Arnhem Centraal, Dieren, Arnhem Centraal, Ede-Wageningen, Utrecht Centraal, Schiphol Airport, Amsterdam Zuid, Amsterdam Amstel, Utrecht Centraal, Alphen a/d Rijn]"
31,"[Tilburg, Eindhoven, Tilburg, Breda, Etten-Leur, Roosendaal, Dordrecht, Breda, Etten-Leur, Roosendaal]"
34,"[Castricum, Alkmaar, Den Helder, Alkmaar, Hoorn, Zaandam, Amsterdam Sloterdijk, Haarlem]"
39,"[Zwolle, Almelo, Hengelo, Enschede, Hengelo, Almelo, Deventer, Zutphen]"
score,5251.229885057472
connections missing,[['Dordrecht': 'Rotterdam Blaak']: ['Helmond': 'Venlo']: ['Roosendaal': 'Vlissingen']: ['Zwolle': 'Deventer']]