train,stations
0,"[Zaandam, Amsterdam Sloterdijk, Amsterdam Zuid, Amsterdam Amstel, Amsterdam Zuid, Amsterdam Amstel, Hilversum, Amsterdam Amstel, Amsterdam Zuid, Amsterdam Amstel, Amsterdam Centraal]"
1,"[Delft, Den Haag HS, Leiden Centraal, Heemstede-Aerdenhout, Leiden Centraal, Den Haag Centraal, Delft, Den Haag Laan v NOI, Leiden Centraal, Heemstede-Aerdenhout, Haarlem, Beverwijk, Zaandam]"
2,"[Den Haag Laan v NOI, Delft, Den Haag HS, Leiden Centraal, Schiphol Airport, Amsterdam Zuid, Amsterdam Amstel, Amsterdam Zuid, Amsterdam Sloterdijk, Zaandam, Beverwijk, Castricum, Alkmaar, Castricum]"
3,"[Delft, Den Haag Laan v NOI, Delft, Schiedam Centrum, Delft, Den Haag HS, Leiden Centraal, Alphen a/d Rijn, Leiden Centraal, Schiphol Airport, Amsterdam Zuid, Schiphol Airport, Amsterdam Zuid, Amsterdam Sloterdijk, Amsterdam Zuid, Schiphol Airport]"
4,"[Breda, Etten-Leur, Roosendaal, Dordrecht, Breda, Tilburg, Eindhoven, Tilburg]"
5,"[Etten-Leur, Roosendaal, Dordrecht, Rotterdam Centraal, Rotterdam Alexander, Rotterdam Centraal, Schiedam Centrum, Rotterdam Blaak, Rotterdam Alexander, Rotterdam Blaak, Rotterdam Alexander, Rotterdam Centraal, Rotterdam Alexander, Rotterdam Blaak, Rotterdam Alexander, Rotterdam Blaak]"
6,"[Alphen a/d Rijn, Leiden Centraal, Heemstede-Aerdenhout, Leiden Centraal, Den Haag Centraal, Leiden Centraal, Schiphol Airport, Leiden Centraal, Schiphol Airport, Amsterdam Zuid, Amsterdam Sloterdijk]"
7,"[Enschede, Hengelo, Almelo, Deventer, Zutphen, Dieren, Arnhem Centraal, Nijmegen, Arnhem Centraal, Ede-Wageningen, Arnhem Centraal, Ede-Wageningen, Arnhem Centraal, Nijmegen, Oss, s-Hertogenbosch]"
8,"[Groningen, Assen, Zwolle, Deventer, Apeldoorn, Amersfoort]"
9,"[Lelystad Centrum, Almere Centrum, Amsterdam Amstel, Amsterdam Zuid, Amsterdam Amstel, Amsterdam Zuid, Amsterdam Amstel, Almere Centrum, Amsterdam Centraal, Amsterdam Amstel, Amsterdam Zuid]"
10,"[Amsterdam Zuid, Schiphol Airport, Amsterdam Zuid, Schiphol Airport, Leiden Centraal, Den Haag Laan v NOI, Gouda, Alphen a/d Rijn, Leiden Centraal, Den Haag HS, Delft, Den Haag HS, Delft, Den Haag HS, Delft]"
11,"[Maastricht, Sittard, Heerlen, Sittard, Roermond, Weert, Roermond, Weert, Eindhoven, s-Hertogenbosch, Oss, s-Hertogenbosch, Tilburg]"
12,"[Amsterdam Sloterdijk, Zaandam, Amsterdam Sloterdijk, Haarlem, Amsterdam Sloterdijk, Haarlem, Beverwijk, Castricum, Alkmaar, Hoorn, Alkmaar, Den Helder]"
13,"[Rotterdam Alexander, Gouda, Den Haag Centraal, Leiden Centraal, Heemstede-Aerdenhout, Haarlem, Beverwijk, Zaandam, Amsterdam Sloterdijk, Zaandam, Castricum, Zaandam]"
score,4559.0
connections missing,[['Apeldoorn': 'Zutphen']: ['Den Haag HS': 'Gouda']: ['Dordrecht': 'Rotterdam Blaak']: ['Eindhoven': 'Helmond']: ['Heerenveen': 'Steenwijk']: ['Helmond': 'Venlo']: ['Hilversum': 'Almere Centrum']: ['Leeuwarden': 'Heerenveen']: ['Leeuwarden': 'Groningen']: ['Roosendaal': 'Vlissingen']: ['Steenwijk': 'Zwolle']: ['Zaandam': 'Hoorn']: ['Zwolle': 'Almelo']]