train,stations
0,"[Zutphen, Deventer, Zwolle, Deventer, Almelo, Hengelo, Enschede, Hengelo, Enschede, Hengelo, Almelo]"
1,"[Schiphol Airport, Amsterdam Zuid, Amsterdam Amstel, Hilversum, Almere Centrum, Amsterdam Amstel, Amsterdam Centraal, Amsterdam Sloterdijk, Zaandam]"
2,"[Gouda, Alphen a/d Rijn, Utrecht Centraal, Amsterdam Amstel, Amsterdam Centraal, Almere Centrum, Amsterdam Centraal, Amsterdam Amstel]"
3,"[Arnhem Centraal, Ede-Wageningen, Utrecht Centraal, Amersfoort, Apeldoorn]"
4,"[Utrecht Centraal, Hilversum, Amsterdam Amstel, Amsterdam Zuid, Amsterdam Sloterdijk, Amsterdam Centraal, Amsterdam Sloterdijk, Amsterdam Zuid, Amsterdam Sloterdijk, Haarlem, Amsterdam Sloterdijk]"
5,"[Den Haag Laan v NOI, Delft, Den Haag Laan v NOI, Delft, Schiedam Centrum, Rotterdam Centraal, Dordrecht, Rotterdam Centraal, Schiedam Centrum, Delft]"
6,"[Utrecht Centraal, Schiphol Airport, Leiden Centraal, Heemstede-Aerdenhout, Haarlem, Beverwijk, Castricum, Zaandam, Castricum, Zaandam]"
7,"[Apeldoorn, Deventer, Zutphen, Apeldoorn, Amersfoort, Utrecht Centraal, Gouda, Utrecht Centraal, Hilversum]"
8,"[Zaandam, Hoorn, Alkmaar]"
9,"[Arnhem Centraal, Dieren, Zutphen, Apeldoorn, Deventer, Zwolle, Steenwijk, Heerenveen, Steenwijk]"
10,"[Rotterdam Alexander, Gouda, Den Haag Centraal, Leiden Centraal, Den Haag HS]"
11,"[Castricum, Beverwijk, Zaandam, Amsterdam Sloterdijk, Zaandam, Castricum, Beverwijk, Castricum, Zaandam, Amsterdam Sloterdijk]"
12,"[Tilburg, Breda, Dordrecht, Roosendaal, Dordrecht, Breda, Etten-Leur, Roosendaal, Dordrecht, Rotterdam Blaak]"
13,"[Heerenveen, Leeuwarden, Heerenveen, Steenwijk, Zwolle, Assen]"
14,"[Venlo, Helmond, Eindhoven, s-Hertogenbosch, Oss, Nijmegen, Oss]"
15,"[Amsterdam Sloterdijk, Zaandam, Amsterdam Sloterdijk, Amsterdam Centraal, Amsterdam Sloterdijk, Amsterdam Centraal, Almere Centrum, Amsterdam Centraal, Utrecht Centraal]"
16,"[Apeldoorn, Deventer, Zutphen, Dieren, Zutphen, Deventer, Apeldoorn, Deventer, Almelo]"
score,4300.459770114943
connections missing,[['Eindhoven': 'Tilburg']: ['Maastricht': 'Sittard']: ['Roermond': 'Weert']: ['Roosendaal': 'Vlissingen']: ['Sittard': 'Heerlen']: ['Sittard': 'Roermond']: ['Weert': 'Eindhoven']: ['s-Hertogenbosch': 'Tilburg']]