train,stations
0,"[Haarlem, Beverwijk, Castricum, Beverwijk, Haarlem, Beverwijk, Zaandam, Amsterdam Sloterdijk, Amsterdam Zuid, Amsterdam Sloterdijk]"
1,"[Schiphol Airport, Amsterdam Zuid, Amsterdam Amstel, Almere Centrum, Lelystad Centrum, Almere Centrum, Hilversum, Almere Centrum, Amsterdam Amstel, Amsterdam Centraal, Almere Centrum]"
2,"[Helmond, Eindhoven, Weert, Eindhoven, Weert, Eindhoven, Weert]"
3,"[Castricum, Alkmaar, Castricum, Beverwijk, Castricum, Alkmaar]"
4,"[s-Hertogenbosch, Tilburg, Eindhoven, s-Hertogenbosch, Oss, s-Hertogenbosch, Oss]"
5,"[Ede-Wageningen, Arnhem Centraal, Ede-Wageningen, Arnhem Centraal, Dieren, Zutphen, Deventer, Apeldoorn, Amersfoort, Zwolle]"
6,"[Ede-Wageningen, Arnhem Centraal, Ede-Wageningen, Arnhem Centraal, Nijmegen, Oss, Nijmegen, Arnhem Centraal]"
7,"[Enschede, Hengelo, Almelo, Deventer]"
8,"[Amsterdam Centraal, Amsterdam Sloterdijk, Haarlem, Heemstede-Aerdenhout, Leiden Centraal, Den Haag Centraal, Leiden Centraal, Den Haag Centraal, Gouda, Alphen a/d Rijn, Gouda, Den Haag Centraal]"
9,"[Heemstede-Aerdenhout, Haarlem, Beverwijk, Castricum, Beverwijk, Zaandam, Beverwijk, Castricum, Zaandam, Beverwijk, Castricum, Beverwijk]"
10,"[Zaandam, Castricum, Zaandam, Beverwijk, Zaandam, Hoorn]"
11,"[Steenwijk, Heerenveen, Leeuwarden, Groningen]"
12,"[Delft, Schiedam Centrum, Delft]"
13,"[Breda, Etten-Leur, Breda, Etten-Leur, Roosendaal, Etten-Leur, Breda, Tilburg, Breda, Etten-Leur, Roosendaal, Etten-Leur, Roosendaal, Vlissingen]"
14,"[Amsterdam Sloterdijk, Amsterdam Centraal, Amsterdam Sloterdijk, Amsterdam Zuid, Amsterdam Sloterdijk, Amsterdam Zuid, Schiphol Airport, Leiden Centraal, Den Haag HS, Leiden Centraal, Den Haag Laan v NOI, Delft, Den Haag HS]"
score,4130.0
connections missing,[['Amsterdam Amstel': 'Hilversum']: ['Assen': 'Zwolle']: ['Den Haag Laan v NOI': 'Gouda']: ['Dordrecht': 'Rotterdam Centraal']: ['Helmond': 'Venlo']: ['Leiden Centraal': 'Alphen a/d Rijn']: ['Maastricht': 'Sittard']: ['Rotterdam Alexander': 'Gouda']: ['Rotterdam Blaak': 'Rotterdam Alexander']: ['Rotterdam Centraal': 'Rotterdam Alexander']: ['Sittard': 'Heerlen']: ['Sittard': 'Roermond']: ['Steenwijk': 'Zwolle']: ['Zwolle': 'Almelo']]