train,stations
0,"[Rotterdam Blaak, Dordrecht, Rotterdam Centraal]"
1,"[Amsterdam Sloterdijk, Haarlem, Amsterdam Sloterdijk, Amsterdam Centraal, Almere Centrum, Amsterdam Amstel, Amsterdam Centraal, Amsterdam Amstel, Hilversum, Almere Centrum]"
2,"[Delft, Schiedam Centrum, Delft]"
3,"[Dieren, Zutphen, Deventer, Zutphen, Apeldoorn, Deventer, Almelo, Hengelo]"
4,"[]"
5,"[Maastricht, Sittard, Roermond, Weert, Eindhoven, s-Hertogenbosch, Utrecht Centraal]"
6,"[Haarlem, Heemstede-Aerdenhout, Haarlem, Beverwijk, Zaandam, Amsterdam Sloterdijk, Haarlem, Amsterdam Sloterdijk, Amsterdam Zuid, Amsterdam Amstel]"
7,"[Helmond, Eindhoven, Tilburg, s-Hertogenbosch, Utrecht Centraal, Gouda, Rotterdam Alexander, Rotterdam Blaak, Schiedam Centrum, Rotterdam Centraal, Rotterdam Alexander, Rotterdam Centraal, Schiedam Centrum, Rotterdam Blaak]"
8,"[Den Haag HS, Leiden Centraal, Schiphol Airport, Leiden Centraal, Heemstede-Aerdenhout, Haarlem, Beverwijk, Castricum, Beverwijk, Castricum, Zaandam, Hoorn]"
9,"[Nijmegen, Oss, s-Hertogenbosch, Oss, Nijmegen, Arnhem Centraal, Nijmegen, Oss]"
10,"[Schiphol Airport, Amsterdam Zuid, Schiphol Airport, Leiden Centraal, Den Haag HS]"
11,"[Amsterdam Sloterdijk, Amsterdam Centraal, Utrecht Centraal, Amersfoort, Apeldoorn]"
12,"[Rotterdam Centraal, Schiedam Centrum, Rotterdam Centraal, Rotterdam Alexander, Gouda, Den Haag HS, Delft, Schiedam Centrum, Rotterdam Centraal, Schiedam Centrum, Delft, Schiedam Centrum, Delft, Den Haag Laan v NOI, Leiden Centraal]"
score,4934.747126436781
connections missing,[['Alkmaar': 'Hoorn']: ['Alkmaar': 'Den Helder']: ['Breda': 'Dordrecht']: ['Den Haag Centraal': 'Gouda']: ['Gouda': 'Alphen a/d Rijn']: ['Helmond': 'Venlo']: ['Roosendaal': 'Vlissingen']: ['Sittard': 'Heerlen']: ['Utrecht Centraal': 'Hilversum']: ['Utrecht Centraal': 'Alphen a/d Rijn']: ['Zwolle': 'Amersfoort']: ['Zwolle': 'Deventer']: ['Zwolle': 'Almelo']]