train,stations
0,"[]"
1,"[Den Haag Laan v NOI, Leiden Centraal, Alphen a/d Rijn, Gouda, Den Haag Centraal, Leiden Centraal, Den Haag HS, Delft, Schiedam Centrum, Delft]"
2,"[Zaandam, Hoorn, Alkmaar, Castricum, Beverwijk, Castricum]"
3,"[Heemstede-Aerdenhout, Haarlem, Amsterdam Sloterdijk, Amsterdam Zuid, Amsterdam Sloterdijk, Amsterdam Zuid]"
4,"[Rotterdam Alexander, Gouda, Den Haag Laan v NOI, Leiden Centraal, Den Haag Centraal, Delft]"
5,"[Lelystad Centrum, Almere Centrum, Hilversum, Utrecht Centraal, Schiphol Airport, Amsterdam Zuid, Amsterdam Amstel, Utrecht Centraal, Amsterdam Centraal, Amsterdam Sloterdijk, Amsterdam Centraal, Amsterdam Sloterdijk, Zaandam]"
6,"[Zutphen, Dieren, Zutphen, Dieren, Arnhem Centraal, Dieren, Zutphen, Dieren, Zutphen, Deventer, Apeldoorn, Deventer, Zwolle]"
7,"[]"
8,"[Enschede, Hengelo, Almelo, Deventer, Zwolle, Steenwijk]"
9,"[Schiphol Airport, Amsterdam Zuid, Schiphol Airport]"
10,"[]"
11,"[Utrecht Centraal, Amersfoort, Zwolle, Assen, Groningen, Assen]"
score,4298.449438202247
connections missing,[['Alkmaar': 'Den Helder']: ['Amsterdam Centraal': 'Almere Centrum']: ['Apeldoorn': 'Amersfoort']: ['Arnhem Centraal': 'Ede-Wageningen']: ['Eindhoven': 'Helmond']: ['Eindhoven': 's-Hertogenbosch']: ['Eindhoven': 'Tilburg']: ['Haarlem': 'Beverwijk']: ['Helmond': 'Venlo']: ['Maastricht': 'Sittard']: ['Nijmegen': 'Arnhem Centraal']: ['Oss': 'Nijmegen']: ['Roermond': 'Weert']: ['Roosendaal': 'Vlissingen']: ['Sittard': 'Heerlen']: ['Sittard': 'Roermond']: ['Utrecht Centraal': 'Alphen a/d Rijn']: ['Utrecht Centraal': 's-Hertogenbosch']: ['Weert': 'Eindhoven']: ['Zaandam': 'Beverwijk']: ['s-Hertogenbosch': 'Oss']]