train,stations
3,"[Schiphol Airport, Leiden Centraal, Den Haag Laan v NOI, Gouda, Alphen a/d Rijn, Leiden Centraal, Den Haag HS, Leiden Centraal]"
5,"[Zaandam, Amsterdam Sloterdijk, Amsterdam Centraal, Amsterdam Sloterdijk, Amsterdam Zuid, Amsterdam Amstel, Hilversum, Utrecht Centraal, Gouda, Rotterdam Alexander]"
11,"[Amsterdam Sloterdijk, Haarlem, Heemstede-Aerdenhout, Haarlem, Amsterdam Sloterdijk, Haarlem, Heemstede-Aerdenhout, Haarlem, Amsterdam Sloterdijk, Zaandam, Castricum, Beverwijk]"
12,"[Breda, Etten-Leur, Roosendaal, Dordrecht, Rotterdam Blaak, Rotterdam Alexander, Rotterdam Blaak]"
14,"[Den Haag Laan v NOI, Gouda, Den Haag HS, Delft, Den Haag HS, Delft, Schiedam Centrum, Rotterdam Centraal, Dordrecht, Breda, Tilburg, Breda]"
15,"[Ede-Wageningen, Arnhem Centraal, Dieren, Zutphen, Deventer, Apeldoorn, Zutphen, Dieren, Zutphen, Deventer, Almelo, Hengelo]"
19,"[Eindhoven, s-Hertogenbosch, Oss, Nijmegen, Arnhem Centraal, Ede-Wageningen, Utrecht Centraal, Amsterdam Centraal]"
22,"[Almere Centrum, Amsterdam Centraal, Utrecht Centraal, Schiphol Airport, Amsterdam Zuid, Amsterdam Amstel, Utrecht Centraal, Amersfoort]"
25,"[Amsterdam Sloterdijk, Amsterdam Centraal, Amsterdam Sloterdijk, Zaandam, Hoorn, Alkmaar, Castricum, Zaandam, Beverwijk, Haarlem, Heemstede-Aerdenhout, Leiden Centraal, Den Haag HS, Delft]"
27,"[Zwolle, Assen, Groningen, Leeuwarden, Heerenveen, Steenwijk, Zwolle, Deventer]"
28,"[Sittard, Heerlen, Sittard, Maastricht, Sittard, Roermond, Weert, Eindhoven, Helmond, Eindhoven, Tilburg]"
score,5873.404494382023
connections missing,[['Alkmaar': 'Den Helder']: ['Almere Centrum': 'Lelystad Centrum']: ['Apeldoorn': 'Amersfoort']: ['Helmond': 'Venlo']: ['Hilversum': 'Almere Centrum']: ['Roosendaal': 'Vlissingen']: ['Utrecht Centraal': 's-Hertogenbosch']: ['Zwolle': 'Amersfoort']: ['Zwolle': 'Almelo']: ['s-Hertogenbosch': 'Tilburg']]