train,stations
1,"[]"
2,"[]"
3,"[Utrecht Centraal, Alphen a/d Rijn, Gouda, Rotterdam Alexander, Rotterdam Centraal, Schiedam Centrum, Rotterdam Centraal, Schiedam Centrum, Rotterdam Centraal, Rotterdam Alexander, Rotterdam Centraal]"
4,"[Den Haag Laan v NOI, Gouda, Rotterdam Alexander, Gouda, Alphen a/d Rijn, Leiden Centraal, Heemstede-Aerdenhout, Haarlem, Amsterdam Sloterdijk, Haarlem, Heemstede-Aerdenhout, Haarlem, Amsterdam Sloterdijk]"
8,"[Amsterdam Centraal, Almere Centrum, Amsterdam Amstel, Amsterdam Zuid, Schiphol Airport]"
11,"[Den Helder, Alkmaar, Castricum, Zaandam, Amsterdam Sloterdijk, Zaandam, Beverwijk, Haarlem, Beverwijk]"
12,"[Tilburg, s-Hertogenbosch, Oss]"
13,"[Enschede, Hengelo, Almelo]"
15,"[Leiden Centraal, Den Haag Centraal, Gouda, Utrecht Centraal, Amsterdam Amstel, Amsterdam Centraal, Amsterdam Sloterdijk, Haarlem, Beverwijk, Castricum, Zaandam, Amsterdam Sloterdijk]"
16,"[Schiedam Centrum, Rotterdam Centraal, Schiedam Centrum, Rotterdam Centraal, Schiedam Centrum]"
20,"[Utrecht Centraal, Hilversum, Almere Centrum, Amsterdam Amstel, Amsterdam Zuid, Schiphol Airport]"
21,"[Dieren, Zutphen, Deventer, Apeldoorn, Deventer, Zwolle, Deventer, Zutphen, Apeldoorn, Amersfoort, Zwolle]"
25,"[Venlo, Helmond, Eindhoven, Tilburg, Breda, Etten-Leur, Roosendaal, Vlissingen]"
26,"[Maastricht, Sittard, Heerlen, Sittard, Roermond, Weert, Eindhoven, s-Hertogenbosch, Utrecht Centraal, Hilversum, Amsterdam Amstel]"
27,"[Heerenveen, Steenwijk, Zwolle, Assen, Groningen, Leeuwarden, Heerenveen, Leeuwarden, Heerenveen]"
score,5420.561797752809
connections missing,[['Alkmaar': 'Hoorn']: ['Almere Centrum': 'Lelystad Centrum']: ['Utrecht Centraal': 'Schiphol Airport']: ['Zwolle': 'Almelo']]