train,stations
0,"[Haarlem, Heemstede-Aerdenhout, Leiden Centraal, Alphen a/d Rijn, Leiden Centraal, Den Haag Laan v NOI, Gouda, Rotterdam Alexander, Rotterdam Blaak, Schiedam Centrum, Rotterdam Centraal, Dordrecht, Breda, Etten-Leur]"
1,"[Helmond, Eindhoven, s-Hertogenbosch, Tilburg, Eindhoven, Tilburg, s-Hertogenbosch, Oss]"
2,"[s-Hertogenbosch, Utrecht Centraal, Schiphol Airport, Leiden Centraal, Schiphol Airport, Amsterdam Zuid, Schiphol Airport, Amsterdam Zuid]"
3,"[]"
4,"[Sittard, Roermond]"
5,"[Hilversum, Amsterdam Amstel, Amsterdam Centraal, Amsterdam Sloterdijk, Amsterdam Centraal, Amsterdam Sloterdijk, Amsterdam Centraal, Amsterdam Sloterdijk, Amsterdam Centraal, Utrecht Centraal]"
6,"[Zutphen, Dieren, Zutphen, Apeldoorn, Amersfoort, Utrecht Centraal, Amersfoort]"
7,"[Roosendaal, Dordrecht, Rotterdam Blaak, Rotterdam Alexander, Rotterdam Centraal, Schiedam Centrum]"
8,"[Delft, Schiedam Centrum, Rotterdam Centraal, Schiedam Centrum]"
9,"[Alkmaar, Castricum, Beverwijk, Haarlem, Amsterdam Sloterdijk, Amsterdam Centraal]"
10,"[Arnhem Centraal, Nijmegen, Arnhem Centraal, Ede-Wageningen, Arnhem Centraal, Dieren, Zutphen, Dieren, Arnhem Centraal, Nijmegen, Oss, s-Hertogenbosch, Oss, s-Hertogenbosch]"
11,"[Amsterdam Sloterdijk, Amsterdam Centraal, Amsterdam Amstel, Utrecht Centraal]"
12,"[Leeuwarden, Heerenveen, Steenwijk, Zwolle, Deventer, Apeldoorn, Deventer]"
13,"[]"
14,"[Enschede, Hengelo, Almelo, Hengelo, Enschede, Hengelo, Enschede, Hengelo, Enschede, Hengelo, Enschede, Hengelo, Almelo]"
15,"[Breda, Etten-Leur, Breda, Etten-Leur]"
score,4426.574712643678
connections missing,[['Alkmaar': 'Hoorn']: ['Alkmaar': 'Den Helder']: ['Amsterdam Amstel': 'Almere Centrum']: ['Assen': 'Zwolle']: ['Roosendaal': 'Vlissingen']: ['Zaandam': 'Hoorn']: ['Zaandam': 'Castricum']: ['Zaandam': 'Beverwijk']: ['Zwolle': 'Amersfoort']: ['Zwolle': 'Almelo']]