train,stations
0,"[Amsterdam Amstel, Amsterdam Centraal, Utrecht Centraal, Gouda, Den Haag Centraal, Gouda]"
1,"[Gouda, Den Haag HS, Delft, Schiedam Centrum, Rotterdam Centraal, Rotterdam Alexander, Rotterdam Blaak, Rotterdam Alexander, Gouda, Utrecht Centraal, Amersfoort, Apeldoorn, Deventer, Apeldoorn, Amersfoort]"
2,"[Rotterdam Blaak, Dordrecht, Roosendaal, Etten-Leur, Breda, Etten-Leur, Breda, Tilburg]"
3,"[Amsterdam Zuid, Amsterdam Amstel, Amsterdam Centraal, Almere Centrum, Lelystad Centrum, Almere Centrum, Amsterdam Amstel, Amsterdam Zuid, Schiphol Airport, Amsterdam Zuid]"
4,"[Den Haag HS, Leiden Centraal, Den Haag Laan v NOI, Delft, Den Haag Centraal, Leiden Centraal]"
5,"[Zaandam, Amsterdam Sloterdijk, Zaandam, Castricum, Zaandam, Hoorn, Zaandam, Beverwijk]"
6,"[Zutphen, Deventer]"
7,"[Zutphen, Dieren, Arnhem Centraal, Dieren, Arnhem Centraal, Nijmegen, Arnhem Centraal, Dieren, Zutphen, Deventer, Almelo, Hengelo, Enschede]"
8,"[]"
9,"[Amsterdam Centraal, Amsterdam Sloterdijk, Amsterdam Centraal, Almere Centrum, Amsterdam Centraal, Almere Centrum]"
10,"[Den Helder, Alkmaar, Castricum, Zaandam, Amsterdam Sloterdijk, Haarlem, Heemstede-Aerdenhout, Leiden Centraal, Heemstede-Aerdenhout, Haarlem, Beverwijk, Zaandam, Beverwijk]"
score,3571.213483146067
connections missing,[['Alkmaar': 'Hoorn']: ['Amsterdam Amstel': 'Hilversum']: ['Amsterdam Zuid': 'Amsterdam Sloterdijk']: ['Assen': 'Zwolle']: ['Breda': 'Dordrecht']: ['Den Haag Laan v NOI': 'Gouda']: ['Dordrecht': 'Rotterdam Centraal']: ['Eindhoven': 'Helmond']: ['Eindhoven': 's-Hertogenbosch']: ['Gouda': 'Alphen a/d Rijn']: ['Groningen': 'Assen']: ['Helmond': 'Venlo']: ['Hilversum': 'Almere Centrum']: ['Maastricht': 'Sittard']: ['Oss': 'Nijmegen']: ['Roermond': 'Weert']: ['Roosendaal': 'Vlissingen']: ['Rotterdam Blaak': 'Schiedam Centrum']: ['Sittard': 'Heerlen']: ['Sittard': 'Roermond']: ['Steenwijk': 'Zwolle']: ['Utrecht Centraal': 'Hilversum']: ['Utrecht Centraal': 'Alphen a/d Rijn']: ['Utrecht Centraal': 'Schiphol Airport']: ['Utrecht Centraal': 's-Hertogenbosch']: ['Weert': 'Eindhoven']: ['Zwolle': 'Amersfoort']: ['Zwolle': 'Deventer']: ['Zwolle': 'Almelo']: ['s-Hertogenbosch': 'Oss']]