train,stations
0,"[Amsterdam Amstel, Amsterdam Centraal, Amsterdam Sloterdijk, Zaandam, Amsterdam Sloterdijk, Amsterdam Centraal, Amsterdam Sloterdijk, Haarlem]"
1,"[Amsterdam Amstel, Utrecht Centraal, s-Hertogenbosch, Oss, Nijmegen, Arnhem Centraal, Dieren]"
2,"[Castricum, Alkmaar, Hoorn, Zaandam, Beverwijk, Castricum, Alkmaar, Castricum, Alkmaar, Castricum]"
3,"[Heemstede-Aerdenhout, Leiden Centraal, Den Haag Laan v NOI, Delft, Den Haag Centraal, Leiden Centraal, Den Haag HS]"
4,"[Heerenveen]"
5,"[Zaandam, Amsterdam Sloterdijk, Amsterdam Zuid, Schiphol Airport, Amsterdam Zuid, Schiphol Airport, Amsterdam Zuid, Schiphol Airport, Amsterdam Zuid, Schiphol Airport, Leiden Centraal, Schiphol Airport]"
6,"[Roosendaal, Etten-Leur, Breda, Tilburg, s-Hertogenbosch, Oss, s-Hertogenbosch, Eindhoven, Weert, Eindhoven]"
7,"[Amsterdam Zuid, Amsterdam Amstel, Almere Centrum, Lelystad Centrum, Almere Centrum, Lelystad Centrum, Almere Centrum, Amsterdam Centraal, Utrecht Centraal]"
8,"[Zutphen, Dieren, Zutphen, Dieren, Zutphen, Deventer, Almelo, Hengelo, Enschede, Hengelo, Enschede]"
9,"[Amersfoort, Utrecht Centraal, Alphen a/d Rijn, Leiden Centraal, Den Haag Centraal, Delft]"
10,"[Maastricht, Sittard]"
11,"[Helmond, Eindhoven, Weert, Roermond]"
12,"[Haarlem, Heemstede-Aerdenhout, Haarlem, Heemstede-Aerdenhout, Haarlem, Beverwijk, Castricum, Zaandam, Amsterdam Sloterdijk, Amsterdam Zuid, Schiphol Airport, Utrecht Centraal]"
13,"[Eindhoven, Tilburg, Breda]"
score,4778.689655172413
connections missing,[['Alkmaar': 'Den Helder']: ['Amsterdam Amstel': 'Hilversum']: ['Apeldoorn': 'Amersfoort']: ['Assen': 'Zwolle']: ['Den Haag HS': 'Gouda']: ['Den Haag Laan v NOI': 'Gouda']: ['Gouda': 'Alphen a/d Rijn']: ['Leeuwarden': 'Heerenveen']: ['Roosendaal': 'Vlissingen']: ['Utrecht Centraal': 'Ede-Wageningen']: ['Zwolle': 'Amersfoort']: ['Zwolle': 'Almelo']]