train,stations
0,"[Schiphol Airport, Amsterdam Zuid, Amsterdam Sloterdijk, Amsterdam Centraal, Almere Centrum, Hilversum, Utrecht Centraal]"
3,"[Delft, Den Haag Laan v NOI, Leiden Centraal, Den Haag Centraal, Delft, Schiedam Centrum, Rotterdam Centraal, Schiedam Centrum, Rotterdam Centraal, Schiedam Centrum]"
5,"[Schiedam Centrum, Rotterdam Centraal, Schiedam Centrum, Delft, Den Haag HS, Delft, Schiedam Centrum, Rotterdam Blaak, Dordrecht, Breda, Etten-Leur, Breda, Tilburg, Eindhoven, Helmond]"
6,"[Haarlem, Heemstede-Aerdenhout, Leiden Centraal, Den Haag Laan v NOI, Leiden Centraal, Heemstede-Aerdenhout, Leiden Centraal, Den Haag Centraal, Leiden Centraal, Den Haag HS, Delft]"
8,"[s-Hertogenbosch, Oss, s-Hertogenbosch, Eindhoven, Weert, Roermond, Sittard, Roermond, Sittard, Heerlen, Sittard]"
9,"[Utrecht Centraal, Gouda, Den Haag HS, Delft, Schiedam Centrum]"
10,"[Hoorn, Alkmaar, Castricum, Zaandam, Castricum, Beverwijk, Haarlem, Heemstede-Aerdenhout, Haarlem, Amsterdam Sloterdijk, Amsterdam Centraal, Amsterdam Amstel, Amsterdam Zuid, Amsterdam Amstel, Amsterdam Centraal, Amsterdam Sloterdijk]"
12,"[Hengelo, Enschede, Hengelo, Enschede, Hengelo, Almelo, Deventer, Zwolle, Steenwijk, Heerenveen, Leeuwarden, Groningen]"
13,"[Apeldoorn, Zutphen, Deventer, Apeldoorn, Amersfoort, Utrecht Centraal, Ede-Wageningen, Arnhem Centraal, Dieren, Arnhem Centraal, Nijmegen]"
16,"[Leiden Centraal, Alphen a/d Rijn, Utrecht Centraal, Amsterdam Amstel, Almere Centrum, Lelystad Centrum, Almere Centrum, Amsterdam Centraal, Amsterdam Amstel, Hilversum]"
17,"[Hoorn, Alkmaar, Hoorn, Zaandam, Amsterdam Sloterdijk, Amsterdam Zuid, Schiphol Airport, Leiden Centraal, Den Haag Laan v NOI, Gouda, Rotterdam Alexander, Rotterdam Centraal]"
score,5499.3258426966295
connections missing,[['Alkmaar': 'Den Helder']: ['Assen': 'Zwolle']: ['Den Haag Centraal': 'Gouda']: ['Groningen': 'Assen']: ['Helmond': 'Venlo']: ['Roosendaal': 'Vlissingen']: ['Utrecht Centraal': 'Schiphol Airport']: ['Utrecht Centraal': 's-Hertogenbosch']: ['Zaandam': 'Beverwijk']: ['Zutphen': 'Dieren']: ['Zwolle': 'Amersfoort']: ['Zwolle': 'Almelo']: ['s-Hertogenbosch': 'Tilburg']]