train,stations
0,"[Groningen, Leeuwarden, Heerenveen, Steenwijk, Zwolle, Assen, Groningen, Assen]"
1,"[Dordrecht, Rotterdam Blaak, Dordrecht, Breda, Tilburg, Breda, Etten-Leur, Roosendaal, Dordrecht, Rotterdam Centraal, Rotterdam Alexander, Rotterdam Blaak, Rotterdam Alexander, Rotterdam Centraal, Schiedam Centrum, Rotterdam Centraal, Schiedam Centrum]"
2,"[Rotterdam Alexander, Gouda, Rotterdam Alexander, Rotterdam Centraal, Schiedam Centrum, Delft, Den Haag Centraal, Gouda, Utrecht Centraal, Amsterdam Centraal, Amsterdam Sloterdijk, Zaandam, Castricum, Zaandam, Hoorn]"
3,"[Leiden Centraal, Alphen a/d Rijn, Gouda, Rotterdam Alexander, Rotterdam Blaak, Dordrecht, Rotterdam Blaak, Dordrecht, Rotterdam Centraal, Rotterdam Alexander, Rotterdam Centraal, Schiedam Centrum, Rotterdam Blaak, Rotterdam Alexander, Rotterdam Centraal]"
4,"[Arnhem Centraal, Ede-Wageningen, Utrecht Centraal, Hilversum, Utrecht Centraal, Amsterdam Amstel, Hilversum, Utrecht Centraal, Amersfoort, Utrecht Centraal, Hilversum]"
5,"[Amsterdam Sloterdijk, Haarlem, Beverwijk, Castricum, Zaandam, Hoorn, Alkmaar, Castricum, Beverwijk, Castricum, Beverwijk, Castricum, Beverwijk]"
6,"[Haarlem, Heemstede-Aerdenhout, Haarlem, Heemstede-Aerdenhout, Leiden Centraal, Heemstede-Aerdenhout, Haarlem, Heemstede-Aerdenhout, Haarlem, Heemstede-Aerdenhout, Leiden Centraal]"
7,"[Rotterdam Blaak, Dordrecht, Rotterdam Centraal, Rotterdam Alexander, Rotterdam Centraal, Schiedam Centrum, Rotterdam Blaak, Dordrecht, Roosendaal, Etten-Leur, Roosendaal, Dordrecht, Rotterdam Blaak, Schiedam Centrum, Rotterdam Centraal, Schiedam Centrum]"
8,"[Heerlen, Sittard, Maastricht, Sittard, Roermond, Sittard, Roermond, Weert, Roermond, Weert, Roermond, Weert, Eindhoven]"
9,"[Enschede, Hengelo, Almelo, Deventer, Zutphen, Dieren, Zutphen, Dieren, Zutphen]"
10,"[Gouda, Rotterdam Alexander, Gouda, Den Haag Laan v NOI, Delft, Den Haag Centraal, Leiden Centraal, Schiphol Airport, Leiden Centraal, Den Haag HS, Delft, Den Haag HS, Gouda]"
11,"[Zutphen, Dieren, Zutphen, Deventer, Zwolle, Amersfoort, Utrecht Centraal, Amersfoort, Apeldoorn, Deventer, Apeldoorn]"
12,"[Amsterdam Amstel, Amsterdam Centraal, Amsterdam Sloterdijk, Amsterdam Zuid, Schiphol Airport, Utrecht Centraal, Hilversum, Almere Centrum, Amsterdam Centraal, Amsterdam Amstel, Amsterdam Zuid, Schiphol Airport, Amsterdam Zuid]"
13,"[Amersfoort, Apeldoorn, Deventer, Apeldoorn, Zutphen, Dieren, Arnhem Centraal, Ede-Wageningen, Arnhem Centraal, Nijmegen, Oss, s-Hertogenbosch, Tilburg, Eindhoven]"
14,"[Eindhoven, Helmond, Eindhoven, s-Hertogenbosch, Eindhoven, s-Hertogenbosch, Utrecht Centraal, Gouda, Rotterdam Alexander, Rotterdam Blaak, Rotterdam Alexander, Rotterdam Blaak, Rotterdam Alexander, Gouda]"
15,"[Almere Centrum, Lelystad Centrum, Almere Centrum, Amsterdam Amstel, Amsterdam Centraal, Utrecht Centraal, Alphen a/d Rijn, Leiden Centraal, Den Haag Laan v NOI, Leiden Centraal, Schiphol Airport, Amsterdam Zuid]"
16,"[Utrecht Centraal, Hilversum, Utrecht Centraal, Gouda, Rotterdam Alexander, Rotterdam Blaak, Schiedam Centrum, Delft, Den Haag HS, Delft, Schiedam Centrum, Rotterdam Blaak, Dordrecht, Rotterdam Blaak]"
17,"[Breda, Tilburg, Breda, Etten-Leur, Breda, Tilburg, Breda, Etten-Leur, Roosendaal, Etten-Leur, Roosendaal, Vlissingen]"
18,"[Amsterdam Zuid, Schiphol Airport, Amsterdam Zuid, Amsterdam Sloterdijk, Zaandam, Beverwijk, Castricum, Alkmaar, Den Helder, Alkmaar, Castricum, Beverwijk]"
score,4833.2808988764045
connections missing,[['Helmond': 'Venlo']: ['Zwolle': 'Almelo']]