train,stations
0,"[Breda, Tilburg, Breda, Etten-Leur, Breda, Dordrecht, Rotterdam Blaak, Dordrecht, Rotterdam Blaak, Rotterdam Alexander, Rotterdam Centraal, Schiedam Centrum, Rotterdam Centraal, Schiedam Centrum, Delft, Schiedam Centrum]"
1,"[Rotterdam Blaak, Rotterdam Alexander, Rotterdam Centraal, Dordrecht, Breda, Etten-Leur, Roosendaal, Etten-Leur, Roosendaal, Etten-Leur, Breda, Etten-Leur]"
2,"[Hengelo, Enschede, Hengelo, Enschede, Hengelo, Enschede, Hengelo, Almelo, Deventer, Zwolle, Steenwijk]"
3,"[Apeldoorn, Amersfoort, Zwolle, Almelo, Hengelo, Enschede, Hengelo]"
4,"[Gouda, Rotterdam Alexander, Rotterdam Blaak, Schiedam Centrum, Delft, Den Haag Centraal, Delft, Schiedam Centrum, Rotterdam Centraal]"
5,"[Rotterdam Alexander, Gouda, Den Haag Laan v NOI, Leiden Centraal]"
6,"[Dieren, Zutphen, Apeldoorn, Deventer, Almelo, Deventer, Zutphen, Dieren, Arnhem Centraal, Ede-Wageningen]"
7,"[Maastricht, Sittard, Heerlen, Sittard]"
8,"[Amsterdam Centraal, Amsterdam Amstel, Amsterdam Centraal, Almere Centrum, Amsterdam Centraal, Utrecht Centraal, Ede-Wageningen, Arnhem Centraal]"
9,"[Den Helder, Alkmaar, Castricum, Beverwijk, Haarlem, Heemstede-Aerdenhout, Haarlem, Amsterdam Sloterdijk, Amsterdam Zuid, Schiphol Airport, Leiden Centraal]"
10,"[Heerenveen, Steenwijk, Heerenveen, Steenwijk, Heerenveen, Leeuwarden, Heerenveen]"
11,"[Rotterdam Centraal, Schiedam Centrum, Delft, Den Haag Laan v NOI, Gouda, Rotterdam Alexander, Rotterdam Centraal, Schiedam Centrum, Rotterdam Blaak, Dordrecht, Rotterdam Centraal, Schiedam Centrum, Rotterdam Centraal]"
12,"[Zaandam, Castricum, Beverwijk, Haarlem, Heemstede-Aerdenhout, Leiden Centraal, Alphen a/d Rijn, Gouda, Den Haag Centraal]"
13,"[Amsterdam Amstel, Amsterdam Centraal, Almere Centrum, Hilversum, Utrecht Centraal]"
14,"[Eindhoven, Helmond, Eindhoven]"
15,"[Delft, Schiedam Centrum, Rotterdam Blaak, Rotterdam Alexander, Rotterdam Centraal, Schiedam Centrum]"
16,"[Alkmaar, Hoorn, Zaandam, Amsterdam Sloterdijk, Amsterdam Centraal, Amsterdam Sloterdijk, Amsterdam Zuid, Amsterdam Amstel, Amsterdam Zuid, Schiphol Airport, Amsterdam Zuid]"
17,"[Den Haag Laan v NOI, Leiden Centraal, Alphen a/d Rijn]"
18,"[Amsterdam Zuid, Schiphol Airport, Amsterdam Zuid, Schiphol Airport, Utrecht Centraal]"
19,"[Oss, s-Hertogenbosch, Tilburg, s-Hertogenbosch, Oss, Nijmegen, Arnhem Centraal, Ede-Wageningen, Utrecht Centraal]"
score,3990.287356321838
connections missing,[['Almere Centrum': 'Lelystad Centrum']: ['Amsterdam Amstel': 'Almere Centrum']: ['Den Haag HS': 'Gouda']: ['Roosendaal': 'Vlissingen']: ['Zaandam': 'Beverwijk']]