train,stations
0,"[Leiden Centraal, Den Haag Laan v NOI, Leiden Centraal, Schiphol Airport, Leiden Centraal, Den Haag Centraal, Delft, Den Haag Centraal, Delft, Den Haag Centraal, Delft, Schiedam Centrum, Delft]"
1,"[Leeuwarden, Heerenveen, Steenwijk]"
2,"[Den Haag HS, Delft, Den Haag Centraal, Leiden Centraal, Alphen a/d Rijn, Leiden Centraal, Schiphol Airport, Amsterdam Zuid, Schiphol Airport, Amsterdam Zuid, Schiphol Airport, Leiden Centraal, Schiphol Airport, Amsterdam Zuid, Schiphol Airport]"
3,"[Arnhem Centraal, Ede-Wageningen, Arnhem Centraal, Ede-Wageningen, Arnhem Centraal, Nijmegen, Oss, s-Hertogenbosch, Eindhoven, Helmond, Eindhoven, Helmond, Venlo]"
4,"[Rotterdam Blaak, Schiedam Centrum, Delft, Den Haag HS, Gouda, Rotterdam Alexander, Rotterdam Centraal, Dordrecht, Breda, Dordrecht, Rotterdam Blaak, Rotterdam Alexander]"
5,"[Rotterdam Alexander, Rotterdam Blaak, Schiedam Centrum, Rotterdam Centraal, Rotterdam Alexander, Gouda, Den Haag Laan v NOI, Delft, Den Haag Centraal, Delft, Den Haag HS, Leiden Centraal, Heemstede-Aerdenhout, Haarlem, Heemstede-Aerdenhout]"
6,"[Heerenveen, Steenwijk, Zwolle, Amersfoort, Apeldoorn, Zutphen, Dieren, Zutphen, Apeldoorn, Zutphen]"
7,"[Castricum, Alkmaar, Hoorn, Alkmaar, Castricum, Zaandam, Beverwijk, Zaandam, Amsterdam Sloterdijk, Zaandam, Amsterdam Sloterdijk, Amsterdam Zuid, Amsterdam Amstel]"
8,"[Maastricht, Sittard, Roermond, Sittard, Heerlen, Sittard, Roermond, Weert, Eindhoven, Tilburg, Breda, Tilburg]"
9,"[s-Hertogenbosch, Oss, s-Hertogenbosch, Oss, s-Hertogenbosch, Tilburg, s-Hertogenbosch, Oss, Nijmegen, Arnhem Centraal, Dieren, Zutphen, Deventer, Apeldoorn, Amersfoort]"
10,"[Etten-Leur, Roosendaal, Etten-Leur, Breda, Tilburg, s-Hertogenbosch, Eindhoven, Helmond, Eindhoven, Weert, Eindhoven, Helmond]"
11,"[Etten-Leur, Breda, Tilburg, s-Hertogenbosch, Eindhoven, Tilburg, Breda, Dordrecht, Roosendaal]"
12,"[Nijmegen, Arnhem Centraal, Ede-Wageningen, Arnhem Centraal, Dieren, Zutphen, Dieren, Arnhem Centraal]"
13,"[Enschede, Hengelo, Almelo, Hengelo, Enschede, Hengelo, Almelo, Hengelo, Enschede, Hengelo, Almelo, Deventer, Apeldoorn, Deventer, Zutphen]"
14,"[Amsterdam Zuid, Amsterdam Amstel, Amsterdam Zuid, Amsterdam Sloterdijk, Haarlem, Beverwijk, Castricum, Zaandam, Castricum, Alkmaar, Hoorn, Zaandam]"
15,"[Amsterdam Sloterdijk, Amsterdam Centraal, Amsterdam Amstel, Hilversum, Almere Centrum, Lelystad Centrum, Almere Centrum, Amsterdam Centraal, Amsterdam Amstel, Amsterdam Centraal]"
16,"[Castricum, Beverwijk, Castricum, Zaandam, Hoorn, Zaandam, Hoorn, Alkmaar, Den Helder]"
17,"[Assen, Zwolle, Amersfoort, Zwolle]"
18,"[Almelo, Zwolle, Deventer, Almelo, Hengelo, Almelo, Hengelo, Enschede, Hengelo]"
score,4265.0
connections missing,[['Amsterdam Amstel': 'Almere Centrum']: ['Den Haag Centraal': 'Gouda']: ['Gouda': 'Alphen a/d Rijn']: ['Groningen': 'Assen']: ['Leeuwarden': 'Groningen']: ['Roosendaal': 'Vlissingen']]