train,stations
0,"[Deventer, Zutphen, Deventer, Zutphen, Dieren, Arnhem Centraal, Ede-Wageningen, Arnhem Centraal, Dieren, Arnhem Centraal, Dieren, Arnhem Centraal, Ede-Wageningen, Utrecht Centraal]"
1,"[Den Haag Centraal, Gouda, Utrecht Centraal, Gouda, Utrecht Centraal, Amsterdam Amstel, Utrecht Centraal, Gouda, Rotterdam Alexander, Gouda, Den Haag HS, Delft]"
2,"[Steenwijk, Heerenveen, Steenwijk, Heerenveen, Leeuwarden, Groningen, Assen, Zwolle]"
3,"[Zaandam, Amsterdam Sloterdijk, Amsterdam Centraal, Amsterdam Sloterdijk, Zaandam, Amsterdam Sloterdijk, Amsterdam Zuid, Amsterdam Amstel, Amsterdam Centraal, Amsterdam Sloterdijk, Amsterdam Centraal, Almere Centrum, Hilversum]"
4,"[Heerenveen, Steenwijk, Zwolle, Almelo, Hengelo, Enschede, Hengelo, Enschede, Hengelo, Almelo, Deventer, Zutphen, Dieren]"
5,"[Schiedam Centrum, Delft, Den Haag Centraal, Leiden Centraal, Schiphol Airport, Amsterdam Zuid, Schiphol Airport, Utrecht Centraal, Hilversum, Amsterdam Amstel, Almere Centrum, Lelystad Centrum]"
6,"[Deventer, Apeldoorn, Zutphen, Deventer, Zwolle, Amersfoort, Apeldoorn, Zutphen, Deventer, Apeldoorn]"
7,"[Breda, Tilburg, s-Hertogenbosch, Eindhoven, Tilburg, Breda, Etten-Leur, Roosendaal, Etten-Leur, Breda, Etten-Leur, Breda, Dordrecht, Roosendaal]"
8,"[Schiedam Centrum, Rotterdam Centraal, Schiedam Centrum, Delft, Den Haag HS, Leiden Centraal, Den Haag Laan v NOI, Gouda, Den Haag Centraal, Leiden Centraal, Alphen a/d Rijn, Gouda, Rotterdam Alexander, Rotterdam Blaak, Dordrecht]"
9,"[Schiedam Centrum, Delft, Den Haag HS, Delft, Den Haag Centraal, Gouda, Alphen a/d Rijn, Leiden Centraal, Den Haag Centraal, Leiden Centraal, Den Haag HS, Gouda, Alphen a/d Rijn, Leiden Centraal]"
10,"[Oss, Nijmegen, Oss, Nijmegen, Arnhem Centraal, Nijmegen, Oss, s-Hertogenbosch, Utrecht Centraal, Amersfoort, Utrecht Centraal, Hilversum]"
11,"[Roosendaal, Etten-Leur, Roosendaal, Dordrecht, Rotterdam Centraal, Dordrecht, Rotterdam Centraal, Schiedam Centrum, Delft, Den Haag Laan v NOI, Delft, Den Haag Laan v NOI, Leiden Centraal, Heemstede-Aerdenhout, Leiden Centraal]"
12,"[Venlo, Helmond, Eindhoven, Weert, Eindhoven, Weert, Roermond, Sittard, Heerlen, Sittard, Maastricht, Sittard]"
13,"[Rotterdam Alexander, Rotterdam Blaak, Rotterdam Alexander, Rotterdam Blaak, Schiedam Centrum, Rotterdam Blaak, Schiedam Centrum, Rotterdam Centraal, Rotterdam Alexander, Rotterdam Blaak, Dordrecht]"
14,"[Castricum, Alkmaar, Castricum, Beverwijk, Haarlem, Heemstede-Aerdenhout, Haarlem, Amsterdam Sloterdijk, Zaandam, Beverwijk, Castricum, Zaandam, Hoorn, Alkmaar]"
15,"[Hilversum, Almere Centrum, Amsterdam Centraal, Amsterdam Sloterdijk, Haarlem, Amsterdam Sloterdijk, Zaandam, Amsterdam Sloterdijk, Amsterdam Centraal, Utrecht Centraal, Alphen a/d Rijn]"
score,5591.2808988764045
connections missing,[['Alkmaar': 'Den Helder']: ['Roosendaal': 'Vlissingen']]