train,stations
0,"[Leiden Centraal, Den Haag Laan v NOI, Delft, Den Haag HS, Delft, Schiedam Centrum, Rotterdam Centraal, Rotterdam Alexander, Gouda, Utrecht Centraal, Alphen a/d Rijn, Leiden Centraal, Den Haag Centraal, Leiden Centraal, Heemstede-Aerdenhout, Haarlem, Heemstede-Aerdenhout]"
1,"[Apeldoorn, Amersfoort, Zwolle, Almelo, Deventer, Zwolle, Steenwijk]"
2,"[Assen, Groningen, Leeuwarden, Heerenveen, Steenwijk, Zwolle, Almelo, Hengelo, Enschede, Hengelo, Enschede]"
3,"[Dieren, Zutphen, Deventer, Apeldoorn, Zutphen, Dieren, Arnhem Centraal, Nijmegen, Arnhem Centraal, Ede-Wageningen, Utrecht Centraal, Schiphol Airport, Amsterdam Zuid]"
4,"[Den Haag Laan v NOI, Gouda, Den Haag Centraal, Leiden Centraal, Den Haag HS, Leiden Centraal, Den Haag HS, Leiden Centraal, Schiphol Airport]"
5,"[Utrecht Centraal, Hilversum, Amsterdam Amstel, Amsterdam Zuid, Schiphol Airport, Amsterdam Zuid, Amsterdam Sloterdijk, Zaandam, Beverwijk, Castricum, Alkmaar, Den Helder]"
6,"[Almere Centrum, Amsterdam Amstel, Amsterdam Centraal, Utrecht Centraal, Amsterdam Amstel, Amsterdam Centraal, Amsterdam Sloterdijk, Amsterdam Centraal, Almere Centrum, Lelystad Centrum, Almere Centrum, Hilversum]"
7,"[Sittard, Maastricht, Sittard, Roermond, Weert, Eindhoven, Tilburg, Breda, Etten-Leur, Roosendaal, Dordrecht, Rotterdam Centraal, Schiedam Centrum, Delft]"
8,"[Venlo, Helmond, Eindhoven, s-Hertogenbosch, Oss, s-Hertogenbosch, Tilburg, Breda, Dordrecht, Rotterdam Blaak, Rotterdam Alexander, Rotterdam Centraal, Schiedam Centrum, Delft, Schiedam Centrum]"
score,5899.606741573034
connections missing,[['Alkmaar': 'Hoorn']: ['Amsterdam Sloterdijk': 'Haarlem']: ['Assen': 'Zwolle']: ['Delft': 'Den Haag Centraal']: ['Den Haag HS': 'Gouda']: ['Gouda': 'Alphen a/d Rijn']: ['Haarlem': 'Beverwijk']: ['Oss': 'Nijmegen']: ['Roosendaal': 'Vlissingen']: ['Rotterdam Blaak': 'Schiedam Centrum']: ['Sittard': 'Heerlen']: ['Utrecht Centraal': 'Amersfoort']: ['Utrecht Centraal': 's-Hertogenbosch']: ['Zaandam': 'Hoorn']: ['Zaandam': 'Castricum']]