train,stations
0,"[Lelystad Centrum, Almere Centrum, Hilversum, Utrecht Centraal]"
1,"[Schiphol Airport, Amsterdam Zuid, Amsterdam Sloterdijk, Haarlem, Heemstede-Aerdenhout, Leiden Centraal, Schiphol Airport, Amsterdam Zuid, Schiphol Airport, Amsterdam Zuid, Amsterdam Amstel, Amsterdam Centraal, Utrecht Centraal]"
2,"[Rotterdam Centraal, Schiedam Centrum, Delft, Schiedam Centrum, Rotterdam Centraal, Rotterdam Alexander, Rotterdam Centraal, Dordrecht, Roosendaal, Etten-Leur, Roosendaal, Etten-Leur, Breda]"
3,"[Breda, Tilburg, s-Hertogenbosch, Tilburg, s-Hertogenbosch, Eindhoven, Helmond, Eindhoven, Helmond, Eindhoven, Weert]"
4,"[Leiden Centraal, Heemstede-Aerdenhout, Haarlem, Heemstede-Aerdenhout, Haarlem, Heemstede-Aerdenhout, Leiden Centraal, Den Haag HS, Delft]"
5,"[Amsterdam Sloterdijk, Zaandam, Hoorn, Alkmaar, Castricum, Zaandam]"
6,"[Amsterdam Amstel, Amsterdam Centraal, Amsterdam Amstel, Amsterdam Centraal, Almere Centrum, Amsterdam Amstel, Utrecht Centraal]"
7,"[Enschede, Hengelo, Enschede, Hengelo, Enschede, Hengelo, Enschede, Hengelo, Enschede, Hengelo, Almelo, Deventer]"
8,"[Breda, Tilburg, s-Hertogenbosch, Oss, Nijmegen, Arnhem Centraal, Ede-Wageningen, Arnhem Centraal, Ede-Wageningen, Arnhem Centraal, Dieren, Arnhem Centraal]"
9,"[Heerenveen, Steenwijk, Zwolle, Deventer, Zutphen, Apeldoorn, Amersfoort, Utrecht Centraal, Amsterdam Amstel, Amsterdam Centraal]"
10,"[Delft, Den Haag Centraal, Leiden Centraal, Den Haag Laan v NOI, Gouda, Den Haag Laan v NOI, Leiden Centraal, Schiphol Airport, Leiden Centraal, Heemstede-Aerdenhout, Haarlem]"
11,"[Schiedam Centrum, Delft, Schiedam Centrum, Rotterdam Blaak, Dordrecht, Rotterdam Blaak, Schiedam Centrum, Rotterdam Blaak, Schiedam Centrum, Rotterdam Blaak, Dordrecht, Rotterdam Centraal, Rotterdam Alexander, Rotterdam Blaak, Dordrecht]"
score,4678.034482758621
connections missing,[['Alkmaar': 'Den Helder']: ['Assen': 'Zwolle']: ['Delft': 'Den Haag Laan v NOI']: ['Den Haag Centraal': 'Gouda']: ['Gouda': 'Alphen a/d Rijn']: ['Helmond': 'Venlo']: ['Leeuwarden': 'Heerenveen']: ['Leiden Centraal': 'Alphen a/d Rijn']: ['Maastricht': 'Sittard']: ['Roermond': 'Weert']: ['Roosendaal': 'Vlissingen']: ['Rotterdam Alexander': 'Gouda']: ['Sittard': 'Heerlen']: ['Sittard': 'Roermond']: ['Utrecht Centraal': 'Alphen a/d Rijn']: ['Utrecht Centraal': 's-Hertogenbosch']: ['Zwolle': 'Amersfoort']: ['Zwolle': 'Almelo']]