train,stations
0,"[Breda, Tilburg, Eindhoven, Weert]"
1,"[Rotterdam Centraal, Dordrecht, Breda, Etten-Leur, Roosendaal, Dordrecht, Rotterdam Centraal, Dordrecht, Rotterdam Blaak]"
2,"[Gouda, Utrecht Centraal, Amersfoort, Zwolle, Deventer]"
3,"[Lelystad Centrum, Almere Centrum, Lelystad Centrum, Almere Centrum, Amsterdam Centraal, Utrecht Centraal, Gouda, Utrecht Centraal, Hilversum]"
4,"[Alkmaar, Castricum, Beverwijk]"
5,"[Amsterdam Sloterdijk, Amsterdam Centraal, Amsterdam Amstel, Hilversum, Amsterdam Amstel, Utrecht Centraal, Gouda, Rotterdam Alexander, Rotterdam Blaak, Schiedam Centrum, Rotterdam Centraal]"
6,"[Heerenveen, Leeuwarden, Groningen, Assen, Zwolle, Steenwijk]"
7,"[Leiden Centraal, Alphen a/d Rijn, Utrecht Centraal, Amsterdam Centraal, Almere Centrum, Amsterdam Amstel, Amsterdam Centraal]"
8,"[Zwolle, Almelo, Deventer, Zutphen, Dieren, Zutphen, Dieren, Zutphen, Dieren, Zutphen]"
9,"[Schiphol Airport, Leiden Centraal, Den Haag Laan v NOI, Gouda, Rotterdam Alexander, Rotterdam Centraal, Rotterdam Alexander, Rotterdam Blaak, Rotterdam Alexander, Rotterdam Blaak, Schiedam Centrum, Rotterdam Centraal, Rotterdam Alexander, Gouda]"
10,"[Gouda, Den Haag HS, Delft, Den Haag Laan v NOI, Delft, Schiedam Centrum, Rotterdam Centraal, Schiedam Centrum, Delft, Den Haag Centraal, Leiden Centraal]"
11,"[s-Hertogenbosch, Oss, Nijmegen, Arnhem Centraal, Dieren, Zutphen, Apeldoorn, Deventer, Apeldoorn, Amersfoort, Utrecht Centraal, Gouda, Den Haag Centraal]"
12,"[Heemstede-Aerdenhout, Haarlem, Heemstede-Aerdenhout, Haarlem, Beverwijk, Castricum, Beverwijk, Castricum, Zaandam, Amsterdam Sloterdijk, Haarlem, Amsterdam Sloterdijk, Amsterdam Zuid]"
score,4515.887640449438
connections missing,[['Alkmaar': 'Den Helder']: ['Almelo': 'Hengelo']: ['Amsterdam Amstel': 'Amsterdam Zuid']: ['Amsterdam Zuid': 'Schiphol Airport']: ['Eindhoven': 's-Hertogenbosch']: ['Hengelo': 'Enschede']: ['Hilversum': 'Almere Centrum']: ['Leiden Centraal': 'Heemstede-Aerdenhout']: ['Maastricht': 'Sittard']: ['Roermond': 'Weert']: ['Roosendaal': 'Vlissingen']: ['Sittard': 'Heerlen']: ['Sittard': 'Roermond']: ['Utrecht Centraal': 'Ede-Wageningen']: ['Utrecht Centraal': 'Schiphol Airport']: ['Utrecht Centraal': 's-Hertogenbosch']: ['s-Hertogenbosch': 'Tilburg']]