train,stations
0,"[Hengelo, Enschede, Hengelo, Enschede, Hengelo, Enschede, Hengelo, Almelo, Hengelo, Enschede, Hengelo, Almelo, Hengelo, Enschede, Hengelo, Almelo, Hengelo, Enschede, Hengelo, Almelo, Hengelo]"
1,"[Rotterdam Blaak, Schiedam Centrum, Delft, Schiedam Centrum, Rotterdam Centraal, Schiedam Centrum, Rotterdam Centraal, Schiedam Centrum, Delft, Den Haag HS, Gouda, Den Haag Laan v NOI, Leiden Centraal, Schiphol Airport, Utrecht Centraal]"
2,"[Almelo, Deventer, Zutphen, Deventer, Zutphen, Apeldoorn, Deventer, Zwolle, Assen]"
3,"[Heemstede-Aerdenhout, Haarlem, Amsterdam Sloterdijk, Amsterdam Centraal, Amsterdam Sloterdijk, Haarlem, Amsterdam Sloterdijk, Haarlem, Heemstede-Aerdenhout, Leiden Centraal, Den Haag Centraal, Leiden Centraal]"
4,"[Rotterdam Alexander, Rotterdam Blaak, Dordrecht, Breda, Tilburg, Breda, Etten-Leur, Breda, Etten-Leur, Roosendaal]"
5,"[Haarlem, Heemstede-Aerdenhout, Leiden Centraal, Heemstede-Aerdenhout, Haarlem, Heemstede-Aerdenhout, Leiden Centraal, Alphen a/d Rijn, Gouda, Alphen a/d Rijn, Gouda, Utrecht Centraal, Amsterdam Centraal, Amsterdam Sloterdijk]"
6,"[Utrecht Centraal, s-Hertogenbosch, Oss, s-Hertogenbosch, Eindhoven, Weert, Roermond]"
7,"[Sittard, Heerlen, Sittard, Roermond, Weert, Eindhoven]"
8,"[Helmond, Eindhoven, Tilburg, s-Hertogenbosch, Utrecht Centraal, Amsterdam Centraal, Amsterdam Amstel, Amsterdam Centraal, Almere Centrum, Lelystad Centrum]"
9,"[Castricum, Alkmaar, Hoorn, Zaandam, Amsterdam Sloterdijk, Amsterdam Zuid, Schiphol Airport, Amsterdam Zuid, Schiphol Airport, Leiden Centraal, Den Haag HS, Leiden Centraal]"
10,"[Deventer, Zwolle, Steenwijk, Heerenveen, Leeuwarden, Heerenveen, Leeuwarden]"
11,"[Oss, s-Hertogenbosch, Oss, Nijmegen, Arnhem Centraal, Ede-Wageningen, Utrecht Centraal, Amersfoort, Utrecht Centraal, Amersfoort, Utrecht Centraal]"
12,"[Helmond, Eindhoven, Helmond, Venlo, Helmond, Eindhoven, Helmond, Eindhoven, Weert, Roermond]"
13,"[Amsterdam Amstel, Utrecht Centraal, Gouda, Alphen a/d Rijn, Utrecht Centraal, Alphen a/d Rijn]"
14,"[Leiden Centraal, Den Haag Laan v NOI, Delft, Den Haag Laan v NOI, Gouda, Rotterdam Alexander, Rotterdam Blaak, Dordrecht]"
15,"[Enschede, Hengelo, Almelo, Zwolle, Almelo, Hengelo, Enschede, Hengelo, Enschede, Hengelo, Enschede, Hengelo]"
16,"[Alkmaar, Den Helder, Alkmaar, Castricum, Alkmaar, Castricum, Beverwijk, Zaandam, Amsterdam Sloterdijk, Zaandam, Amsterdam Sloterdijk, Amsterdam Centraal]"
17,"[Amsterdam Sloterdijk, Zaandam, Beverwijk, Castricum, Zaandam, Hoorn, Zaandam, Beverwijk]"
18,"[Gouda, Den Haag Laan v NOI, Delft, Den Haag HS, Delft, Den Haag Centraal, Leiden Centraal, Alphen a/d Rijn, Gouda, Rotterdam Alexander, Rotterdam Centraal, Dordrecht, Breda]"
score,4007.123595505618
connections missing,[['Amsterdam Amstel': 'Almere Centrum']: ['Amsterdam Amstel': 'Amsterdam Zuid']: ['Amsterdam Amstel': 'Hilversum']: ['Arnhem Centraal': 'Dieren']: ['Hilversum': 'Almere Centrum']: ['Roosendaal': 'Vlissingen']: ['Zutphen': 'Dieren']: ['Zwolle': 'Amersfoort']]