train,stations
0,"[Zwolle, Assen, Groningen, Leeuwarden]"
1,"[Breda, Tilburg, s-Hertogenbosch, Tilburg, Eindhoven, s-Hertogenbosch, Eindhoven, Helmond]"
2,"[Breda, Etten-Leur, Breda, Tilburg, s-Hertogenbosch, Oss, s-Hertogenbosch, Oss, s-Hertogenbosch, Eindhoven, Weert]"
3,"[Schiedam Centrum, Delft, Den Haag Centraal, Gouda, Alphen a/d Rijn, Leiden Centraal, Heemstede-Aerdenhout, Haarlem, Amsterdam Sloterdijk, Amsterdam Zuid, Amsterdam Sloterdijk, Amsterdam Zuid, Schiphol Airport]"
4,"[Alkmaar, Castricum, Alkmaar, Den Helder, Alkmaar, Castricum, Beverwijk, Haarlem, Beverwijk]"
5,"[Schiphol Airport, Amsterdam Zuid, Amsterdam Amstel, Utrecht Centraal, s-Hertogenbosch, Oss, Nijmegen, Arnhem Centraal, Nijmegen]"
6,"[Almere Centrum, Amsterdam Amstel, Amsterdam Centraal, Amsterdam Amstel, Almere Centrum, Lelystad Centrum, Almere Centrum, Hilversum, Utrecht Centraal, Hilversum]"
7,"[Utrecht Centraal, Amersfoort, Zwolle, Deventer, Zutphen, Deventer, Zwolle, Deventer, Almelo, Hengelo]"
8,"[Castricum, Beverwijk, Castricum, Zaandam, Beverwijk, Zaandam, Castricum]"
9,"[Delft, Den Haag HS, Leiden Centraal, Den Haag Laan v NOI, Gouda, Alphen a/d Rijn, Utrecht Centraal]"
10,"[Delft, Den Haag Laan v NOI, Delft, Den Haag Laan v NOI, Gouda, Rotterdam Alexander, Rotterdam Centraal, Dordrecht, Breda]"
11,"[Schiphol Airport, Utrecht Centraal, Amsterdam Amstel, Amsterdam Zuid, Schiphol Airport, Amsterdam Zuid]"
12,"[Maastricht, Sittard, Heerlen, Sittard, Roermond, Sittard, Roermond, Weert]"
13,"[Vlissingen]"
14,"[Lelystad Centrum, Almere Centrum, Lelystad Centrum, Almere Centrum, Amsterdam Amstel, Amsterdam Centraal, Amsterdam Sloterdijk, Amsterdam Centraal, Utrecht Centraal]"
15,"[Den Haag HS, Gouda, Rotterdam Alexander, Rotterdam Blaak, Dordrecht, Rotterdam Centraal, Rotterdam Alexander, Rotterdam Centraal, Rotterdam Alexander, Rotterdam Centraal, Schiedam Centrum, Rotterdam Blaak, Rotterdam Alexander, Rotterdam Centraal, Schiedam Centrum]"
16,"[Almere Centrum, Amsterdam Centraal, Utrecht Centraal, Alphen a/d Rijn, Leiden Centraal, Den Haag Laan v NOI, Delft, Den Haag Laan v NOI, Leiden Centraal, Schiphol Airport, Leiden Centraal]"
17,"[Amsterdam Sloterdijk, Amsterdam Centraal, Amsterdam Sloterdijk, Haarlem, Heemstede-Aerdenhout, Haarlem, Heemstede-Aerdenhout, Leiden Centraal, Den Haag HS, Gouda, Utrecht Centraal, Schiphol Airport]"
18,"[Hengelo, Enschede, Hengelo, Almelo, Hengelo, Almelo, Zwolle, Steenwijk, Heerenveen, Leeuwarden, Heerenveen]"
19,"[Gouda, Alphen a/d Rijn, Gouda, Den Haag Laan v NOI, Leiden Centraal, Den Haag Centraal, Gouda, Den Haag HS]"
score,3705.123595505618
connections missing,[['Alkmaar': 'Hoorn']: ['Amsterdam Amstel': 'Hilversum']: ['Apeldoorn': 'Amersfoort']: ['Apeldoorn': 'Zutphen']: ['Arnhem Centraal': 'Ede-Wageningen']: ['Deventer': 'Apeldoorn']: ['Helmond': 'Venlo']: ['Roosendaal': 'Dordrecht']]