train,stations
0,"[Enschede, Hengelo, Enschede, Hengelo, Enschede, Hengelo, Enschede, Hengelo, Almelo, Hengelo, Enschede, Hengelo, Almelo, Hengelo, Enschede, Hengelo, Almelo, Hengelo, Enschede, Hengelo, Almelo]"
1,"[Rotterdam Alexander, Rotterdam Blaak, Schiedam Centrum, Delft, Schiedam Centrum, Rotterdam Centraal, Schiedam Centrum, Rotterdam Centraal, Schiedam Centrum, Delft, Den Haag HS, Gouda, Den Haag Laan v NOI, Leiden Centraal, Schiphol Airport, Utrecht Centraal]"
2,"[Almelo, Deventer, Zutphen, Deventer, Zutphen, Apeldoorn, Deventer, Zwolle]"
3,"[Heemstede-Aerdenhout, Haarlem, Amsterdam Sloterdijk, Amsterdam Centraal, Amsterdam Sloterdijk, Haarlem, Amsterdam Sloterdijk, Haarlem, Heemstede-Aerdenhout, Leiden Centraal, Den Haag Centraal]"
4,"[Dordrecht, Breda, Tilburg, Breda, Etten-Leur, Breda, Etten-Leur, Roosendaal, Etten-Leur, Breda]"
5,"[Heemstede-Aerdenhout, Leiden Centraal, Heemstede-Aerdenhout, Haarlem, Heemstede-Aerdenhout, Leiden Centraal, Alphen a/d Rijn, Gouda, Alphen a/d Rijn, Gouda, Utrecht Centraal, Amsterdam Centraal, Amsterdam Sloterdijk]"
6,"[Eindhoven, s-Hertogenbosch, Oss, s-Hertogenbosch, Eindhoven, Weert]"
7,"[Heerlen, Sittard, Roermond, Weert, Eindhoven, Helmond, Eindhoven]"
8,"[Eindhoven, Helmond, Eindhoven, Tilburg, s-Hertogenbosch, Utrecht Centraal, Amsterdam Centraal, Amsterdam Amstel, Amsterdam Centraal, Almere Centrum]"
9,"[Castricum, Alkmaar, Hoorn, Zaandam, Amsterdam Sloterdijk, Amsterdam Zuid, Schiphol Airport, Amsterdam Zuid, Schiphol Airport, Leiden Centraal, Den Haag HS, Leiden Centraal, Den Haag Centraal, Delft]"
10,"[Zwolle, Steenwijk, Heerenveen, Leeuwarden, Heerenveen, Leeuwarden, Heerenveen]"
11,"[Oss, s-Hertogenbosch, Oss, Nijmegen, Arnhem Centraal, Ede-Wageningen, Utrecht Centraal, Amersfoort, Utrecht Centraal, Amersfoort, Utrecht Centraal]"
12,"[Eindhoven, Helmond, Eindhoven, Helmond, Venlo, Helmond, Eindhoven, Helmond, Eindhoven, Weert, Roermond, Sittard]"
13,"[Amsterdam Amstel, Utrecht Centraal, Gouda, Alphen a/d Rijn, Utrecht Centraal, Alphen a/d Rijn]"
14,"[Leiden Centraal, Den Haag Laan v NOI, Leiden Centraal, Den Haag Laan v NOI, Delft, Den Haag Laan v NOI, Gouda, Rotterdam Alexander]"
15,"[Enschede, Hengelo, Almelo, Zwolle, Almelo, Hengelo, Enschede, Hengelo, Enschede, Hengelo]"
16,"[Den Helder, Alkmaar, Castricum, Alkmaar, Castricum, Beverwijk, Zaandam, Amsterdam Sloterdijk, Zaandam, Amsterdam Sloterdijk, Amsterdam Centraal, Amsterdam Amstel, Hilversum]"
17,"[Amsterdam Sloterdijk, Zaandam, Beverwijk, Castricum, Zaandam, Hoorn, Zaandam, Beverwijk]"
18,"[Delft, Den Haag HS, Delft, Den Haag Centraal, Leiden Centraal, Alphen a/d Rijn, Gouda, Rotterdam Alexander, Rotterdam Centraal, Dordrecht, Breda, Etten-Leur, Roosendaal]"
score,4077.483146067416
connections missing,[['Amsterdam Amstel': 'Almere Centrum']: ['Amsterdam Amstel': 'Amsterdam Zuid']: ['Arnhem Centraal': 'Dieren']: ['Hilversum': 'Almere Centrum']: ['Roosendaal': 'Vlissingen']: ['Zutphen': 'Dieren']: ['Zwolle': 'Amersfoort']]