train,stations
2,"[Beverwijk, Haarlem, Beverwijk, Haarlem, Amsterdam Sloterdijk, Amsterdam Centraal, Amsterdam Amstel, Hilversum, Almere Centrum, Amsterdam Amstel, Amsterdam Centraal, Amsterdam Amstel, Amsterdam Centraal]"
3,"[Den Haag Centraal, Delft, Schiedam Centrum, Rotterdam Blaak, Rotterdam Alexander, Rotterdam Centraal, Rotterdam Alexander, Rotterdam Centraal, Schiedam Centrum, Rotterdam Centraal, Dordrecht, Rotterdam Centraal, Schiedam Centrum, Rotterdam Centraal]"
5,"[Amsterdam Amstel, Amsterdam Centraal, Almere Centrum, Lelystad Centrum, Almere Centrum, Hilversum, Amsterdam Amstel, Amsterdam Centraal]"
6,"[Tilburg, Breda, Tilburg, Eindhoven, s-Hertogenbosch, Tilburg, Breda, Etten-Leur, Breda, Etten-Leur, Roosendaal, Etten-Leur, Roosendaal]"
7,"[Apeldoorn, Amersfoort, Zwolle, Assen, Zwolle, Deventer, Apeldoorn]"
8,"[Alkmaar, Hoorn, Zaandam, Amsterdam Sloterdijk, Amsterdam Zuid, Schiphol Airport, Amsterdam Zuid, Schiphol Airport, Amsterdam Zuid, Amsterdam Sloterdijk, Haarlem, Beverwijk]"
9,"[Tilburg, Eindhoven, s-Hertogenbosch, Oss, s-Hertogenbosch, Tilburg, Breda, Dordrecht]"
10,"[Den Haag Centraal, Gouda, Den Haag Centraal, Delft, Den Haag Centraal, Gouda, Alphen a/d Rijn, Leiden Centraal, Schiphol Airport, Leiden Centraal, Den Haag Laan v NOI, Leiden Centraal, Den Haag HS]"
11,"[Den Haag HS, Delft, Den Haag Laan v NOI, Gouda, Rotterdam Alexander, Rotterdam Centraal]"
12,"[Castricum, Alkmaar, Castricum, Beverwijk, Haarlem, Beverwijk, Castricum, Zaandam, Beverwijk, Haarlem, Heemstede-Aerdenhout, Haarlem, Heemstede-Aerdenhout]"
14,"[Delft, Den Haag HS, Gouda, Den Haag Centraal, Leiden Centraal, Alphen a/d Rijn, Gouda, Rotterdam Alexander, Rotterdam Blaak, Dordrecht]"
16,"[Leeuwarden, Heerenveen, Steenwijk, Zwolle, Assen, Zwolle, Deventer]"
18,"[Venlo, Helmond, Eindhoven, Weert, Roermond, Sittard, Roermond, Weert, Eindhoven, s-Hertogenbosch]"
19,"[Oss, s-Hertogenbosch, Oss, Nijmegen, Arnhem Centraal, Ede-Wageningen, Arnhem Centraal, Nijmegen, Arnhem Centraal, Dieren, Arnhem Centraal, Ede-Wageningen, Arnhem Centraal, Dieren, Zutphen, Deventer]"
22,"[Haarlem, Heemstede-Aerdenhout, Leiden Centraal, Den Haag Centraal, Delft, Schiedam Centrum, Rotterdam Blaak, Dordrecht, Roosendaal, Dordrecht]"
26,"[Groningen, Assen, Zwolle, Almelo, Hengelo, Almelo]"
47,"[Maastricht, Sittard, Heerlen, Sittard, Roermond, Weert]"
score,4989.0
connections missing,[['Alkmaar': 'Den Helder']: ['Apeldoorn': 'Zutphen']: ['Hengelo': 'Enschede']: ['Leeuwarden': 'Groningen']: ['Roosendaal': 'Vlissingen']]