train,stations
0,"[Schiedam Centrum, Rotterdam Blaak, Schiedam Centrum, Rotterdam Blaak, Rotterdam Alexander, Rotterdam Centraal, Rotterdam Alexander]"
1,"[Weert, Roermond, Sittard, Maastricht, Sittard, Heerlen, Sittard]"
2,"[Utrecht Centraal, Hilversum, Almere Centrum, Lelystad Centrum, Almere Centrum]"
3,"[Castricum, Alkmaar, Castricum, Zaandam]"
4,"[Assen, Zwolle]"
5,"[Amsterdam Sloterdijk, Zaandam, Beverwijk, Haarlem, Beverwijk, Zaandam, Amsterdam Sloterdijk, Zaandam, Amsterdam Sloterdijk, Amsterdam Centraal, Amsterdam Sloterdijk, Amsterdam Centraal, Amsterdam Sloterdijk, Amsterdam Zuid, Amsterdam Amstel, Amsterdam Centraal]"
6,"[Apeldoorn, Amersfoort, Utrecht Centraal, Amsterdam Centraal, Amsterdam Amstel, Utrecht Centraal, Gouda, Den Haag HS, Delft, Schiedam Centrum, Delft, Schiedam Centrum]"
7,"[Rotterdam Centraal, Schiedam Centrum, Rotterdam Blaak, Dordrecht, Rotterdam Centraal, Dordrecht, Rotterdam Blaak, Schiedam Centrum, Delft, Den Haag HS, Delft, Den Haag HS]"
8,"[]"
9,"[Arnhem Centraal, Ede-Wageningen, Utrecht Centraal, Amersfoort, Utrecht Centraal, Gouda, Alphen a/d Rijn, Gouda]"
10,"[Rotterdam Blaak, Rotterdam Alexander, Rotterdam Centraal, Schiedam Centrum, Rotterdam Blaak, Schiedam Centrum, Delft, Den Haag Laan v NOI]"
11,"[Alkmaar, Castricum, Zaandam, Amsterdam Sloterdijk, Zaandam, Hoorn, Zaandam, Hoorn]"
12,"[Amsterdam Amstel, Hilversum, Almere Centrum, Amsterdam Amstel, Amsterdam Centraal, Amsterdam Sloterdijk, Amsterdam Zuid, Amsterdam Sloterdijk]"
13,"[Haarlem, Beverwijk, Zaandam, Amsterdam Sloterdijk, Amsterdam Zuid, Schiphol Airport, Amsterdam Zuid, Schiphol Airport, Leiden Centraal, Heemstede-Aerdenhout]"
14,"[Helmond, Eindhoven, Weert, Eindhoven, Tilburg, s-Hertogenbosch]"
15,"[Leiden Centraal, Den Haag Laan v NOI, Leiden Centraal, Den Haag Centraal, Delft, Den Haag Laan v NOI, Delft, Den Haag Laan v NOI, Delft, Schiedam Centrum, Rotterdam Blaak, Dordrecht, Roosendaal, Etten-Leur, Breda]"
score,4070.3258426966295
connections missing,[['Arnhem Centraal': 'Dieren']: ['Den Haag Centraal': 'Gouda']: ['Den Haag Laan v NOI': 'Gouda']: ['Deventer': 'Almelo']: ['Eindhoven': 's-Hertogenbosch']: ['Helmond': 'Venlo']: ['Nijmegen': 'Arnhem Centraal']: ['Oss': 'Nijmegen']: ['Roosendaal': 'Vlissingen']: ['Utrecht Centraal': 'Alphen a/d Rijn']: ['Zutphen': 'Dieren']: ['Zwolle': 'Amersfoort']: ['s-Hertogenbosch': 'Oss']]