train,stations
0,"[Helmond, Eindhoven, Helmond, Venlo, Helmond, Eindhoven, Tilburg, Breda, Tilburg]"
1,"[Hoorn, Alkmaar, Castricum, Beverwijk, Zaandam, Beverwijk, Castricum]"
2,"[Schiedam Centrum, Rotterdam Centraal, Dordrecht, Rotterdam Blaak, Rotterdam Alexander, Gouda, Rotterdam Alexander, Rotterdam Centraal, Schiedam Centrum, Delft, Den Haag Centraal]"
3,"[Haarlem, Beverwijk, Castricum, Alkmaar, Castricum, Zaandam, Amsterdam Sloterdijk, Amsterdam Centraal, Almere Centrum, Lelystad Centrum, Almere Centrum, Lelystad Centrum]"
4,"[Almere Centrum, Hilversum, Amsterdam Amstel, Amsterdam Centraal, Amsterdam Sloterdijk, Zaandam, Amsterdam Sloterdijk]"
5,"[Beverwijk, Haarlem, Amsterdam Sloterdijk, Amsterdam Centraal, Amsterdam Sloterdijk, Amsterdam Zuid, Schiphol Airport, Amsterdam Zuid, Amsterdam Sloterdijk, Amsterdam Zuid, Amsterdam Sloterdijk, Amsterdam Zuid]"
6,"[s-Hertogenbosch, Tilburg, Eindhoven, Helmond, Eindhoven, s-Hertogenbosch, Oss, Nijmegen, Arnhem Centraal, Ede-Wageningen]"
7,"[Lelystad Centrum, Almere Centrum, Lelystad Centrum, Almere Centrum, Amsterdam Amstel, Hilversum, Amsterdam Amstel]"
8,"[Amsterdam Amstel, Amsterdam Centraal, Amsterdam Sloterdijk, Haarlem, Amsterdam Sloterdijk, Zaandam, Hoorn, Alkmaar, Castricum, Alkmaar]"
9,"[Groningen, Assen, Zwolle]"
10,"[Leeuwarden, Heerenveen, Steenwijk, Zwolle, Almelo]"
11,"[Den Haag HS, Leiden Centraal, Schiphol Airport, Amsterdam Zuid, Amsterdam Amstel, Amsterdam Centraal, Almere Centrum, Lelystad Centrum, Almere Centrum, Lelystad Centrum, Almere Centrum, Lelystad Centrum]"
12,"[Dordrecht, Breda, Tilburg, s-Hertogenbosch, Eindhoven, s-Hertogenbosch, Oss, s-Hertogenbosch, Eindhoven, Weert]"
13,"[Rotterdam Centraal, Schiedam Centrum, Delft, Den Haag Laan v NOI, Leiden Centraal, Den Haag Laan v NOI, Leiden Centraal]"
14,"[Zwolle, Amersfoort, Apeldoorn, Zutphen, Apeldoorn, Zutphen, Dieren, Zutphen, Apeldoorn]"
15,"[Leiden Centraal, Alphen a/d Rijn, Gouda, Rotterdam Alexander, Rotterdam Blaak, Dordrecht, Roosendaal, Etten-Leur, Roosendaal, Etten-Leur, Roosendaal, Etten-Leur]"
16,"[Hoorn, Zaandam, Amsterdam Sloterdijk, Haarlem, Heemstede-Aerdenhout, Leiden Centraal, Schiphol Airport, Amsterdam Zuid]"
17,"[Apeldoorn, Deventer, Zwolle, Assen, Groningen]"
18,"[Delft, Den Haag HS, Leiden Centraal, Den Haag HS, Delft, Schiedam Centrum, Rotterdam Centraal, Rotterdam Alexander, Rotterdam Blaak, Schiedam Centrum, Rotterdam Centraal, Dordrecht, Roosendaal, Etten-Leur, Breda]"
19,"[Schiedam Centrum, Delft, Den Haag HS, Delft, Schiedam Centrum, Rotterdam Blaak, Rotterdam Alexander, Rotterdam Centraal, Schiedam Centrum, Delft, Den Haag Centraal, Gouda, Den Haag HS, Leiden Centraal, Den Haag HS, Delft]"
score,3951.0
connections missing,[['Hengelo': 'Enschede']: ['Maastricht': 'Sittard']: ['Roosendaal': 'Vlissingen']: ['Sittard': 'Heerlen']: ['Sittard': 'Roermond']]