train,stations
0,"[Helmond, Eindhoven, Helmond, Venlo, Helmond, Eindhoven, Tilburg, Breda, Tilburg]"
1,"[Den Helder, Alkmaar, Castricum, Beverwijk, Zaandam, Beverwijk]"
2,"[Schiedam Centrum, Rotterdam Centraal, Dordrecht, Rotterdam Blaak, Rotterdam Alexander, Gouda, Rotterdam Alexander, Rotterdam Centraal, Schiedam Centrum, Delft, Den Haag Centraal, Leiden Centraal]"
3,"[Beverwijk, Castricum, Alkmaar, Castricum, Zaandam, Amsterdam Sloterdijk, Amsterdam Centraal, Almere Centrum, Lelystad Centrum, Almere Centrum, Lelystad Centrum, Almere Centrum]"
4,"[Almere Centrum, Hilversum, Amsterdam Amstel, Amsterdam Centraal, Amsterdam Sloterdijk, Zaandam, Castricum]"
5,"[Heemstede-Aerdenhout, Haarlem, Beverwijk, Haarlem, Amsterdam Sloterdijk, Amsterdam Centraal, Amsterdam Sloterdijk, Amsterdam Zuid, Schiphol Airport, Amsterdam Zuid, Amsterdam Sloterdijk, Amsterdam Zuid, Amsterdam Sloterdijk, Zaandam]"
6,"[Breda, Tilburg, Eindhoven, Helmond, Eindhoven, s-Hertogenbosch, Oss, Nijmegen, Arnhem Centraal, Nijmegen]"
7,"[Lelystad Centrum, Almere Centrum, Lelystad Centrum, Almere Centrum, Amsterdam Amstel, Hilversum, Amsterdam Amstel, Amsterdam Zuid, Amsterdam Sloterdijk, Amsterdam Zuid, Amsterdam Amstel]"
8,"[Amsterdam Centraal, Amsterdam Sloterdijk, Haarlem, Amsterdam Sloterdijk, Zaandam, Hoorn, Alkmaar, Castricum, Alkmaar]"
9,"[Assen, Groningen, Assen, Zwolle, Assen, Groningen]"
10,"[Leeuwarden, Heerenveen, Steenwijk, Zwolle, Almelo, Hengelo, Almelo]"
11,"[Delft, Den Haag Centraal, Delft, Den Haag HS, Leiden Centraal, Schiphol Airport, Amsterdam Zuid, Amsterdam Amstel, Amsterdam Centraal, Almere Centrum, Lelystad Centrum, Almere Centrum]"
12,"[Dordrecht, Breda, Tilburg, s-Hertogenbosch, Eindhoven, s-Hertogenbosch, Oss, s-Hertogenbosch, Eindhoven, Weert]"
13,"[Delft, Den Haag Laan v NOI, Leiden Centraal, Den Haag Laan v NOI, Leiden Centraal, Alphen a/d Rijn, Leiden Centraal]"
14,"[Zwolle, Amersfoort, Apeldoorn, Zutphen, Apeldoorn, Zutphen, Dieren, Zutphen, Apeldoorn]"
15,"[Den Haag Centraal, Leiden Centraal, Alphen a/d Rijn, Gouda, Rotterdam Alexander, Rotterdam Blaak, Dordrecht, Roosendaal, Etten-Leur, Roosendaal, Etten-Leur]"
16,"[Zaandam, Hoorn, Zaandam, Amsterdam Sloterdijk, Haarlem, Heemstede-Aerdenhout, Leiden Centraal]"
17,"[Apeldoorn, Deventer, Zwolle, Assen, Groningen, Leeuwarden, Groningen, Assen]"
18,"[Delft, Den Haag HS, Leiden Centraal, Den Haag HS, Delft, Schiedam Centrum, Rotterdam Centraal, Rotterdam Alexander, Rotterdam Blaak, Schiedam Centrum, Rotterdam Centraal, Dordrecht, Roosendaal, Etten-Leur, Roosendaal, Dordrecht]"
19,"[Delft, Den Haag HS, Delft, Schiedam Centrum, Rotterdam Blaak, Rotterdam Alexander, Rotterdam Centraal, Schiedam Centrum, Delft, Den Haag Centraal, Gouda, Den Haag HS, Leiden Centraal, Den Haag HS, Delft, Den Haag HS]"
score,3914.0
connections missing,[['Arnhem Centraal': 'Ede-Wageningen']: ['Hengelo': 'Enschede']: ['Maastricht': 'Sittard']: ['Roosendaal': 'Vlissingen']: ['Sittard': 'Heerlen']: ['Sittard': 'Roermond']]