train,stations
4,"[Heerenveen, Steenwijk, Zwolle, Assen, Groningen, Leeuwarden, Heerenveen, Leeuwarden]"
5,"[Hilversum, Utrecht Centraal, Amersfoort, Apeldoorn, Zutphen, Deventer, Almelo]"
6,"[Delft, Den Haag HS, Delft, Den Haag Centraal, Gouda, Den Haag HS, Gouda, Den Haag Centraal, Delft, Schiedam Centrum, Rotterdam Centraal]"
7,"[Den Helder, Alkmaar, Hoorn, Zaandam, Castricum, Alkmaar]"
11,"[Venlo, Helmond, Eindhoven, Weert, Roermond, Sittard, Roermond, Weert, Eindhoven, Tilburg]"
12,"[Heerenveen, Steenwijk, Zwolle, Deventer, Apeldoorn, Deventer, Almelo, Hengelo, Enschede, Hengelo, Enschede]"
13,"[Den Haag HS, Gouda, Alphen a/d Rijn, Leiden Centraal, Den Haag HS, Delft, Den Haag HS, Gouda, Den Haag Centraal]"
14,"[Amersfoort, Utrecht Centraal, Gouda, Den Haag HS, Leiden Centraal, Schiphol Airport, Amsterdam Zuid, Amsterdam Sloterdijk, Amsterdam Centraal, Amsterdam Sloterdijk, Amsterdam Zuid]"
16,"[Rotterdam Blaak, Dordrecht, Breda, Tilburg, s-Hertogenbosch, Utrecht Centraal, Alphen a/d Rijn, Leiden Centraal, Schiphol Airport, Leiden Centraal, Den Haag Laan v NOI, Leiden Centraal]"
18,"[Dieren, Zutphen, Deventer, Apeldoorn, Zutphen, Deventer, Apeldoorn, Amersfoort, Zwolle, Deventer]"
19,"[Gouda, Rotterdam Alexander, Rotterdam Centraal, Schiedam Centrum, Rotterdam Centraal, Schiedam Centrum, Delft, Den Haag Laan v NOI, Delft, Schiedam Centrum, Rotterdam Blaak, Rotterdam Alexander, Gouda, Rotterdam Alexander]"
20,"[Utrecht Centraal, Amersfoort, Utrecht Centraal, Amsterdam Centraal, Amsterdam Amstel, Amsterdam Zuid, Amsterdam Sloterdijk, Zaandam]"
24,"[Vlissingen, Roosendaal, Etten-Leur, Breda, Dordrecht, Roosendaal, Dordrecht, Rotterdam Centraal, Schiedam Centrum, Delft, Schiedam Centrum]"
26,"[Rotterdam Centraal, Schiedam Centrum, Rotterdam Centraal, Rotterdam Alexander, Rotterdam Blaak, Schiedam Centrum, Delft, Den Haag Centraal, Leiden Centraal, Den Haag Centraal, Leiden Centraal, Heemstede-Aerdenhout, Leiden Centraal, Den Haag HS, Delft, Den Haag Centraal]"
28,"[Lelystad Centrum, Almere Centrum, Lelystad Centrum, Almere Centrum, Amsterdam Centraal, Amsterdam Amstel, Hilversum, Almere Centrum, Amsterdam Amstel, Hilversum]"
29,"[Nijmegen, Arnhem Centraal, Nijmegen, Oss, Nijmegen, Oss, s-Hertogenbosch, Utrecht Centraal, Schiphol Airport, Leiden Centraal, Den Haag HS, Delft]"
30,"[Haarlem, Heemstede-Aerdenhout, Haarlem, Beverwijk, Haarlem, Heemstede-Aerdenhout, Haarlem, Amsterdam Sloterdijk, Amsterdam Zuid, Amsterdam Amstel, Utrecht Centraal, Amsterdam Centraal, Amsterdam Sloterdijk, Haarlem]"
31,"[Beverwijk, Castricum, Alkmaar, Castricum, Zaandam, Castricum, Beverwijk, Zaandam, Amsterdam Sloterdijk, Haarlem, Amsterdam Sloterdijk]"
39,"[Utrecht Centraal, s-Hertogenbosch, Eindhoven, Weert, Roermond, Sittard, Heerlen, Sittard, Maastricht, Sittard, Heerlen]"
43,"[Zutphen, Dieren, Arnhem Centraal, Ede-Wageningen, Utrecht Centraal, Gouda]"
score,4768.0
connections missing,[]