train,stations
0,"[Leiden Centraal, Den Haag HS, Leiden Centraal, Den Haag HS, Leiden Centraal]"
1,"[Eindhoven, Helmond, Eindhoven, Tilburg, Eindhoven, Helmond]"
2,"[Almere Centrum, Hilversum, Amsterdam Amstel, Amsterdam Centraal, Amsterdam Sloterdijk, Zaandam, Beverwijk, Castricum, Zaandam, Castricum, Zaandam, Amsterdam Sloterdijk, Zaandam]"
3,"[Enschede, Hengelo, Enschede, Hengelo, Almelo, Deventer, Zutphen, Deventer, Zutphen, Deventer]"
4,"[Rotterdam Blaak, Rotterdam Alexander, Rotterdam Blaak, Schiedam Centrum, Rotterdam Centraal, Schiedam Centrum, Delft, Den Haag Laan v NOI, Gouda, Den Haag Laan v NOI, Delft, Den Haag Centraal]"
5,"[Castricum, Alkmaar, Hoorn, Zaandam, Amsterdam Sloterdijk, Zaandam]"
6,"[Amsterdam Sloterdijk, Amsterdam Centraal, Almere Centrum, Amsterdam Amstel, Hilversum, Utrecht Centraal, Amsterdam Centraal, Amsterdam Sloterdijk, Haarlem]"
7,"[Schiedam Centrum, Rotterdam Centraal, Rotterdam Alexander, Gouda, Rotterdam Alexander, Rotterdam Blaak, Dordrecht, Breda, Tilburg, Breda, Tilburg, s-Hertogenbosch]"
8,"[Heemstede-Aerdenhout, Leiden Centraal, Schiphol Airport, Amsterdam Zuid, Schiphol Airport, Amsterdam Zuid, Amsterdam Sloterdijk, Haarlem, Beverwijk, Haarlem, Heemstede-Aerdenhout, Leiden Centraal, Schiphol Airport, Leiden Centraal, Schiphol Airport, Amsterdam Zuid]"
9,"[Etten-Leur, Roosendaal, Etten-Leur, Breda, Dordrecht, Rotterdam Blaak]"
10,"[Rotterdam Centraal, Schiedam Centrum, Delft, Den Haag Centraal, Gouda, Den Haag Centraal, Delft, Den Haag HS, Gouda, Alphen a/d Rijn, Leiden Centraal, Schiphol Airport]"
11,"[Amsterdam Amstel, Utrecht Centraal, Amsterdam Amstel, Amsterdam Centraal, Utrecht Centraal, Alphen a/d Rijn, Gouda, Utrecht Centraal, Amersfoort, Apeldoorn]"
12,"[s-Hertogenbosch, Eindhoven, Weert, Roermond, Sittard, Heerlen, Sittard, Maastricht]"
13,"[Hilversum, Utrecht Centraal, Ede-Wageningen, Arnhem Centraal, Dieren, Zutphen, Dieren, Arnhem Centraal, Ede-Wageningen, Arnhem Centraal, Nijmegen, Arnhem Centraal]"
14,"[Rotterdam Alexander, Rotterdam Blaak, Rotterdam Alexander, Rotterdam Blaak, Rotterdam Alexander, Rotterdam Blaak, Dordrecht, Rotterdam Centraal]"
score,4051.977011494253
connections missing,[['Alkmaar': 'Den Helder']: ['Almere Centrum': 'Lelystad Centrum']: ['Amsterdam Amstel': 'Amsterdam Zuid']: ['Assen': 'Zwolle']: ['Den Haag Centraal': 'Leiden Centraal']: ['Heerenveen': 'Steenwijk']: ['Helmond': 'Venlo']: ['Leeuwarden': 'Heerenveen']: ['Roosendaal': 'Vlissingen']: ['Roosendaal': 'Dordrecht']: ['Steenwijk': 'Zwolle']: ['Utrecht Centraal': 'Schiphol Airport']: ['Utrecht Centraal': 's-Hertogenbosch']: ['Zwolle': 'Amersfoort']: ['Zwolle': 'Deventer']: ['Zwolle': 'Almelo']: ['s-Hertogenbosch': 'Oss']]