train,stations
0,"[Maastricht, Sittard, Heerlen, Sittard, Roermond, Weert, Eindhoven, Weert, Eindhoven, Helmond, Eindhoven]"
1,"[Almere Centrum, Hilversum, Amsterdam Amstel, Almere Centrum, Amsterdam Centraal, Amsterdam Sloterdijk, Zaandam]"
2,"[Tilburg, s-Hertogenbosch, Oss, Nijmegen, Arnhem Centraal, Nijmegen, Arnhem Centraal]"
3,"[Gouda, Den Haag HS, Leiden Centraal, Heemstede-Aerdenhout, Leiden Centraal, Den Haag Laan v NOI, Delft, Schiedam Centrum, Rotterdam Centraal, Schiedam Centrum, Rotterdam Centraal]"
4,"[Amsterdam Centraal, Amsterdam Amstel, Amsterdam Zuid, Amsterdam Amstel, Amsterdam Zuid, Schiphol Airport, Amsterdam Zuid, Schiphol Airport, Utrecht Centraal, Amersfoort]"
5,"[Heemstede-Aerdenhout, Haarlem, Amsterdam Sloterdijk, Amsterdam Zuid, Amsterdam Sloterdijk, Haarlem, Amsterdam Sloterdijk, Zaandam, Beverwijk, Haarlem, Amsterdam Sloterdijk]"
6,"[Rotterdam Alexander, Gouda, Alphen a/d Rijn, Gouda, Utrecht Centraal, Alphen a/d Rijn, Utrecht Centraal, Hilversum]"
7,"[Beverwijk, Castricum, Alkmaar, Castricum, Zaandam, Hoorn, Zaandam, Hoorn]"
8,"[Etten-Leur, Breda, Etten-Leur]"
9,"[Hengelo, Almelo, Hengelo, Almelo, Deventer, Zwolle, Deventer, Zutphen, Apeldoorn, Amersfoort]"
10,"[Utrecht Centraal, Gouda, Den Haag Centraal, Leiden Centraal, Den Haag Centraal, Delft, Den Haag HS]"
score,4562.449438202247
connections missing,[['Alkmaar': 'Den Helder']: ['Almere Centrum': 'Lelystad Centrum']: ['Arnhem Centraal': 'Dieren']: ['Assen': 'Zwolle']: ['Den Haag Laan v NOI': 'Gouda']: ['Eindhoven': 'Tilburg']: ['Groningen': 'Assen']: ['Heerenveen': 'Steenwijk']: ['Helmond': 'Venlo']: ['Hengelo': 'Enschede']: ['Leeuwarden': 'Heerenveen']: ['Leeuwarden': 'Groningen']: ['Leiden Centraal': 'Schiphol Airport']: ['Roosendaal': 'Vlissingen']: ['Steenwijk': 'Zwolle']: ['Tilburg': 'Breda']: ['Utrecht Centraal': 'Amsterdam Centraal']: ['Utrecht Centraal': 'Amsterdam Amstel']: ['Utrecht Centraal': 's-Hertogenbosch']: ['Zwolle': 'Amersfoort']: ['Zwolle': 'Almelo']]