train,stations
0,"[Leiden Centraal, Heemstede-Aerdenhout, Haarlem, Amsterdam Sloterdijk, Amsterdam Centraal, Amsterdam Amstel, Amsterdam Zuid, Amsterdam Amstel, Amsterdam Zuid, Schiphol Airport]"
1,"[Alphen a/d Rijn, Leiden Centraal, Heemstede-Aerdenhout, Leiden Centraal, Den Haag Centraal, Delft, Schiedam Centrum, Rotterdam Centraal]"
2,"[Castricum, Alkmaar, Castricum, Beverwijk]"
3,"[Amsterdam Sloterdijk, Amsterdam Centraal, Amsterdam Amstel, Amsterdam Centraal, Amsterdam Sloterdijk, Zaandam, Beverwijk, Haarlem, Amsterdam Sloterdijk, Zaandam, Amsterdam Sloterdijk, Zaandam]"
4,"[Alkmaar, Castricum, Zaandam, Hoorn, Alkmaar, Castricum]"
5,"[Schiedam Centrum, Rotterdam Centraal, Rotterdam Alexander, Rotterdam Centraal, Dordrecht, Rotterdam Centraal, Schiedam Centrum, Rotterdam Centraal, Rotterdam Alexander, Gouda, Den Haag Centraal, Delft]"
score,7485.428571428571
connections missing,[['Alkmaar': 'Den Helder']: ['Amsterdam Zuid': 'Amsterdam Sloterdijk']: ['Gouda': 'Alphen a/d Rijn']: ['Leiden Centraal': 'Schiphol Airport']]