train,stations
0,"[Delft, Den Haag Centraal, Leiden Centraal, Heemstede-Aerdenhout, Haarlem, Heemstede-Aerdenhout, Haarlem, Amsterdam Sloterdijk, Amsterdam Centraal, Amsterdam Amstel, Amsterdam Zuid, Amsterdam Sloterdijk]"
1,"[Schiedam Centrum, Rotterdam Centraal, Dordrecht, Rotterdam Centraal, Rotterdam Alexander, Gouda, Rotterdam Alexander, Gouda, Alphen a/d Rijn]"
2,"[Gouda, Den Haag Centraal, Leiden Centraal, Schiphol Airport, Leiden Centraal, Den Haag Centraal]"
3,"[Beverwijk, Castricum, Zaandam, Amsterdam Sloterdijk, Amsterdam Zuid, Schiphol Airport, Leiden Centraal, Den Haag Centraal]"
4,"[Zaandam, Amsterdam Sloterdijk, Amsterdam Zuid, Schiphol Airport, Amsterdam Zuid]"
5,"[Gouda, Den Haag Centraal, Leiden Centraal, Alphen a/d Rijn, Gouda, Rotterdam Alexander]"
6,"[Hoorn, Alkmaar, Castricum, Zaandam, Amsterdam Sloterdijk]"
score,7001.285714285714
connections missing,[['Alkmaar': 'Den Helder']: ['Haarlem': 'Beverwijk']: ['Schiedam Centrum': 'Delft']: ['Zaandam': 'Beverwijk']: ['Zaandam': 'Hoorn']]