train,stations
0,"[Dordrecht, Rotterdam Centraal, Schiedam Centrum, Delft, Schiedam Centrum]"
1,"[Dordrecht, Rotterdam Centraal, Schiedam Centrum, Delft, Schiedam Centrum, Delft, Den Haag Centraal, Leiden Centraal]"
2,"[Beverwijk, Haarlem, Beverwijk, Castricum, Beverwijk, Haarlem]"
3,"[Amsterdam Zuid, Amsterdam Amstel, Amsterdam Centraal, Amsterdam Sloterdijk, Zaandam, Hoorn, Alkmaar]"
4,"[Schiedam Centrum, Delft, Schiedam Centrum, Rotterdam Centraal, Rotterdam Alexander, Gouda, Den Haag Centraal]"
5,"[Castricum, Beverwijk, Castricum, Zaandam, Beverwijk]"
6,"[Heemstede-Aerdenhout, Haarlem, Amsterdam Sloterdijk, Amsterdam Zuid, Amsterdam Amstel, Amsterdam Zuid, Schiphol Airport, Leiden Centraal, Den Haag Centraal]"
score,7052.285714285714