train,stations
0,"[Zaandam, Beverwijk, Zaandam, Hoorn, Zaandam, Amsterdam Sloterdijk, Haarlem, Beverwijk, Haarlem]"
1,"[Eindhoven, Weert, Eindhoven, Helmond, Eindhoven, Tilburg, s-Hertogenbosch, Eindhoven, Helmond, Venlo, Helmond]"
2,"[Roermond, Weert, Roermond, Sittard, Heerlen, Sittard, Heerlen]"
3,"[Beverwijk, Castricum, Zaandam, Amsterdam Sloterdijk, Amsterdam Zuid, Amsterdam Amstel, Almere Centrum]"
4,"[Den Haag HS, Delft, Schiedam Centrum, Rotterdam Centraal, Rotterdam Alexander, Gouda, Den Haag HS, Delft, Schiedam Centrum, Rotterdam Blaak, Rotterdam Alexander, Rotterdam Centraal, Rotterdam Alexander, Rotterdam Centraal, Dordrecht, Roosendaal]"
5,"[Gouda, Den Haag Centraal, Leiden Centraal, Den Haag Centraal, Leiden Centraal, Den Haag Laan v NOI, Delft, Den Haag Laan v NOI]"
6,"[Rotterdam Centraal, Schiedam Centrum, Delft, Den Haag Centraal, Leiden Centraal, Alphen a/d Rijn, Utrecht Centraal, Ede-Wageningen, Arnhem Centraal, Ede-Wageningen, Arnhem Centraal, Nijmegen]"
7,"[Leiden Centraal, Schiphol Airport, Amsterdam Zuid, Schiphol Airport, Utrecht Centraal, Hilversum, Almere Centrum, Lelystad Centrum, Almere Centrum]"
8,"[Etten-Leur, Roosendaal, Etten-Leur, Breda, Tilburg, s-Hertogenbosch, Utrecht Centraal, Amersfoort, Apeldoorn, Zutphen, Deventer, Zwolle]"
9,"[Amsterdam Amstel, Almere Centrum, Lelystad Centrum, Almere Centrum, Amsterdam Centraal, Amsterdam Amstel, Amsterdam Zuid, Schiphol Airport, Amsterdam Zuid, Amsterdam Sloterdijk, Zaandam, Hoorn, Alkmaar]"
10,"[Leiden Centraal, Den Haag HS, Delft, Den Haag Laan v NOI, Delft, Den Haag Laan v NOI, Gouda, Utrecht Centraal, Amsterdam Amstel]"
11,"[Dordrecht, Rotterdam Centraal, Dordrecht, Rotterdam Blaak]"
12,"[Zutphen, Deventer, Almelo, Deventer, Zwolle, Almelo, Deventer, Zutphen, Deventer]"
13,"[Hengelo, Enschede, Hengelo, Almelo, Hengelo, Almelo, Deventer, Apeldoorn, Amersfoort, Apeldoorn, Deventer]"
14,"[Zaandam, Castricum, Zaandam, Castricum, Beverwijk]"
15,"[Heerenveen, Leeuwarden, Heerenveen, Steenwijk, Zwolle, Deventer, Zutphen, Apeldoorn, Zutphen, Dieren, Zutphen, Deventer]"
16,"[Etten-Leur, Roosendaal, Etten-Leur, Roosendaal, Dordrecht, Rotterdam Centraal, Rotterdam Alexander, Gouda, Utrecht Centraal]"
17,"[Heemstede-Aerdenhout, Haarlem, Beverwijk, Castricum, Zaandam, Castricum, Alkmaar, Den Helder, Alkmaar, Castricum, Alkmaar]"
18,"[Assen, Zwolle, Deventer]"
19,"[Leiden Centraal, Heemstede-Aerdenhout, Haarlem, Amsterdam Sloterdijk, Amsterdam Centraal, Amsterdam Sloterdijk, Amsterdam Centraal, Utrecht Centraal, s-Hertogenbosch, Tilburg, Breda, Dordrecht]"
score,4073.287356321838
connections missing,[['Arnhem Centraal': 'Dieren']: ['Gouda': 'Alphen a/d Rijn']: ['Oss': 'Nijmegen']: ['Roosendaal': 'Vlissingen']: ['s-Hertogenbosch': 'Oss']]