train,stations
0,"[Amsterdam Sloterdijk, Haarlem, Heemstede-Aerdenhout, Leiden Centraal, Den Haag Laan v NOI, Gouda, Rotterdam Alexander, Gouda, Den Haag HS, Leiden Centraal, Den Haag Centraal, Leiden Centraal, Den Haag Laan v NOI]"
1,"[Rotterdam Alexander, Rotterdam Centraal, Schiedam Centrum, Delft, Schiedam Centrum, Rotterdam Centraal, Schiedam Centrum, Rotterdam Centraal, Rotterdam Alexander, Rotterdam Centraal, Rotterdam Alexander, Gouda, Alphen a/d Rijn, Gouda, Rotterdam Alexander, Rotterdam Centraal]"
2,"[Schiphol Airport, Amsterdam Zuid, Amsterdam Amstel, Hilversum, Almere Centrum, Amsterdam Amstel, Amsterdam Zuid, Amsterdam Amstel, Amsterdam Centraal, Amsterdam Amstel, Amsterdam Zuid, Amsterdam Sloterdijk]"
3,"[Almelo, Hengelo, Almelo, Deventer, Zutphen, Deventer, Zutphen, Dieren, Zutphen, Dieren]"
4,"[Tilburg, Eindhoven, s-Hertogenbosch, Tilburg, s-Hertogenbosch, Oss, Nijmegen, Arnhem Centraal, Dieren, Zutphen, Dieren]"
5,"[Den Haag HS, Delft, Den Haag Laan v NOI, Gouda, Den Haag Centraal, Delft, Schiedam Centrum, Delft, Schiedam Centrum, Delft, Schiedam Centrum, Rotterdam Centraal, Schiedam Centrum, Delft]"
6,"[Alphen a/d Rijn, Leiden Centraal, Schiphol Airport, Amsterdam Zuid, Amsterdam Sloterdijk, Zaandam, Amsterdam Sloterdijk]"
7,"[Breda, Etten-Leur, Breda, Etten-Leur, Roosendaal, Dordrecht, Rotterdam Blaak, Schiedam Centrum, Delft, Den Haag Centraal, Gouda]"
8,"[]"
9,"[Lelystad Centrum, Almere Centrum, Amsterdam Centraal, Amsterdam Sloterdijk, Haarlem, Beverwijk, Haarlem, Heemstede-Aerdenhout, Leiden Centraal, Heemstede-Aerdenhout, Haarlem, Amsterdam Sloterdijk, Zaandam, Castricum, Alkmaar, Castricum]"
10,"[Helmond, Eindhoven, Weert, Roermond, Sittard]"
11,"[Zutphen, Dieren, Zutphen, Deventer, Almelo, Deventer, Apeldoorn, Zutphen]"
12,"[Rotterdam Alexander, Gouda, Rotterdam Alexander, Rotterdam Blaak, Dordrecht, Rotterdam Centraal, Rotterdam Alexander, Gouda, Rotterdam Alexander, Rotterdam Centraal, Dordrecht, Rotterdam Centraal, Dordrecht, Rotterdam Blaak, Schiedam Centrum, Rotterdam Centraal]"
13,"[Enschede, Hengelo, Enschede, Hengelo, Almelo]"
14,"[Amsterdam Sloterdijk, Zaandam, Hoorn, Alkmaar, Hoorn]"
15,"[Etten-Leur, Breda, Etten-Leur, Breda, Etten-Leur, Breda, Etten-Leur, Breda, Tilburg, s-Hertogenbosch]"
score,4478.0
connections missing,[['Alkmaar': 'Den Helder']: ['Assen': 'Zwolle']: ['Beverwijk': 'Castricum']: ['Breda': 'Dordrecht']: ['Groningen': 'Assen']: ['Helmond': 'Venlo']: ['Leeuwarden': 'Groningen']: ['Roosendaal': 'Vlissingen']: ['Zwolle': 'Amersfoort']]