train,stations
0,"[Amsterdam Centraal, Amsterdam Sloterdijk, Haarlem, Amsterdam Sloterdijk, Amsterdam Centraal, Utrecht Centraal, Amersfoort, Apeldoorn, Deventer, Apeldoorn, Zutphen]"
1,"[Steenwijk, Zwolle, Amersfoort, Apeldoorn, Deventer, Almelo, Hengelo]"
2,"[Dieren, Arnhem Centraal, Nijmegen, Oss, s-Hertogenbosch, Tilburg, Breda, Tilburg, Eindhoven, Tilburg, Eindhoven]"
3,"[Amsterdam Amstel, Amsterdam Zuid, Amsterdam Sloterdijk, Haarlem, Beverwijk, Castricum, Zaandam, Amsterdam Sloterdijk, Amsterdam Centraal, Almere Centrum, Lelystad Centrum, Almere Centrum, Amsterdam Centraal, Almere Centrum]"
4,"[Sittard, Maastricht, Sittard, Heerlen, Sittard, Roermond, Weert, Roermond, Weert, Eindhoven, Helmond, Eindhoven]"
5,"[s-Hertogenbosch, Utrecht Centraal, Alphen a/d Rijn, Leiden Centraal, Schiphol Airport, Utrecht Centraal, Amsterdam Centraal, Amsterdam Sloterdijk]"
6,"[Rotterdam Blaak, Rotterdam Alexander, Gouda, Den Haag Laan v NOI, Delft, Schiedam Centrum, Rotterdam Centraal, Schiedam Centrum, Rotterdam Centraal, Schiedam Centrum, Delft, Den Haag Centraal]"
7,"[Zaandam, Beverwijk, Haarlem, Heemstede-Aerdenhout, Leiden Centraal, Alphen a/d Rijn, Leiden Centraal, Alphen a/d Rijn, Leiden Centraal, Den Haag Centraal, Delft, Schiedam Centrum, Rotterdam Centraal]"
8,"[Rotterdam Blaak, Schiedam Centrum, Rotterdam Centraal, Schiedam Centrum, Rotterdam Blaak, Dordrecht, Breda, Tilburg, Breda, Etten-Leur, Breda, Etten-Leur, Roosendaal, Dordrecht]"
9,"[Den Helder, Alkmaar, Hoorn, Zaandam, Beverwijk, Haarlem, Amsterdam Sloterdijk, Haarlem, Amsterdam Sloterdijk]"
10,"[Zwolle, Almelo, Hengelo, Enschede, Hengelo, Enschede, Hengelo, Almelo, Deventer, Zutphen, Dieren, Arnhem Centraal, Ede-Wageningen, Arnhem Centraal]"
11,"[Beverwijk, Zaandam, Hoorn, Zaandam, Beverwijk, Haarlem, Beverwijk, Haarlem]"
12,"[Deventer, Zutphen, Apeldoorn, Zutphen, Dieren, Zutphen, Deventer]"
13,"[Amsterdam Amstel, Hilversum, Utrecht Centraal, Amsterdam Amstel, Amsterdam Zuid, Amsterdam Amstel, Amsterdam Centraal, Amsterdam Sloterdijk, Haarlem]"
14,"[Leiden Centraal, Schiphol Airport, Leiden Centraal, Den Haag HS, Delft, Den Haag HS, Delft, Den Haag Centraal, Gouda, Rotterdam Alexander, Gouda]"
15,"[Etten-Leur, Breda, Dordrecht, Roosendaal, Dordrecht, Rotterdam Centraal, Rotterdam Alexander, Gouda, Alphen a/d Rijn]"
score,4176.606741573034
connections missing,[['Amsterdam Amstel': 'Almere Centrum']: ['Amsterdam Zuid': 'Schiphol Airport']: ['Assen': 'Zwolle']: ['Castricum': 'Alkmaar']: ['Den Haag HS': 'Gouda']: ['Den Haag Laan v NOI': 'Leiden Centraal']: ['Eindhoven': 's-Hertogenbosch']: ['Groningen': 'Assen']: ['Heerenveen': 'Steenwijk']: ['Helmond': 'Venlo']: ['Hilversum': 'Almere Centrum']: ['Leeuwarden': 'Heerenveen']: ['Leeuwarden': 'Groningen']: ['Roosendaal': 'Vlissingen']: ['Utrecht Centraal': 'Ede-Wageningen']]