train,stations
0,"[Heerlen, Sittard, Maastricht, Sittard, Roermond, Sittard, Roermond, Weert]"
1,"[s-Hertogenbosch, Oss, Nijmegen, Arnhem Centraal, Nijmegen, Oss, s-Hertogenbosch, Oss, s-Hertogenbosch, Tilburg, Breda]"
2,"[Nijmegen, Arnhem Centraal, Dieren, Arnhem Centraal, Ede-Wageningen, Utrecht Centraal, Amsterdam Amstel, Amsterdam Centraal, Almere Centrum, Lelystad Centrum]"
3,"[Schiphol Airport, Leiden Centraal, Alphen a/d Rijn, Gouda, Rotterdam Alexander, Gouda, Den Haag Centraal, Leiden Centraal, Den Haag Centraal, Delft, Schiedam Centrum, Rotterdam Centraal, Schiedam Centrum, Rotterdam Centraal]"
4,"[Delft, Schiedam Centrum, Rotterdam Centraal, Schiedam Centrum, Rotterdam Centraal]"
5,"[Etten-Leur, Breda, Dordrecht, Rotterdam Blaak, Dordrecht, Rotterdam Centraal, Rotterdam Alexander, Rotterdam Centraal, Rotterdam Alexander, Rotterdam Blaak, Schiedam Centrum, Rotterdam Centraal, Rotterdam Alexander]"
6,"[Utrecht Centraal, Amersfoort, Zwolle, Deventer, Zwolle, Deventer]"
7,"[Leiden Centraal, Den Haag HS, Delft, Schiedam Centrum, Delft, Den Haag HS, Gouda, Den Haag Laan v NOI, Leiden Centraal, Den Haag Centraal]"
8,"[Alkmaar, Hoorn, Zaandam, Amsterdam Sloterdijk, Haarlem, Beverwijk, Haarlem, Heemstede-Aerdenhout, Leiden Centraal, Schiphol Airport]"
score,3928.4943820224717
connections missing,[['Alkmaar': 'Den Helder']: ['Almelo': 'Hengelo']: ['Amsterdam Amstel': 'Almere Centrum']: ['Amsterdam Amstel': 'Hilversum']: ['Amsterdam Centraal': 'Amsterdam Sloterdijk']: ['Amsterdam Zuid': 'Amsterdam Sloterdijk']: ['Apeldoorn': 'Amersfoort']: ['Apeldoorn': 'Zutphen']: ['Assen': 'Zwolle']: ['Beverwijk': 'Castricum']: ['Castricum': 'Alkmaar']: ['Deventer': 'Apeldoorn']: ['Deventer': 'Almelo']: ['Eindhoven': 's-Hertogenbosch']: ['Eindhoven': 'Tilburg']: ['Groningen': 'Assen']: ['Heerenveen': 'Steenwijk']: ['Helmond': 'Venlo']: ['Hengelo': 'Enschede']: ['Hilversum': 'Almere Centrum']: ['Leeuwarden': 'Heerenveen']: ['Leeuwarden': 'Groningen']: ['Steenwijk': 'Zwolle']: ['Utrecht Centraal': 'Amsterdam Centraal']: ['Utrecht Centraal': 'Hilversum']: ['Utrecht Centraal': 'Alphen a/d Rijn']: ['Utrecht Centraal': 'Schiphol Airport']: ['Utrecht Centraal': 's-Hertogenbosch']: ['Zaandam': 'Castricum']: ['Zaandam': 'Beverwijk']: ['Zwolle': 'Almelo']: ['s-Hertogenbosch': 'Tilburg']]