train,stations
0,"[Nijmegen, Oss, s-Hertogenbosch, Tilburg, Eindhoven, Weert, Eindhoven]"
1,"[Steenwijk, Zwolle, Deventer, Apeldoorn, Zutphen, Deventer, Almelo, Hengelo, Enschede, Hengelo, Enschede]"
2,"[Etten-Leur, Breda, Tilburg, Eindhoven, s-Hertogenbosch, Oss, s-Hertogenbosch, Tilburg, Eindhoven]"
3,"[Haarlem, Beverwijk, Haarlem, Heemstede-Aerdenhout, Haarlem, Heemstede-Aerdenhout, Leiden Centraal, Den Haag Laan v NOI, Delft, Den Haag Laan v NOI, Delft, Den Haag HS, Leiden Centraal]"
4,"[Rotterdam Blaak, Rotterdam Alexander, Gouda, Den Haag Centraal, Leiden Centraal]"
5,"[Roosendaal, Dordrecht, Rotterdam Blaak, Rotterdam Alexander, Gouda, Den Haag Laan v NOI, Leiden Centraal]"
6,"[Rotterdam Centraal, Rotterdam Alexander, Rotterdam Blaak, Schiedam Centrum, Rotterdam Blaak, Rotterdam Alexander, Rotterdam Centraal, Schiedam Centrum, Rotterdam Blaak, Dordrecht]"
7,"[Leiden Centraal, Den Haag Centraal, Delft, Den Haag Laan v NOI, Leiden Centraal, Alphen a/d Rijn, Leiden Centraal, Den Haag Laan v NOI, Delft, Den Haag Laan v NOI, Leiden Centraal, Schiphol Airport, Amsterdam Zuid, Amsterdam Sloterdijk, Amsterdam Centraal, Almere Centrum]"
8,"[Zutphen, Dieren, Arnhem Centraal, Dieren, Zutphen, Dieren, Zutphen, Dieren, Arnhem Centraal, Nijmegen, Arnhem Centraal, Dieren, Zutphen, Dieren, Zutphen, Dieren, Zutphen]"
9,"[Vlissingen, Roosendaal, Etten-Leur, Roosendaal, Dordrecht, Rotterdam Centraal, Schiedam Centrum, Delft, Den Haag HS, Delft]"
10,"[Beverwijk, Zaandam, Castricum, Beverwijk, Castricum, Alkmaar]"
11,"[Hilversum, Amsterdam Amstel, Amsterdam Centraal, Amsterdam Sloterdijk, Amsterdam Zuid, Amsterdam Sloterdijk, Amsterdam Centraal, Amsterdam Amstel, Amsterdam Zuid, Amsterdam Sloterdijk, Amsterdam Centraal, Amsterdam Sloterdijk, Zaandam, Amsterdam Sloterdijk, Haarlem, Amsterdam Sloterdijk]"
12,"[Den Helder, Alkmaar]"
score,4505.0
connections missing,[['Almere Centrum': 'Lelystad Centrum']: ['Amsterdam Amstel': 'Almere Centrum']: ['Apeldoorn': 'Amersfoort']: ['Assen': 'Zwolle']: ['Gouda': 'Alphen a/d Rijn']: ['Groningen': 'Assen']: ['Heerenveen': 'Steenwijk']: ['Hilversum': 'Almere Centrum']: ['Leeuwarden': 'Heerenveen']: ['Leeuwarden': 'Groningen']: ['Maastricht': 'Sittard']: ['Sittard': 'Heerlen']: ['Sittard': 'Roermond']: ['Zwolle': 'Amersfoort']: ['Zwolle': 'Almelo']]