train,stations
1,"[Amsterdam Amstel, Almere Centrum, Hilversum, Utrecht Centraal, Alphen a/d Rijn, Gouda, Den Haag HS, Leiden Centraal, Heemstede-Aerdenhout, Haarlem, Heemstede-Aerdenhout]"
3,"[Amersfoort, Utrecht Centraal, Gouda, Alphen a/d Rijn, Leiden Centraal, Den Haag Laan v NOI, Leiden Centraal, Den Haag Centraal, Gouda]"
5,"[Enschede, Hengelo, Enschede, Hengelo, Almelo, Deventer, Zwolle, Almelo, Hengelo, Enschede, Hengelo]"
7,"[Schiphol Airport, Utrecht Centraal, Amsterdam Amstel, Utrecht Centraal, Ede-Wageningen, Arnhem Centraal, Dieren, Arnhem Centraal, Nijmegen, Oss, s-Hertogenbosch, Oss]"
8,"[Hilversum, Amsterdam Amstel, Amsterdam Centraal, Amsterdam Amstel, Amsterdam Zuid, Schiphol Airport, Amsterdam Zuid, Amsterdam Amstel, Amsterdam Zuid, Amsterdam Sloterdijk, Haarlem, Beverwijk, Castricum, Alkmaar]"
10,"[Den Haag Centraal, Leiden Centraal, Den Haag Centraal, Delft, Den Haag Laan v NOI, Gouda, Alphen a/d Rijn, Gouda, Rotterdam Alexander, Rotterdam Blaak, Schiedam Centrum, Rotterdam Centraal, Rotterdam Alexander]"
11,"[Almere Centrum, Lelystad Centrum, Almere Centrum, Amsterdam Centraal, Amsterdam Amstel, Hilversum, Utrecht Centraal, Amsterdam Centraal, Amsterdam Sloterdijk, Haarlem]"
12,"[Apeldoorn, Amersfoort, Apeldoorn, Deventer, Zutphen, Dieren, Zutphen, Apeldoorn, Deventer, Almelo]"
13,"[Den Haag HS, Delft, Den Haag Centraal, Leiden Centraal, Den Haag Laan v NOI, Delft, Den Haag Centraal, Leiden Centraal, Heemstede-Aerdenhout, Haarlem, Heemstede-Aerdenhout, Leiden Centraal]"
14,"[Etten-Leur, Roosendaal, Dordrecht, Rotterdam Centraal, Schiedam Centrum, Rotterdam Blaak, Schiedam Centrum, Rotterdam Centraal, Rotterdam Alexander, Rotterdam Centraal, Dordrecht, Roosendaal, Etten-Leur]"
15,"[Heemstede-Aerdenhout, Haarlem, Amsterdam Sloterdijk, Amsterdam Centraal, Amsterdam Amstel, Amsterdam Centraal, Utrecht Centraal, s-Hertogenbosch]"
16,"[Tilburg, s-Hertogenbosch, Eindhoven, Tilburg, s-Hertogenbosch, Oss, Nijmegen, Oss, s-Hertogenbosch, Tilburg, Breda, Etten-Leur, Breda]"
17,"[Schiedam Centrum, Rotterdam Centraal, Dordrecht, Breda, Dordrecht, Rotterdam Blaak, Dordrecht, Roosendaal, Etten-Leur]"
18,"[Beverwijk, Castricum, Alkmaar, Hoorn, Zaandam, Amsterdam Sloterdijk, Amsterdam Zuid]"
19,"[Tilburg, s-Hertogenbosch, Oss, s-Hertogenbosch, Tilburg, Breda, Etten-Leur, Breda, Tilburg, s-Hertogenbosch, Utrecht Centraal]"
21,"[Zwolle, Amersfoort, Utrecht Centraal, Ede-Wageningen, Arnhem Centraal, Dieren, Arnhem Centraal, Nijmegen, Arnhem Centraal]"
23,"[Venlo, Helmond, Eindhoven, Helmond, Eindhoven, Weert, Roermond, Sittard, Maastricht, Sittard]"
29,"[Alkmaar, Den Helder, Alkmaar, Hoorn, Alkmaar, Castricum, Zaandam, Beverwijk]"
31,"[Schiphol Airport, Leiden Centraal, Alphen a/d Rijn, Gouda, Alphen a/d Rijn, Gouda, Den Haag Centraal, Delft, Schiedam Centrum, Rotterdam Centraal, Schiedam Centrum, Delft]"
34,"[Assen, Zwolle, Steenwijk, Heerenveen, Leeuwarden]"
score,5033.114942528737
connections missing,[['Roosendaal': 'Vlissingen']: ['Sittard': 'Heerlen']]